delegator_rewards.csv
Validator,epoch,earned
0xefa5f0435f230579dc95f219a1a8929f91b98cba727d7c1de8b10738be431ade,1,5.16593E-05
0xefa5f0435f230579dc95f219a1a8929f91b98cba727d7c1de8b10738be431ade,2,5.06E-07
0xefa5f0435f230579dc95f219a1a8929f91b98cba727d7c1de8b10738be431ade,3,1.02234E-06
0xefa5f0435f230579dc95f219a1a8929f91b98cba727d7c1de8b10738be431ade,4,0
0xefa5f0435f230579dc95f219a1a8929f91b98cba727d7c1de8b10738be431ade,5,0
0xefa5f0435f230579dc95f219a1a8929f91b98cba727d7c1de8b10738be431ade,6,5.11E-07
0xefa5f0435f230579dc95f219a1a8929f91b98cba727d7c1de8b10738be431ade,7,5.11E-07
0xefa5f0435f230579dc95f219a1a8929f91b98cba727d7c1de8b10738be431ade,8,0
0xefa5f0435f230579dc95f219a1a8929f91b98cba727d7c1de8b10738be431ade,9,0
0xefa5f0435f230579dc95f219a1a8929f91b98cba727d7c1de8b10738be431ade,10,0
0xefa5f0435f230579dc95f219a1a8929f91b98cba727d7c1de8b10738be431ade,11,0
0xefa5f0435f230579dc95f219a1a8929f91b98cba727d7c1de8b10738be431ade,12,3.06701E-06
0xefa5f0435f230579dc95f219a1a8929f91b98cba727d7c1de8b10738be431ade,13,6.13402E-06
0xefa5f0435f230579dc95f219a1a8929f91b98cba727d7c1de8b10738be431ade,14,1.5335E-06
0xefa5f0435f230579dc95f219a1a8929f91b98cba727d7c1de8b10738be431ade,15,0.00077008
0xefa5f0435f230579dc95f219a1a8929f91b98cba727d7c1de8b10738be431ade,16,0.000631293
0xefa5f0435f230579dc95f219a1a8929f91b98cba727d7c1de8b10738be431ade,17,0.000349813
0xefa5f0435f230579dc95f219a1a8929f91b98cba727d7c1de8b10738be431ade,18,5.48628E-05
0xefa5f0435f230579dc95f219a1a8929f91b98cba727d7c1de8b10738be431ade,19,0.001146483
0xefa5f0435f230579dc95f219a1a8929f91b98cba727d7c1de8b10738be431ade,20,555.2845623
0xefa5f0435f230579dc95f219a1a8929f91b98cba727d7c1de8b10738be431ade,21,559.4376528
0xefa5f0435f230579dc95f219a1a8929f91b98cba727d7c1de8b10738be431ade,22,555.8264339
0xefa5f0435f230579dc95f219a1a8929f91b98cba727d7c1de8b10738be431ade,23,514.7289076
0xefa5f0435f230579dc95f219a1a8929f91b98cba727d7c1de8b10738be431ade,24,493.0541027
0xefa5f0435f230579dc95f219a1a8929f91b98cba727d7c1de8b10738be431ade,25,469.7489263
0xefa5f0435f230579dc95f219a1a8929f91b98cba727d7c1de8b10738be431ade,26,434.794142
0xefa5f0435f230579dc95f219a1a8929f91b98cba727d7c1de8b10738be431ade,27,409.0896582
0xefa5f0435f230579dc95f219a1a8929f91b98cba727d7c1de8b10738be431ade,28,406.0751052
0xefa5f0435f230579dc95f219a1a8929f91b98cba727d7c1de8b10738be431ade,29,397.5223204
0xefa5f0435f230579dc95f219a1a8929f91b98cba727d7c1de8b10738be431ade,30,397.2500712
0xefa5f0435f230579dc95f219a1a8929f91b98cba727d7c1de8b10738be431ade,31,395.7283745
0xefa5f0435f230579dc95f219a1a8929f91b98cba727d7c1de8b10738be431ade,32,396.4344187
0xefa5f0435f230579dc95f219a1a8929f91b98cba727d7c1de8b10738be431ade,33,395.7726967
0xefa5f0435f230579dc95f219a1a8929f91b98cba727d7c1de8b10738be431ade,34,386.5990293
0xefa5f0435f230579dc95f219a1a8929f91b98cba727d7c1de8b10738be431ade,35,369.8838704
0xefa5f0435f230579dc95f219a1a8929f91b98cba727d7c1de8b10738be431ade,36,367.0356234
0xefa5f0435f230579dc95f219a1a8929f91b98cba727d7c1de8b10738be431ade,37,364.3468742
0xefa5f0435f230579dc95f219a1a8929f91b98cba727d7c1de8b10738be431ade,38,363.980839
0xefa5f0435f230579dc95f219a1a8929f91b98cba727d7c1de8b10738be431ade,39,362.3142631
0xefa5f0435f230579dc95f219a1a8929f91b98cba727d7c1de8b10738be431ade,40,360.3837727
0xefa5f0435f230579dc95f219a1a8929f91b98cba727d7c1de8b10738be431ade,41,359.2769064
0xefa5f0435f230579dc95f219a1a8929f91b98cba727d7c1de8b10738be431ade,42,357.0101766
0xefa5f0435f230579dc95f219a1a8929f91b98cba727d7c1de8b10738be431ade,43,356.9763343
0xefa5f0435f230579dc95f219a1a8929f91b98cba727d7c1de8b10738be431ade,44,356.9619236
0xefa5f0435f230579dc95f219a1a8929f91b98cba727d7c1de8b10738be431ade,45,356.9515147
0xefa5f0435f230579dc95f219a1a8929f91b98cba727d7c1de8b10738be431ade,46,356.9770537
0xefa5f0435f230579dc95f219a1a8929f91b98cba727d7c1de8b10738be431ade,47,356.95953
0xefa5f0435f230579dc95f219a1a8929f91b98cba727d7c1de8b10738be431ade,48,355.8818178
0xefa5f0435f230579dc95f219a1a8929f91b98cba727d7c1de8b10738be431ade,49,355.8479733
0xefa5f0435f230579dc95f219a1a8929f91b98cba727d7c1de8b10738be431ade,50,355.8460738
0xefa5f0435f230579dc95f219a1a8929f91b98cba727d7c1de8b10738be431ade,51,355.877614
0xefa5f0435f230579dc95f219a1a8929f91b98cba727d7c1de8b10738be431ade,52,355.9324621
0xefa5f0435f230579dc95f219a1a8929f91b98cba727d7c1de8b10738be431ade,53,355.9428239
0xefa5f0435f230579dc95f219a1a8929f91b98cba727d7c1de8b10738be431ade,54,354.7704983
0xefa5f0435f230579dc95f219a1a8929f91b98cba727d7c1de8b10738be431ade,55,353.6582238
0xefa5f0435f230579dc95f219a1a8929f91b98cba727d7c1de8b10738be431ade,56,353.666971
0xefa5f0435f230579dc95f219a1a8929f91b98cba727d7c1de8b10738be431ade,57,353.622678
0xefa5f0435f230579dc95f219a1a8929f91b98cba727d7c1de8b10738be431ade,58,352.5036198
0xefa5f0435f230579dc95f219a1a8929f91b98cba727d7c1de8b10738be431ade,59,352.4695667
0xefa5f0435f230579dc95f219a1a8929f91b98cba727d7c1de8b10738be431ade,60,352.5756877
0xefa5f0435f230579dc95f219a1a8929f91b98cba727d7c1de8b10738be431ade,61,352.5052973
0xefa5f0435f230579dc95f219a1a8929f91b98cba727d7c1de8b10738be431ade,62,352.4842954
0xefa5f0435f230579dc95f219a1a8929f91b98cba727d7c1de8b10738be431ade,63,352.5046973
0xefa5f0435f230579dc95f219a1a8929f91b98cba727d7c1de8b10738be431ade,64,375.8954881
0xefa5f0435f230579dc95f219a1a8929f91b98cba727d7c1de8b10738be431ade,65,375.8934975
0xefa5f0435f230579dc95f219a1a8929f91b98cba727d7c1de8b10738be431ade,66,375.8757813
0xefa5f0435f230579dc95f219a1a8929f91b98cba727d7c1de8b10738be431ade,67,374.365547
0xefa5f0435f230579dc95f219a1a8929f91b98cba727d7c1de8b10738be431ade,68,375.8839081
0xefa5f0435f230579dc95f219a1a8929f91b98cba727d7c1de8b10738be431ade,69,373.0407225
0xefa5f0435f230579dc95f219a1a8929f91b98cba727d7c1de8b10738be431ade,70,373.02341
0xefa5f0435f230579dc95f219a1a8929f91b98cba727d7c1de8b10738be431ade,71,372.8871676
0xefa5f0435f230579dc95f219a1a8929f91b98cba727d7c1de8b10738be431ade,72,363.7808783
0xefa5f0435f230579dc95f219a1a8929f91b98cba727d7c1de8b10738be431ade,73,353.1926021
0xefa5f0435f230579dc95f219a1a8929f91b98cba727d7c1de8b10738be431ade,74,353.2200867
0xefa5f0435f230579dc95f219a1a8929f91b98cba727d7c1de8b10738be431ade,75,353.1938766
0xefa5f0435f230579dc95f219a1a8929f91b98cba727d7c1de8b10738be431ade,76,353.1267188
0xefa5f0435f230579dc95f219a1a8929f91b98cba727d7c1de8b10738be431ade,77,353.4116716
0xefa5f0435f230579dc95f219a1a8929f91b98cba727d7c1de8b10738be431ade,78,353.32585
0xefa5f0435f230579dc95f219a1a8929f91b98cba727d7c1de8b10738be431ade,79,367.3087577
0xefa5f0435f230579dc95f219a1a8929f91b98cba727d7c1de8b10738be431ade,80,353.6956296
0xefa5f0435f230579dc95f219a1a8929f91b98cba727d7c1de8b10738be431ade,81,353.6621847
0xefa5f0435f230579dc95f219a1a8929f91b98cba727d7c1de8b10738be431ade,82,355.2110696
0xefa5f0435f230579dc95f219a1a8929f91b98cba727d7c1de8b10738be431ade,83,353.6660187
0xefa5f0435f230579dc95f219a1a8929f91b98cba727d7c1de8b10738be431ade,84,353.6711675
0xefa5f0435f230579dc95f219a1a8929f91b98cba727d7c1de8b10738be431ade,85,354.641778
0xefa5f0435f230579dc95f219a1a8929f91b98cba727d7c1de8b10738be431ade,86,356.3247297
0xefa5f0435f230579dc95f219a1a8929f91b98cba727d7c1de8b10738be431ade,87,356.4516943
0xefa5f0435f230579dc95f219a1a8929f91b98cba727d7c1de8b10738be431ade,88,356.5665939
0xefa5f0435f230579dc95f219a1a8929f91b98cba727d7c1de8b10738be431ade,89,356.6657254
0xefa5f0435f230579dc95f219a1a8929f91b98cba727d7c1de8b10738be431ade,90,355.3493752
0xefa5f0435f230579dc95f219a1a8929f91b98cba727d7c1de8b10738be431ade,91,357.7886586
0xefa5f0435f230579dc95f219a1a8929f91b98cba727d7c1de8b10738be431ade,92,361.7063226
0xefa5f0435f230579dc95f219a1a8929f91b98cba727d7c1de8b10738be431ade,93,361.6619583
0xefa5f0435f230579dc95f219a1a8929f91b98cba727d7c1de8b10738be431ade,94,362.6024465
0xefa5f0435f230579dc95f219a1a8929f91b98cba727d7c1de8b10738be431ade,95,362.4872266
0xefa5f0435f230579dc95f219a1a8929f91b98cba727d7c1de8b10738be431ade,96,361.9122946
0xefa5f0435f230579dc95f219a1a8929f91b98cba727d7c1de8b10738be431ade,97,362.4486463
0xefa5f0435f230579dc95f219a1a8929f91b98cba727d7c1de8b10738be431ade,98,365.1777737
0xefa5f0435f230579dc95f219a1a8929f91b98cba727d7c1de8b10738be431ade,99,366.9896319
0xefa5f0435f230579dc95f219a1a8929f91b98cba727d7c1de8b10738be431ade,100,367.4002291
0xefa5f0435f230579dc95f219a1a8929f91b98cba727d7c1de8b10738be431ade,101,368.5512999
0xefa5f0435f230579dc95f219a1a8929f91b98cba727d7c1de8b10738be431ade,102,368.84551
0xefa5f0435f230579dc95f219a1a8929f91b98cba727d7c1de8b10738be431ade,103,371.1196907
0xefa5f0435f230579dc95f219a1a8929f91b98cba727d7c1de8b10738be431ade,104,370.1542159
0xefa5f0435f230579dc95f219a1a8929f91b98cba727d7c1de8b10738be431ade,105,374.4293528
0xefa5f0435f230579dc95f219a1a8929f91b98cba727d7c1de8b10738be431ade,106,367.9959449
0xefa5f0435f230579dc95f219a1a8929f91b98cba727d7c1de8b10738be431ade,107,355.5608792
0xefa5f0435f230579dc95f219a1a8929f91b98cba727d7c1de8b10738be431ade,108,355.5550707
0xefa5f0435f230579dc95f219a1a8929f91b98cba727d7c1de8b10738be431ade,109,355.6091208
0xefa5f0435f230579dc95f219a1a8929f91b98cba727d7c1de8b10738be431ade,110,319.9658214
0xefa5f0435f230579dc95f219a1a8929f91b98cba727d7c1de8b10738be431ade,111,319.8616434
0xefa5f0435f230579dc95f219a1a8929f91b98cba727d7c1de8b10738be431ade,112,319.8629039
0xefa5f0435f230579dc95f219a1a8929f91b98cba727d7c1de8b10738be431ade,113,319.8508771
0xefa5f0435f230579dc95f219a1a8929f91b98cba727d7c1de8b10738be431ade,114,319.8236277
0xefa5f0435f230579dc95f219a1a8929f91b98cba727d7c1de8b10738be431ade,115,319.831529
0xefa5f0435f230579dc95f219a1a8929f91b98cba727d7c1de8b10738be431ade,116,319.8069601
0xefa5f0435f230579dc95f219a1a8929f91b98cba727d7c1de8b10738be431ade,117,319.8182563
0xefa5f0435f230579dc95f219a1a8929f91b98cba727d7c1de8b10738be431ade,118,319.8744846
0xefa5f0435f230579dc95f219a1a8929f91b98cba727d7c1de8b10738be431ade,119,319.885646
0xefa5f0435f230579dc95f219a1a8929f91b98cba727d7c1de8b10738be431ade,120,318.4996743
0xefa5f0435f230579dc95f219a1a8929f91b98cba727d7c1de8b10738be431ade,121,319.9683481
0xefa5f0435f230579dc95f219a1a8929f91b98cba727d7c1de8b10738be431ade,122,319.9977201
0xefa5f0435f230579dc95f219a1a8929f91b98cba727d7c1de8b10738be431ade,123,319.9362112
0xefa5f0435f230579dc95f219a1a8929f91b98cba727d7c1de8b10738be431ade,124,318.6274332
0xefa5f0435f230579dc95f219a1a8929f91b98cba727d7c1de8b10738be431ade,125,318.5870449
0xefa5f0435f230579dc95f219a1a8929f91b98cba727d7c1de8b10738be431ade,126,320.0056109
0xefa5f0435f230579dc95f219a1a8929f91b98cba727d7c1de8b10738be431ade,127,320.131918
0xefa5f0435f230579dc95f219a1a8929f91b98cba727d7c1de8b10738be431ade,128,320.378419
0xefa5f0435f230579dc95f219a1a8929f91b98cba727d7c1de8b10738be431ade,129,320.3938652
0xefa5f0435f230579dc95f219a1a8929f91b98cba727d7c1de8b10738be431ade,130,320.2017582
0xefa5f0435f230579dc95f219a1a8929f91b98cba727d7c1de8b10738be431ade,131,320.1773341
0xefa5f0435f230579dc95f219a1a8929f91b98cba727d7c1de8b10738be431ade,132,320.1329157
0xefa5f0435f230579dc95f219a1a8929f91b98cba727d7c1de8b10738be431ade,133,320.0938481
0xefa5f0435f230579dc95f219a1a8929f91b98cba727d7c1de8b10738be431ade,134,320.0441882
0xefa5f0435f230579dc95f219a1a8929f91b98cba727d7c1de8b10738be431ade,135,320.0248315
0xefa5f0435f230579dc95f219a1a8929f91b98cba727d7c1de8b10738be431ade,136,320.2547369
0xefa5f0435f230579dc95f219a1a8929f91b98cba727d7c1de8b10738be431ade,137,320.3964905
0xefa5f0435f230579dc95f219a1a8929f91b98cba727d7c1de8b10738be431ade,138,320.177986
0xefa5f0435f230579dc95f219a1a8929f91b98cba727d7c1de8b10738be431ade,139,320.354592
,total earned,43390.79328
