validator(0x68cf08c4ef8b0462d8c3879f4e26cc371fbddd844650d0c41a9c3badc8104609).csv
Validator,epoch,earned,active
0x68cf08c4ef8b0462d8c3879f4e26cc371fbddd844650d0c41a9c3badc8104609,0,NaN,active
0x68cf08c4ef8b0462d8c3879f4e26cc371fbddd844650d0c41a9c3badc8104609,1,0.001856829,active
0x68cf08c4ef8b0462d8c3879f4e26cc371fbddd844650d0c41a9c3badc8104609,2,1.82042E-05,active
0x68cf08c4ef8b0462d8c3879f4e26cc371fbddd844650d0c41a9c3badc8104609,3,3.64084E-05,active
0x68cf08c4ef8b0462d8c3879f4e26cc371fbddd844650d0c41a9c3badc8104609,4,0,active
0x68cf08c4ef8b0462d8c3879f4e26cc371fbddd844650d0c41a9c3badc8104609,5,0,active
0x68cf08c4ef8b0462d8c3879f4e26cc371fbddd844650d0c41a9c3badc8104609,6,1.8362E-05,active
0x68cf08c4ef8b0462d8c3879f4e26cc371fbddd844650d0c41a9c3badc8104609,7,1.8362E-05,active
0x68cf08c4ef8b0462d8c3879f4e26cc371fbddd844650d0c41a9c3badc8104609,8,0,active
0x68cf08c4ef8b0462d8c3879f4e26cc371fbddd844650d0c41a9c3badc8104609,9,0,active
0x68cf08c4ef8b0462d8c3879f4e26cc371fbddd844650d0c41a9c3badc8104609,10,0,active
0x68cf08c4ef8b0462d8c3879f4e26cc371fbddd844650d0c41a9c3badc8104609,11,0,active
0x68cf08c4ef8b0462d8c3879f4e26cc371fbddd844650d0c41a9c3badc8104609,12,0.000110172,active
0x68cf08c4ef8b0462d8c3879f4e26cc371fbddd844650d0c41a9c3badc8104609,13,0.000220344,active
0x68cf08c4ef8b0462d8c3879f4e26cc371fbddd844650d0c41a9c3badc8104609,14,5.5086E-05,active
0x68cf08c4ef8b0462d8c3879f4e26cc371fbddd844650d0c41a9c3badc8104609,15,0.027662527,active
0x68cf08c4ef8b0462d8c3879f4e26cc371fbddd844650d0c41a9c3badc8104609,16,0.022677098,active
0x68cf08c4ef8b0462d8c3879f4e26cc371fbddd844650d0c41a9c3badc8104609,17,0.012761585,active
0x68cf08c4ef8b0462d8c3879f4e26cc371fbddd844650d0c41a9c3badc8104609,18,0.001974187,active
0x68cf08c4ef8b0462d8c3879f4e26cc371fbddd844650d0c41a9c3badc8104609,19,0.041441529,active
0x68cf08c4ef8b0462d8c3879f4e26cc371fbddd844650d0c41a9c3badc8104609,20,19823.64177,active
0x68cf08c4ef8b0462d8c3879f4e26cc371fbddd844650d0c41a9c3badc8104609,21,19796.29689,active
0x68cf08c4ef8b0462d8c3879f4e26cc371fbddd844650d0c41a9c3badc8104609,22,20123.977,active
0x68cf08c4ef8b0462d8c3879f4e26cc371fbddd844650d0c41a9c3badc8104609,23,20003.72088,active
0x68cf08c4ef8b0462d8c3879f4e26cc371fbddd844650d0c41a9c3badc8104609,24,18513.44136,active
0x68cf08c4ef8b0462d8c3879f4e26cc371fbddd844650d0c41a9c3badc8104609,25,17724.03555,active
0x68cf08c4ef8b0462d8c3879f4e26cc371fbddd844650d0c41a9c3badc8104609,26,16899.66131,active
0x68cf08c4ef8b0462d8c3879f4e26cc371fbddd844650d0c41a9c3badc8104609,27,15629.23169,active
0x68cf08c4ef8b0462d8c3879f4e26cc371fbddd844650d0c41a9c3badc8104609,28,14755.97583,active
0x68cf08c4ef8b0462d8c3879f4e26cc371fbddd844650d0c41a9c3badc8104609,29,14572.56738,active
0x68cf08c4ef8b0462d8c3879f4e26cc371fbddd844650d0c41a9c3badc8104609,30,14297.20867,active
0x68cf08c4ef8b0462d8c3879f4e26cc371fbddd844650d0c41a9c3badc8104609,31,14263.59384,active
0x68cf08c4ef8b0462d8c3879f4e26cc371fbddd844650d0c41a9c3badc8104609,32,14282.19628,active
0x68cf08c4ef8b0462d8c3879f4e26cc371fbddd844650d0c41a9c3badc8104609,33,14253.03072,active
0x68cf08c4ef8b0462d8c3879f4e26cc371fbddd844650d0c41a9c3badc8104609,34,14243.15589,active
0x68cf08c4ef8b0462d8c3879f4e26cc371fbddd844650d0c41a9c3badc8104609,35,13898.01288,active
0x68cf08c4ef8b0462d8c3879f4e26cc371fbddd844650d0c41a9c3badc8104609,36,13390.79905,active
0x68cf08c4ef8b0462d8c3879f4e26cc371fbddd844650d0c41a9c3badc8104609,37,13025.76578,active
0x68cf08c4ef8b0462d8c3879f4e26cc371fbddd844650d0c41a9c3badc8104609,38,12961.74147,active
0x68cf08c4ef8b0462d8c3879f4e26cc371fbddd844650d0c41a9c3badc8104609,39,12935.44151,active
0x68cf08c4ef8b0462d8c3879f4e26cc371fbddd844650d0c41a9c3badc8104609,40,12885.90488,active
0x68cf08c4ef8b0462d8c3879f4e26cc371fbddd844650d0c41a9c3badc8104609,41,12844.93804,active
0x68cf08c4ef8b0462d8c3879f4e26cc371fbddd844650d0c41a9c3badc8104609,42,12802.52413,active
0x68cf08c4ef8b0462d8c3879f4e26cc371fbddd844650d0c41a9c3badc8104609,43,12706.22353,active
0x68cf08c4ef8b0462d8c3879f4e26cc371fbddd844650d0c41a9c3badc8104609,44,12704.94691,active
0x68cf08c4ef8b0462d8c3879f4e26cc371fbddd844650d0c41a9c3badc8104609,45,12702.72582,active
0x68cf08c4ef8b0462d8c3879f4e26cc371fbddd844650d0c41a9c3badc8104609,46,12703.52092,active
0x68cf08c4ef8b0462d8c3879f4e26cc371fbddd844650d0c41a9c3badc8104609,47,12697.64574,active
0x68cf08c4ef8b0462d8c3879f4e26cc371fbddd844650d0c41a9c3badc8104609,48,12717.94232,active
0x68cf08c4ef8b0462d8c3879f4e26cc371fbddd844650d0c41a9c3badc8104609,49,12673.44791,active
0x68cf08c4ef8b0462d8c3879f4e26cc371fbddd844650d0c41a9c3badc8104609,50,12676.08695,active
0x68cf08c4ef8b0462d8c3879f4e26cc371fbddd844650d0c41a9c3badc8104609,51,12675.19858,active
0x68cf08c4ef8b0462d8c3879f4e26cc371fbddd844650d0c41a9c3badc8104609,52,12676.47174,active
0x68cf08c4ef8b0462d8c3879f4e26cc371fbddd844650d0c41a9c3badc8104609,53,12675.70363,active
0x68cf08c4ef8b0462d8c3879f4e26cc371fbddd844650d0c41a9c3badc8104609,54,12679.15545,active
0x68cf08c4ef8b0462d8c3879f4e26cc371fbddd844650d0c41a9c3badc8104609,55,12632.17351,active
0x68cf08c4ef8b0462d8c3879f4e26cc371fbddd844650d0c41a9c3badc8104609,56,12595.64381,active
0x68cf08c4ef8b0462d8c3879f4e26cc371fbddd844650d0c41a9c3badc8104609,57,12593.93871,active
0x68cf08c4ef8b0462d8c3879f4e26cc371fbddd844650d0c41a9c3badc8104609,58,12573.36047,active
0x68cf08c4ef8b0462d8c3879f4e26cc371fbddd844650d0c41a9c3badc8104609,59,12561.53924,active
0x68cf08c4ef8b0462d8c3879f4e26cc371fbddd844650d0c41a9c3badc8104609,60,12565.5238,active
0x68cf08c4ef8b0462d8c3879f4e26cc371fbddd844650d0c41a9c3badc8104609,61,12556.50281,active
0x68cf08c4ef8b0462d8c3879f4e26cc371fbddd844650d0c41a9c3badc8104609,62,12553.08707,active
0x68cf08c4ef8b0462d8c3879f4e26cc371fbddd844650d0c41a9c3badc8104609,63,12569.10547,active
0x68cf08c4ef8b0462d8c3879f4e26cc371fbddd844650d0c41a9c3badc8104609,64,12562.79392,active
0x68cf08c4ef8b0462d8c3879f4e26cc371fbddd844650d0c41a9c3badc8104609,65,13359.05324,active
0x68cf08c4ef8b0462d8c3879f4e26cc371fbddd844650d0c41a9c3badc8104609,66,13359.84597,active
0x68cf08c4ef8b0462d8c3879f4e26cc371fbddd844650d0c41a9c3badc8104609,67,13351.89702,active
0x68cf08c4ef8b0462d8c3879f4e26cc371fbddd844650d0c41a9c3badc8104609,68,13332.82231,active
0x68cf08c4ef8b0462d8c3879f4e26cc371fbddd844650d0c41a9c3badc8104609,69,13360.80798,active
0x68cf08c4ef8b0462d8c3879f4e26cc371fbddd844650d0c41a9c3badc8104609,70,13253.75498,active
0x68cf08c4ef8b0462d8c3879f4e26cc371fbddd844650d0c41a9c3badc8104609,71,13248.533,active
0x68cf08c4ef8b0462d8c3879f4e26cc371fbddd844650d0c41a9c3badc8104609,72,13248.00612,active
0x68cf08c4ef8b0462d8c3879f4e26cc371fbddd844650d0c41a9c3badc8104609,73,12924.50419,active
0x68cf08c4ef8b0462d8c3879f4e26cc371fbddd844650d0c41a9c3badc8104609,74,12559.13324,active
0x68cf08c4ef8b0462d8c3879f4e26cc371fbddd844650d0c41a9c3badc8104609,75,12557.89208,active
0x68cf08c4ef8b0462d8c3879f4e26cc371fbddd844650d0c41a9c3badc8104609,76,12556.85133,active
0x68cf08c4ef8b0462d8c3879f4e26cc371fbddd844650d0c41a9c3badc8104609,77,12569.08394,active
0x68cf08c4ef8b0462d8c3879f4e26cc371fbddd844650d0c41a9c3badc8104609,78,12566.71264,active
0x68cf08c4ef8b0462d8c3879f4e26cc371fbddd844650d0c41a9c3badc8104609,79,12578.47715,active
0x68cf08c4ef8b0462d8c3879f4e26cc371fbddd844650d0c41a9c3badc8104609,80,13050.38171,active
0x68cf08c4ef8b0462d8c3879f4e26cc371fbddd844650d0c41a9c3badc8104609,81,12579.25662,active
0x68cf08c4ef8b0462d8c3879f4e26cc371fbddd844650d0c41a9c3badc8104609,82,12579.20351,active
0x68cf08c4ef8b0462d8c3879f4e26cc371fbddd844650d0c41a9c3badc8104609,83,12631.48066,active
0x68cf08c4ef8b0462d8c3879f4e26cc371fbddd844650d0c41a9c3badc8104609,84,12583.6868,active
0x68cf08c4ef8b0462d8c3879f4e26cc371fbddd844650d0c41a9c3badc8104609,85,12617.94178,active
0x68cf08c4ef8b0462d8c3879f4e26cc371fbddd844650d0c41a9c3badc8104609,86,12670.56568,active
0x68cf08c4ef8b0462d8c3879f4e26cc371fbddd844650d0c41a9c3badc8104609,87,12675.01085,active
0x68cf08c4ef8b0462d8c3879f4e26cc371fbddd844650d0c41a9c3badc8104609,88,12667.94811,active
0x68cf08c4ef8b0462d8c3879f4e26cc371fbddd844650d0c41a9c3badc8104609,89,12676.59795,active
0x68cf08c4ef8b0462d8c3879f4e26cc371fbddd844650d0c41a9c3badc8104609,90,12673.47594,active
0x68cf08c4ef8b0462d8c3879f4e26cc371fbddd844650d0c41a9c3badc8104609,91,12702.27903,active
0x68cf08c4ef8b0462d8c3879f4e26cc371fbddd844650d0c41a9c3badc8104609,92,12740.44178,active
0x68cf08c4ef8b0462d8c3879f4e26cc371fbddd844650d0c41a9c3badc8104609,93,12850.41074,active
0x68cf08c4ef8b0462d8c3879f4e26cc371fbddd844650d0c41a9c3badc8104609,94,12928.12681,active
0x68cf08c4ef8b0462d8c3879f4e26cc371fbddd844650d0c41a9c3badc8104609,95,12923.82017,active
0x68cf08c4ef8b0462d8c3879f4e26cc371fbddd844650d0c41a9c3badc8104609,96,12958.25809,active
0x68cf08c4ef8b0462d8c3879f4e26cc371fbddd844650d0c41a9c3badc8104609,97,12902.77152,active
0x68cf08c4ef8b0462d8c3879f4e26cc371fbddd844650d0c41a9c3badc8104609,98,13000.2521,active
0x68cf08c4ef8b0462d8c3879f4e26cc371fbddd844650d0c41a9c3badc8104609,99,13009.78346,active
0x68cf08c4ef8b0462d8c3879f4e26cc371fbddd844650d0c41a9c3badc8104609,100,13051.19742,active
0x68cf08c4ef8b0462d8c3879f4e26cc371fbddd844650d0c41a9c3badc8104609,101,13091.56524,active
0x68cf08c4ef8b0462d8c3879f4e26cc371fbddd844650d0c41a9c3badc8104609,102,13157.23367,active
0x68cf08c4ef8b0462d8c3879f4e26cc371fbddd844650d0c41a9c3badc8104609,103,13223.44529,active
0x68cf08c4ef8b0462d8c3879f4e26cc371fbddd844650d0c41a9c3badc8104609,104,13189.05996,active
0x68cf08c4ef8b0462d8c3879f4e26cc371fbddd844650d0c41a9c3badc8104609,105,13233.47568,active
0x68cf08c4ef8b0462d8c3879f4e26cc371fbddd844650d0c41a9c3badc8104609,106,13092.97952,active
0x68cf08c4ef8b0462d8c3879f4e26cc371fbddd844650d0c41a9c3badc8104609,107,12745.16633,active
0x68cf08c4ef8b0462d8c3879f4e26cc371fbddd844650d0c41a9c3badc8104609,108,12660.19195,active
0x68cf08c4ef8b0462d8c3879f4e26cc371fbddd844650d0c41a9c3badc8104609,109,12661.72726,active
0x68cf08c4ef8b0462d8c3879f4e26cc371fbddd844650d0c41a9c3badc8104609,110,11392.03097,active
0x68cf08c4ef8b0462d8c3879f4e26cc371fbddd844650d0c41a9c3badc8104609,111,11387.32562,active
0x68cf08c4ef8b0462d8c3879f4e26cc371fbddd844650d0c41a9c3badc8104609,112,11398.08711,active
0x68cf08c4ef8b0462d8c3879f4e26cc371fbddd844650d0c41a9c3badc8104609,113,11397.45357,active
0x68cf08c4ef8b0462d8c3879f4e26cc371fbddd844650d0c41a9c3badc8104609,114,11396.9701,active
0x68cf08c4ef8b0462d8c3879f4e26cc371fbddd844650d0c41a9c3badc8104609,115,11396.64586,active
0x68cf08c4ef8b0462d8c3879f4e26cc371fbddd844650d0c41a9c3badc8104609,116,11392.64215,active
0x68cf08c4ef8b0462d8c3879f4e26cc371fbddd844650d0c41a9c3badc8104609,117,11391.35574,active
0x68cf08c4ef8b0462d8c3879f4e26cc371fbddd844650d0c41a9c3badc8104609,118,11376.74959,active
0x68cf08c4ef8b0462d8c3879f4e26cc371fbddd844650d0c41a9c3badc8104609,119,11370.69334,active
0x68cf08c4ef8b0462d8c3879f4e26cc371fbddd844650d0c41a9c3badc8104609,120,11368.37842,active
0x68cf08c4ef8b0462d8c3879f4e26cc371fbddd844650d0c41a9c3badc8104609,121,11361.30714,active
0x68cf08c4ef8b0462d8c3879f4e26cc371fbddd844650d0c41a9c3badc8104609,122,11363.82879,active
0x68cf08c4ef8b0462d8c3879f4e26cc371fbddd844650d0c41a9c3badc8104609,123,11361.35716,active
0x68cf08c4ef8b0462d8c3879f4e26cc371fbddd844650d0c41a9c3badc8104609,124,11361.81289,active
0x68cf08c4ef8b0462d8c3879f4e26cc371fbddd844650d0c41a9c3badc8104609,125,11360.57766,active
0x68cf08c4ef8b0462d8c3879f4e26cc371fbddd844650d0c41a9c3badc8104609,126,11361.69545,active
0x68cf08c4ef8b0462d8c3879f4e26cc371fbddd844650d0c41a9c3badc8104609,127,11385.62919,active
0x68cf08c4ef8b0462d8c3879f4e26cc371fbddd844650d0c41a9c3badc8104609,128,11382.05132,active
0x68cf08c4ef8b0462d8c3879f4e26cc371fbddd844650d0c41a9c3badc8104609,129,11381.05179,active
0x68cf08c4ef8b0462d8c3879f4e26cc371fbddd844650d0c41a9c3badc8104609,130,11383.83185,active
0x68cf08c4ef8b0462d8c3879f4e26cc371fbddd844650d0c41a9c3badc8104609,131,11413.14589,active
0x68cf08c4ef8b0462d8c3879f4e26cc371fbddd844650d0c41a9c3badc8104609,132,11412.41582,active
0x68cf08c4ef8b0462d8c3879f4e26cc371fbddd844650d0c41a9c3badc8104609,133,11387.93648,active
0x68cf08c4ef8b0462d8c3879f4e26cc371fbddd844650d0c41a9c3badc8104609,134,11399.14153,active
0x68cf08c4ef8b0462d8c3879f4e26cc371fbddd844650d0c41a9c3badc8104609,135,11383.68615,active
0x68cf08c4ef8b0462d8c3879f4e26cc371fbddd844650d0c41a9c3badc8104609,136,11390.85047,active
0x68cf08c4ef8b0462d8c3879f4e26cc371fbddd844650d0c41a9c3badc8104609,137,11395.96964,active
0x68cf08c4ef8b0462d8c3879f4e26cc371fbddd844650d0c41a9c3badc8104609,138,11387.59088,active
0x68cf08c4ef8b0462d8c3879f4e26cc371fbddd844650d0c41a9c3badc8104609,139,11379.37154,active
0x68cf08c4ef8b0462d8c3879f4e26cc371fbddd844650d0c41a9c3badc8104609,140,11387.92999,active
0x68cf08c4ef8b0462d8c3879f4e26cc371fbddd844650d0c41a9c3badc8104609,141,11396.35692,active
0x68cf08c4ef8b0462d8c3879f4e26cc371fbddd844650d0c41a9c3badc8104609,142,11401.15481,active
0x68cf08c4ef8b0462d8c3879f4e26cc371fbddd844650d0c41a9c3badc8104609,143,11402.88642,active
0x68cf08c4ef8b0462d8c3879f4e26cc371fbddd844650d0c41a9c3badc8104609,144,11411.2204,active
0x68cf08c4ef8b0462d8c3879f4e26cc371fbddd844650d0c41a9c3badc8104609,145,11409.64497,active
0x68cf08c4ef8b0462d8c3879f4e26cc371fbddd844650d0c41a9c3badc8104609,146,11419.16208,active
0x68cf08c4ef8b0462d8c3879f4e26cc371fbddd844650d0c41a9c3badc8104609,147,11428.81346,active
0x68cf08c4ef8b0462d8c3879f4e26cc371fbddd844650d0c41a9c3badc8104609,148,11444.5675,active
0x68cf08c4ef8b0462d8c3879f4e26cc371fbddd844650d0c41a9c3badc8104609,149,11519.5825,active
0x68cf08c4ef8b0462d8c3879f4e26cc371fbddd844650d0c41a9c3badc8104609,150,11517.75098,active
0x68cf08c4ef8b0462d8c3879f4e26cc371fbddd844650d0c41a9c3badc8104609,151,11518.32566,active
0x68cf08c4ef8b0462d8c3879f4e26cc371fbddd844650d0c41a9c3badc8104609,152,11519.04395,active
0x68cf08c4ef8b0462d8c3879f4e26cc371fbddd844650d0c41a9c3badc8104609,153,11510.87139,active
0x68cf08c4ef8b0462d8c3879f4e26cc371fbddd844650d0c41a9c3badc8104609,154,11522.7449,active
0x68cf08c4ef8b0462d8c3879f4e26cc371fbddd844650d0c41a9c3badc8104609,155,11521.67554,active
0x68cf08c4ef8b0462d8c3879f4e26cc371fbddd844650d0c41a9c3badc8104609,156,11510.6736,active
0x68cf08c4ef8b0462d8c3879f4e26cc371fbddd844650d0c41a9c3badc8104609,157,11511.58102,active
0x68cf08c4ef8b0462d8c3879f4e26cc371fbddd844650d0c41a9c3badc8104609,158,11511.01416,active
0x68cf08c4ef8b0462d8c3879f4e26cc371fbddd844650d0c41a9c3badc8104609,159,11513.08118,active
0x68cf08c4ef8b0462d8c3879f4e26cc371fbddd844650d0c41a9c3badc8104609,160,11160.85874,active
0x68cf08c4ef8b0462d8c3879f4e26cc371fbddd844650d0c41a9c3badc8104609,161,11148.33244,active
0x68cf08c4ef8b0462d8c3879f4e26cc371fbddd844650d0c41a9c3badc8104609,162,11189.17121,active
0x68cf08c4ef8b0462d8c3879f4e26cc371fbddd844650d0c41a9c3badc8104609,163,11190.20566,active
0x68cf08c4ef8b0462d8c3879f4e26cc371fbddd844650d0c41a9c3badc8104609,164,11191.85616,active
0x68cf08c4ef8b0462d8c3879f4e26cc371fbddd844650d0c41a9c3badc8104609,165,11187.66067,active
0x68cf08c4ef8b0462d8c3879f4e26cc371fbddd844650d0c41a9c3badc8104609,166,11190.65799,active
0x68cf08c4ef8b0462d8c3879f4e26cc371fbddd844650d0c41a9c3badc8104609,167,10505.62103,active
0x68cf08c4ef8b0462d8c3879f4e26cc371fbddd844650d0c41a9c3badc8104609,168,10543.21486,active
0x68cf08c4ef8b0462d8c3879f4e26cc371fbddd844650d0c41a9c3badc8104609,169,10567.09222,active
0x68cf08c4ef8b0462d8c3879f4e26cc371fbddd844650d0c41a9c3badc8104609,170,10578.88537,active
0x68cf08c4ef8b0462d8c3879f4e26cc371fbddd844650d0c41a9c3badc8104609,171,10565.2972,active
0x68cf08c4ef8b0462d8c3879f4e26cc371fbddd844650d0c41a9c3badc8104609,172,10412.56236,active
0x68cf08c4ef8b0462d8c3879f4e26cc371fbddd844650d0c41a9c3badc8104609,173,10410.48828,active
0x68cf08c4ef8b0462d8c3879f4e26cc371fbddd844650d0c41a9c3badc8104609,174,10407.28168,active
0x68cf08c4ef8b0462d8c3879f4e26cc371fbddd844650d0c41a9c3badc8104609,175,10414.23531,active
0x68cf08c4ef8b0462d8c3879f4e26cc371fbddd844650d0c41a9c3badc8104609,176,10425.55397,active
0x68cf08c4ef8b0462d8c3879f4e26cc371fbddd844650d0c41a9c3badc8104609,177,10432.31411,active
0x68cf08c4ef8b0462d8c3879f4e26cc371fbddd844650d0c41a9c3badc8104609,178,10432.6643,active
0x68cf08c4ef8b0462d8c3879f4e26cc371fbddd844650d0c41a9c3badc8104609,179,10430.93238,active
0x68cf08c4ef8b0462d8c3879f4e26cc371fbddd844650d0c41a9c3badc8104609,180,10429.19565,active
0x68cf08c4ef8b0462d8c3879f4e26cc371fbddd844650d0c41a9c3badc8104609,181,10430.11961,active
0x68cf08c4ef8b0462d8c3879f4e26cc371fbddd844650d0c41a9c3badc8104609,182,10431.45789,active
0x68cf08c4ef8b0462d8c3879f4e26cc371fbddd844650d0c41a9c3badc8104609,183,10435.43967,active
0x68cf08c4ef8b0462d8c3879f4e26cc371fbddd844650d0c41a9c3badc8104609,184,10455.82185,active
0x68cf08c4ef8b0462d8c3879f4e26cc371fbddd844650d0c41a9c3badc8104609,185,10442.22827,active
0x68cf08c4ef8b0462d8c3879f4e26cc371fbddd844650d0c41a9c3badc8104609,186,10439.03799,active
0x68cf08c4ef8b0462d8c3879f4e26cc371fbddd844650d0c41a9c3badc8104609,187,10443.76289,active
0x68cf08c4ef8b0462d8c3879f4e26cc371fbddd844650d0c41a9c3badc8104609,188,10452.04136,active
0x68cf08c4ef8b0462d8c3879f4e26cc371fbddd844650d0c41a9c3badc8104609,189,10423.32577,active
0x68cf08c4ef8b0462d8c3879f4e26cc371fbddd844650d0c41a9c3badc8104609,190,10436.07629,active
0x68cf08c4ef8b0462d8c3879f4e26cc371fbddd844650d0c41a9c3badc8104609,191,10458.16081,active
0x68cf08c4ef8b0462d8c3879f4e26cc371fbddd844650d0c41a9c3badc8104609,192,10433.56812,active
0x68cf08c4ef8b0462d8c3879f4e26cc371fbddd844650d0c41a9c3badc8104609,193,10433.00976,active
0x68cf08c4ef8b0462d8c3879f4e26cc371fbddd844650d0c41a9c3badc8104609,194,10432.90638,active
0x68cf08c4ef8b0462d8c3879f4e26cc371fbddd844650d0c41a9c3badc8104609,195,10432.53338,active
0x68cf08c4ef8b0462d8c3879f4e26cc371fbddd844650d0c41a9c3badc8104609,196,10433.21283,active
0x68cf08c4ef8b0462d8c3879f4e26cc371fbddd844650d0c41a9c3badc8104609,197,10412.21103,active
0x68cf08c4ef8b0462d8c3879f4e26cc371fbddd844650d0c41a9c3badc8104609,198,10395.68906,active
0x68cf08c4ef8b0462d8c3879f4e26cc371fbddd844650d0c41a9c3badc8104609,199,10414.2156,active
0x68cf08c4ef8b0462d8c3879f4e26cc371fbddd844650d0c41a9c3badc8104609,200,9400.472588,active
0x68cf08c4ef8b0462d8c3879f4e26cc371fbddd844650d0c41a9c3badc8104609,201,9390.499605,active
0x68cf08c4ef8b0462d8c3879f4e26cc371fbddd844650d0c41a9c3badc8104609,202,9391.311189,active
0x68cf08c4ef8b0462d8c3879f4e26cc371fbddd844650d0c41a9c3badc8104609,203,9433.298465,active
0x68cf08c4ef8b0462d8c3879f4e26cc371fbddd844650d0c41a9c3badc8104609,204,9440.920791,active
0x68cf08c4ef8b0462d8c3879f4e26cc371fbddd844650d0c41a9c3badc8104609,205,9455.712961,active
0x68cf08c4ef8b0462d8c3879f4e26cc371fbddd844650d0c41a9c3badc8104609,206,9454.85511,active
0x68cf08c4ef8b0462d8c3879f4e26cc371fbddd844650d0c41a9c3badc8104609,207,9450.392258,active
0x68cf08c4ef8b0462d8c3879f4e26cc371fbddd844650d0c41a9c3badc8104609,208,9454.495235,active
0x68cf08c4ef8b0462d8c3879f4e26cc371fbddd844650d0c41a9c3badc8104609,209,9451.460271,active
0x68cf08c4ef8b0462d8c3879f4e26cc371fbddd844650d0c41a9c3badc8104609,210,9437.846341,active
0x68cf08c4ef8b0462d8c3879f4e26cc371fbddd844650d0c41a9c3badc8104609,211,9459.128686,active
0x68cf08c4ef8b0462d8c3879f4e26cc371fbddd844650d0c41a9c3badc8104609,212,9440.671915,active
0x68cf08c4ef8b0462d8c3879f4e26cc371fbddd844650d0c41a9c3badc8104609,213,9442.734464,active
0x68cf08c4ef8b0462d8c3879f4e26cc371fbddd844650d0c41a9c3badc8104609,214,9439.714243,active
0x68cf08c4ef8b0462d8c3879f4e26cc371fbddd844650d0c41a9c3badc8104609,215,9446.191952,active
0x68cf08c4ef8b0462d8c3879f4e26cc371fbddd844650d0c41a9c3badc8104609,216,9436.613079,active
0x68cf08c4ef8b0462d8c3879f4e26cc371fbddd844650d0c41a9c3badc8104609,217,9435.675168,active
0x68cf08c4ef8b0462d8c3879f4e26cc371fbddd844650d0c41a9c3badc8104609,218,9440.740862,active
0x68cf08c4ef8b0462d8c3879f4e26cc371fbddd844650d0c41a9c3badc8104609,219,9430.924375,active
0x68cf08c4ef8b0462d8c3879f4e26cc371fbddd844650d0c41a9c3badc8104609,220,9443.574659,active
0x68cf08c4ef8b0462d8c3879f4e26cc371fbddd844650d0c41a9c3badc8104609,221,9455.297333,active
0x68cf08c4ef8b0462d8c3879f4e26cc371fbddd844650d0c41a9c3badc8104609,222,9407.038218,active
0x68cf08c4ef8b0462d8c3879f4e26cc371fbddd844650d0c41a9c3badc8104609,223,9407.183759,active
0x68cf08c4ef8b0462d8c3879f4e26cc371fbddd844650d0c41a9c3badc8104609,224,9444.802957,active
0x68cf08c4ef8b0462d8c3879f4e26cc371fbddd844650d0c41a9c3badc8104609,225,9442.764678,active
0x68cf08c4ef8b0462d8c3879f4e26cc371fbddd844650d0c41a9c3badc8104609,226,9444.402195,active
0x68cf08c4ef8b0462d8c3879f4e26cc371fbddd844650d0c41a9c3badc8104609,227,9445.814474,active
0x68cf08c4ef8b0462d8c3879f4e26cc371fbddd844650d0c41a9c3badc8104609,228,9444.158361,active
0x68cf08c4ef8b0462d8c3879f4e26cc371fbddd844650d0c41a9c3badc8104609,229,9452.833622,active
0x68cf08c4ef8b0462d8c3879f4e26cc371fbddd844650d0c41a9c3badc8104609,230,9446.171678,active
0x68cf08c4ef8b0462d8c3879f4e26cc371fbddd844650d0c41a9c3badc8104609,231,9464.238383,active
0x68cf08c4ef8b0462d8c3879f4e26cc371fbddd844650d0c41a9c3badc8104609,232,9468.662232,active
0x68cf08c4ef8b0462d8c3879f4e26cc371fbddd844650d0c41a9c3badc8104609,233,9470.303821,active
0x68cf08c4ef8b0462d8c3879f4e26cc371fbddd844650d0c41a9c3badc8104609,234,9467.681438,active
0x68cf08c4ef8b0462d8c3879f4e26cc371fbddd844650d0c41a9c3badc8104609,235,9463.852638,active
0x68cf08c4ef8b0462d8c3879f4e26cc371fbddd844650d0c41a9c3badc8104609,236,9463.445355,active
0x68cf08c4ef8b0462d8c3879f4e26cc371fbddd844650d0c41a9c3badc8104609,237,9466.837222,active
0x68cf08c4ef8b0462d8c3879f4e26cc371fbddd844650d0c41a9c3badc8104609,238,9465.488196,active
0x68cf08c4ef8b0462d8c3879f4e26cc371fbddd844650d0c41a9c3badc8104609,239,9471.750716,active
0x68cf08c4ef8b0462d8c3879f4e26cc371fbddd844650d0c41a9c3badc8104609,240,9497.644875,active
0x68cf08c4ef8b0462d8c3879f4e26cc371fbddd844650d0c41a9c3badc8104609,241,9495.548065,active
0x68cf08c4ef8b0462d8c3879f4e26cc371fbddd844650d0c41a9c3badc8104609,242,9495.598691,active
0x68cf08c4ef8b0462d8c3879f4e26cc371fbddd844650d0c41a9c3badc8104609,243,9496.506368,active
0x68cf08c4ef8b0462d8c3879f4e26cc371fbddd844650d0c41a9c3badc8104609,244,9503.786647,active
0x68cf08c4ef8b0462d8c3879f4e26cc371fbddd844650d0c41a9c3badc8104609,245,9533.983912,active
0x68cf08c4ef8b0462d8c3879f4e26cc371fbddd844650d0c41a9c3badc8104609,246,9508.486008,active
0x68cf08c4ef8b0462d8c3879f4e26cc371fbddd844650d0c41a9c3badc8104609,247,9574.839993,active
0x68cf08c4ef8b0462d8c3879f4e26cc371fbddd844650d0c41a9c3badc8104609,248,9541.258746,active
0x68cf08c4ef8b0462d8c3879f4e26cc371fbddd844650d0c41a9c3badc8104609,249,9516.211442,active
0x68cf08c4ef8b0462d8c3879f4e26cc371fbddd844650d0c41a9c3badc8104609,250,9519.890546,active
0x68cf08c4ef8b0462d8c3879f4e26cc371fbddd844650d0c41a9c3badc8104609,251,9515.674809,active
0x68cf08c4ef8b0462d8c3879f4e26cc371fbddd844650d0c41a9c3badc8104609,252,9507.44554,active
0x68cf08c4ef8b0462d8c3879f4e26cc371fbddd844650d0c41a9c3badc8104609,253,9510.99466,active
0x68cf08c4ef8b0462d8c3879f4e26cc371fbddd844650d0c41a9c3badc8104609,254,9605.807313,active
0x68cf08c4ef8b0462d8c3879f4e26cc371fbddd844650d0c41a9c3badc8104609,255,9510.469409,active
0x68cf08c4ef8b0462d8c3879f4e26cc371fbddd844650d0c41a9c3badc8104609,256,9510.368825,active
0x68cf08c4ef8b0462d8c3879f4e26cc371fbddd844650d0c41a9c3badc8104609,257,9511.164803,active
0x68cf08c4ef8b0462d8c3879f4e26cc371fbddd844650d0c41a9c3badc8104609,258,9516.822306,active
0x68cf08c4ef8b0462d8c3879f4e26cc371fbddd844650d0c41a9c3badc8104609,259,9507.795675,active
0x68cf08c4ef8b0462d8c3879f4e26cc371fbddd844650d0c41a9c3badc8104609,260,9506.958672,active
0x68cf08c4ef8b0462d8c3879f4e26cc371fbddd844650d0c41a9c3badc8104609,261,9506.369211,active
0x68cf08c4ef8b0462d8c3879f4e26cc371fbddd844650d0c41a9c3badc8104609,262,9510.765247,active
0x68cf08c4ef8b0462d8c3879f4e26cc371fbddd844650d0c41a9c3badc8104609,263,9509.635195,active
0x68cf08c4ef8b0462d8c3879f4e26cc371fbddd844650d0c41a9c3badc8104609,264,9510.780725,active
0x68cf08c4ef8b0462d8c3879f4e26cc371fbddd844650d0c41a9c3badc8104609,265,9588.32284,active
0x68cf08c4ef8b0462d8c3879f4e26cc371fbddd844650d0c41a9c3badc8104609,266,9474.074122,active
0x68cf08c4ef8b0462d8c3879f4e26cc371fbddd844650d0c41a9c3badc8104609,267,9459.908208,active
0x68cf08c4ef8b0462d8c3879f4e26cc371fbddd844650d0c41a9c3badc8104609,268,9465.058204,active
0x68cf08c4ef8b0462d8c3879f4e26cc371fbddd844650d0c41a9c3badc8104609,269,9461.407419,active
0x68cf08c4ef8b0462d8c3879f4e26cc371fbddd844650d0c41a9c3badc8104609,270,9467.036836,active
0x68cf08c4ef8b0462d8c3879f4e26cc371fbddd844650d0c41a9c3badc8104609,271,9427.971664,active
0x68cf08c4ef8b0462d8c3879f4e26cc371fbddd844650d0c41a9c3badc8104609,272,9424.304605,active
0x68cf08c4ef8b0462d8c3879f4e26cc371fbddd844650d0c41a9c3badc8104609,273,9421.813398,active
0x68cf08c4ef8b0462d8c3879f4e26cc371fbddd844650d0c41a9c3badc8104609,274,9422.695139,active
0x68cf08c4ef8b0462d8c3879f4e26cc371fbddd844650d0c41a9c3badc8104609,275,9433.363206,active
0x68cf08c4ef8b0462d8c3879f4e26cc371fbddd844650d0c41a9c3badc8104609,276,9445.201284,active
0x68cf08c4ef8b0462d8c3879f4e26cc371fbddd844650d0c41a9c3badc8104609,277,9447.564845,active
0x68cf08c4ef8b0462d8c3879f4e26cc371fbddd844650d0c41a9c3badc8104609,278,9430.997966,active
0x68cf08c4ef8b0462d8c3879f4e26cc371fbddd844650d0c41a9c3badc8104609,279,9435.891138,active
0x68cf08c4ef8b0462d8c3879f4e26cc371fbddd844650d0c41a9c3badc8104609,280,9436.34571,active
0x68cf08c4ef8b0462d8c3879f4e26cc371fbddd844650d0c41a9c3badc8104609,281,9439.313016,active
0x68cf08c4ef8b0462d8c3879f4e26cc371fbddd844650d0c41a9c3badc8104609,282,9434.32346,active
0x68cf08c4ef8b0462d8c3879f4e26cc371fbddd844650d0c41a9c3badc8104609,283,9432.716313,active
0x68cf08c4ef8b0462d8c3879f4e26cc371fbddd844650d0c41a9c3badc8104609,284,9434.835494,active
0x68cf08c4ef8b0462d8c3879f4e26cc371fbddd844650d0c41a9c3badc8104609,285,9429.501866,active
0x68cf08c4ef8b0462d8c3879f4e26cc371fbddd844650d0c41a9c3badc8104609,286,9426.150683,active
0x68cf08c4ef8b0462d8c3879f4e26cc371fbddd844650d0c41a9c3badc8104609,287,9412.935168,active
0x68cf08c4ef8b0462d8c3879f4e26cc371fbddd844650d0c41a9c3badc8104609,288,9417.663213,active
0x68cf08c4ef8b0462d8c3879f4e26cc371fbddd844650d0c41a9c3badc8104609,289,9411.509573,active
0x68cf08c4ef8b0462d8c3879f4e26cc371fbddd844650d0c41a9c3badc8104609,290,8470.841986,active
0x68cf08c4ef8b0462d8c3879f4e26cc371fbddd844650d0c41a9c3badc8104609,291,8471.905953,active
0x68cf08c4ef8b0462d8c3879f4e26cc371fbddd844650d0c41a9c3badc8104609,292,8469.506143,active
0x68cf08c4ef8b0462d8c3879f4e26cc371fbddd844650d0c41a9c3badc8104609,293,8472.887846,active
0x68cf08c4ef8b0462d8c3879f4e26cc371fbddd844650d0c41a9c3badc8104609,294,8469.745386,active
0x68cf08c4ef8b0462d8c3879f4e26cc371fbddd844650d0c41a9c3badc8104609,295,8466.808721,active
0x68cf08c4ef8b0462d8c3879f4e26cc371fbddd844650d0c41a9c3badc8104609,296,8468.649489,active
0x68cf08c4ef8b0462d8c3879f4e26cc371fbddd844650d0c41a9c3badc8104609,297,8521.371645,active
0x68cf08c4ef8b0462d8c3879f4e26cc371fbddd844650d0c41a9c3badc8104609,298,8516.215553,active
0x68cf08c4ef8b0462d8c3879f4e26cc371fbddd844650d0c41a9c3badc8104609,299,8468.192751,active
0x68cf08c4ef8b0462d8c3879f4e26cc371fbddd844650d0c41a9c3badc8104609,300,8468.889655,active
0x68cf08c4ef8b0462d8c3879f4e26cc371fbddd844650d0c41a9c3badc8104609,301,8459.085714,active
0x68cf08c4ef8b0462d8c3879f4e26cc371fbddd844650d0c41a9c3badc8104609,302,8459.369804,active
0x68cf08c4ef8b0462d8c3879f4e26cc371fbddd844650d0c41a9c3badc8104609,303,8453.731135,active
0x68cf08c4ef8b0462d8c3879f4e26cc371fbddd844650d0c41a9c3badc8104609,304,8443.746207,active
0x68cf08c4ef8b0462d8c3879f4e26cc371fbddd844650d0c41a9c3badc8104609,305,8449.945164,active
0x68cf08c4ef8b0462d8c3879f4e26cc371fbddd844650d0c41a9c3badc8104609,306,8450.597566,active
0x68cf08c4ef8b0462d8c3879f4e26cc371fbddd844650d0c41a9c3badc8104609,307,8465.730521,active
0x68cf08c4ef8b0462d8c3879f4e26cc371fbddd844650d0c41a9c3badc8104609,308,8463.324592,active
0x68cf08c4ef8b0462d8c3879f4e26cc371fbddd844650d0c41a9c3badc8104609,309,8463.372884,active
0x68cf08c4ef8b0462d8c3879f4e26cc371fbddd844650d0c41a9c3badc8104609,310,8464.282643,active
0x68cf08c4ef8b0462d8c3879f4e26cc371fbddd844650d0c41a9c3badc8104609,311,8466.525307,active
0x68cf08c4ef8b0462d8c3879f4e26cc371fbddd844650d0c41a9c3badc8104609,312,8466.074919,active
0x68cf08c4ef8b0462d8c3879f4e26cc371fbddd844650d0c41a9c3badc8104609,313,8473.864829,active
0x68cf08c4ef8b0462d8c3879f4e26cc371fbddd844650d0c41a9c3badc8104609,314,8483.613244,active
,,3269787.341,
