validator(0x4fffd0005522be4bc029724c7f0f6ed7093a6bf3a09b90e62f61dc15181e1a3e).csv
Validator,epoch,earned,active
0x4fffd0005522be4bc029724c7f0f6ed7093a6bf3a09b90e62f61dc15181e1a3e,275,1.6159960110629998,active
0x4fffd0005522be4bc029724c7f0f6ed7093a6bf3a09b90e62f61dc15181e1a3e,276,1.6178532109460577,active
0x4fffd0005522be4bc029724c7f0f6ed7093a6bf3a09b90e62f61dc15181e1a3e,277,1.6182616232933122,active
0x4fffd0005522be4bc029724c7f0f6ed7093a6bf3a09b90e62f61dc15181e1a3e,278,1.6154274591172566,active
0x4fffd0005522be4bc029724c7f0f6ed7093a6bf3a09b90e62f61dc15181e1a3e,279,1.616269157478618,active
0x4fffd0005522be4bc029724c7f0f6ed7093a6bf3a09b90e62f61dc15181e1a3e,280,1.616350573791413,active
0x4fffd0005522be4bc029724c7f0f6ed7093a6bf3a09b90e62f61dc15181e1a3e,281,1.6168623970338025,active
0x4fffd0005522be4bc029724c7f0f6ed7093a6bf3a09b90e62f61dc15181e1a3e,282,1.616011287217362,active
0x4fffd0005522be4bc029724c7f0f6ed7093a6bf3a09b90e62f61dc15181e1a3e,283,1.615739547790851,active
0x4fffd0005522be4bc029724c7f0f6ed7093a6bf3a09b90e62f61dc15181e1a3e,284,1.6161060939789553,active
0x4fffd0005522be4bc029724c7f0f6ed7093a6bf3a09b90e62f61dc15181e1a3e,285,1.6151960374544507,active
0x4fffd0005522be4bc029724c7f0f6ed7093a6bf3a09b90e62f61dc15181e1a3e,286,1.614625551925014,active
0x4fffd0005522be4bc029724c7f0f6ed7093a6bf3a09b90e62f61dc15181e1a3e,287,1.6123653757290086,active
0x4fffd0005522be4bc029724c7f0f6ed7093a6bf3a09b90e62f61dc15181e1a3e,288,1.613178788826129,active
0x4fffd0005522be4bc029724c7f0f6ed7093a6bf3a09b90e62f61dc15181e1a3e,289,1.6121282473171803,active
0x4fffd0005522be4bc029724c7f0f6ed7093a6bf3a09b90e62f61dc15181e1a3e,290,1.4510013984712795,active
0x4fffd0005522be4bc029724c7f0f6ed7093a6bf3a09b90e62f61dc15181e1a3e,291,1.4511865095814862,active
0x4fffd0005522be4bc029724c7f0f6ed7093a6bf3a09b90e62f61dc15181e1a3e,292,1.4507782960417033,active
0x4fffd0005522be4bc029724c7f0f6ed7093a6bf3a09b90e62f61dc15181e1a3e,293,1.4513604222113181,active
0x4fffd0005522be4bc029724c7f0f6ed7093a6bf3a09b90e62f61dc15181e1a3e,294,1.4508249949592131,active
0x4fffd0005522be4bc029724c7f0f6ed7093a6bf3a09b90e62f61dc15181e1a3e,295,1.4503248160598294,active
0x4fffd0005522be4bc029724c7f0f6ed7093a6bf3a09b90e62f61dc15181e1a3e,296,1.45064298754181,active
0x4fffd0005522be4bc029724c7f0f6ed7093a6bf3a09b90e62f61dc15181e1a3e,297,1.4596769391969922,active
0x4fffd0005522be4bc029724c7f0f6ed7093a6bf3a09b90e62f61dc15181e1a3e,298,1.4587966117977529,active
0x4fffd0005522be4bc029724c7f0f6ed7093a6bf3a09b90e62f61dc15181e1a3e,299,1.450573353453076,active
0x4fffd0005522be4bc029724c7f0f6ed7093a6bf3a09b90e62f61dc15181e1a3e,300,1.4506955867773907,active
0x4fffd0005522be4bc029724c7f0f6ed7093a6bf3a09b90e62f61dc15181e1a3e,301,1.449019053551602,active
0x4fffd0005522be4bc029724c7f0f6ed7093a6bf3a09b90e62f61dc15181e1a3e,302,1.4490705665002523,active
0x4fffd0005522be4bc029724c7f0f6ed7093a6bf3a09b90e62f61dc15181e1a3e,303,1.4481075225682334,active
0x4fffd0005522be4bc029724c7f0f6ed7093a6bf3a09b90e62f61dc15181e1a3e,304,1.4463999656859534,active
0x4fffd0005522be4bc029724c7f0f6ed7093a6bf3a09b90e62f61dc15181e1a3e,305,1.4474646768963062,active
0x4fffd0005522be4bc029724c7f0f6ed7093a6bf3a09b90e62f61dc15181e1a3e,306,1.4475792747048712,active
0x4fffd0005522be4bc029724c7f0f6ed7093a6bf3a09b90e62f61dc15181e1a3e,307,1.4501743825026274,active
0x4fffd0005522be4bc029724c7f0f6ed7093a6bf3a09b90e62f61dc15181e1a3e,308,1.4497650995357925,active
0x4fffd0005522be4bc029724c7f0f6ed7093a6bf3a09b90e62f61dc15181e1a3e,309,1.4497762220019839,active
0x4fffd0005522be4bc029724c7f0f6ed7093a6bf3a09b90e62f61dc15181e1a3e,310,1.4499349139385307,active
0x4fffd0005522be4bc029724c7f0f6ed7093a6bf3a09b90e62f61dc15181e1a3e,311,1.450321934172792,active
0x4fffd0005522be4bc029724c7f0f6ed7093a6bf3a09b90e62f61dc15181e1a3e,312,1.450247633692713,active
0x4fffd0005522be4bc029724c7f0f6ed7093a6bf3a09b90e62f61dc15181e1a3e,313,1.4515849070400335,active
0x4fffd0005522be4bc029724c7f0f6ed7093a6bf3a09b90e62f61dc15181e1a3e,314,1.4532576833916238,active
0x4fffd0005522be4bc029724c7f0f6ed7093a6bf3a09b90e62f61dc15181e1a3e,315,1.458134154256242,active
0x4fffd0005522be4bc029724c7f0f6ed7093a6bf3a09b90e62f61dc15181e1a3e,316,1.4519540973662606,active
0x4fffd0005522be4bc029724c7f0f6ed7093a6bf3a09b90e62f61dc15181e1a3e,317,1.4527836971349504,active
0x4fffd0005522be4bc029724c7f0f6ed7093a6bf3a09b90e62f61dc15181e1a3e,318,1.4528702008145975,active
0x4fffd0005522be4bc029724c7f0f6ed7093a6bf3a09b90e62f61dc15181e1a3e,319,1.4532796580162044,active
0x4fffd0005522be4bc029724c7f0f6ed7093a6bf3a09b90e62f61dc15181e1a3e,320,1.4532399062113022,active
0x4fffd0005522be4bc029724c7f0f6ed7093a6bf3a09b90e62f61dc15181e1a3e,321,1.4543219306186839,active
0x4fffd0005522be4bc029724c7f0f6ed7093a6bf3a09b90e62f61dc15181e1a3e,322,1.4549222297371471,active
