validator(0xefa5f0435f230579dc95f219a1a8929f91b98cba727d7c1de8b10738be431ade17).csv
Validator,epoch,earned,active
0xefa5f0435f230579dc95f219a1a8929f91b98cba727d7c1de8b10738be431ade,0,NaN,active
0xefa5f0435f230579dc95f219a1a8929f91b98cba727d7c1de8b10738be431ade,1,0.00004294736842105263,active
0xefa5f0435f230579dc95f219a1a8929f91b98cba727d7c1de8b10738be431ade,2,4.210526315787629e-7,active
0xefa5f0435f230579dc95f219a1a8929f91b98cba727d7c1de8b10738be431ade,3,8.421052622530051e-7,active
0xefa5f0435f230579dc95f219a1a8929f91b98cba727d7c1de8b10738be431ade,4,0,active
0xefa5f0435f230579dc95f219a1a8929f91b98cba727d7c1de8b10738be431ade,5,0,active
0xefa5f0435f230579dc95f219a1a8929f91b98cba727d7c1de8b10738be431ade,6,4.247020580445506e-7,active
0xefa5f0435f230579dc95f219a1a8929f91b98cba727d7c1de8b10738be431ade,7,4.2470205804454873e-7,active
0xefa5f0435f230579dc95f219a1a8929f91b98cba727d7c1de8b10738be431ade,8,0,active
0xefa5f0435f230579dc95f219a1a8929f91b98cba727d7c1de8b10738be431ade,9,0,active
0xefa5f0435f230579dc95f219a1a8929f91b98cba727d7c1de8b10738be431ade,10,0,active
0xefa5f0435f230579dc95f219a1a8929f91b98cba727d7c1de8b10738be431ade,11,0,active
0xefa5f0435f230579dc95f219a1a8929f91b98cba727d7c1de8b10738be431ade,12,0.0000025482123510280745,active
0xefa5f0435f230579dc95f219a1a8929f91b98cba727d7c1de8b10738be431ade,13,0.000005096424702056017,active
0xefa5f0435f230579dc95f219a1a8929f91b98cba727d7c1de8b10738be431ade,14,0.000001274106175513938,active
0xefa5f0435f230579dc95f219a1a8929f91b98cba727d7c1de8b10738be431ade,15,0.000639817898157826,active
0xefa5f0435f230579dc95f219a1a8929f91b98cba727d7c1de8b10738be431ade,16,0.0005245078644729918,active
0xefa5f0435f230579dc95f219a1a8929f91b98cba727d7c1de8b10738be431ade,17,0.00029516793065721827,active
0xefa5f0435f230579dc95f219a1a8929f91b98cba727d7c1de8b10738be431ade,18,0.000045661768576003685,active
0xefa5f0435f230579dc95f219a1a8929f91b98cba727d7c1de8b10738be431ade,19,0.0009585180865486412,active
0xefa5f0435f230579dc95f219a1a8929f91b98cba727d7c1de8b10738be431ade,20,463.2360173095855,active
0xefa5f0435f230579dc95f219a1a8929f91b98cba727d7c1de8b10738be431ade,21,457.87773023666387,active
0xefa5f0435f230579dc95f219a1a8929f91b98cba727d7c1de8b10738be431ade,22,465.4567954662707,active
0xefa5f0435f230579dc95f219a1a8929f91b98cba727d7c1de8b10738be431ade,23,462.67533590477535,active
0xefa5f0435f230579dc95f219a1a8929f91b98cba727d7c1de8b10738be431ade,24,428.20596992216656,active
0xefa5f0435f230579dc95f219a1a8929f91b98cba727d7c1de8b10738be431ade,25,409.947436815969,active
0xefa5f0435f230579dc95f219a1a8929f91b98cba727d7c1de8b10738be431ade,26,390.8801027324932,active
0xefa5f0435f230579dc95f219a1a8929f91b98cba727d7c1de8b10738be431ade,27,361.4957470129662,active
0xefa5f0435f230579dc95f219a1a8929f91b98cba727d7c1de8b10738be431ade,28,341.2978071676459,active
0xefa5f0435f230579dc95f219a1a8929f91b98cba727d7c1de8b10738be431ade,29,337.0556682686694,active
0xefa5f0435f230579dc95f219a1a8929f91b98cba727d7c1de8b10738be431ade,30,330.68676891550257,active
0xefa5f0435f230579dc95f219a1a8929f91b98cba727d7c1de8b10738be431ade,31,329.9092757896024,active
0xefa5f0435f230579dc95f219a1a8929f91b98cba727d7c1de8b10738be431ade,32,330.339540294756,active
0xefa5f0435f230579dc95f219a1a8929f91b98cba727d7c1de8b10738be431ade,33,329.6649565754993,active
0xefa5f0435f230579dc95f219a1a8929f91b98cba727d7c1de8b10738be431ade,34,329.4365569989298,active
0xefa5f0435f230579dc95f219a1a8929f91b98cba727d7c1de8b10738be431ade,35,321.45358443103277,active
0xefa5f0435f230579dc95f219a1a8929f91b98cba727d7c1de8b10738be431ade,36,309.7220004496002,active
0xefa5f0435f230579dc95f219a1a8929f91b98cba727d7c1de8b10738be431ade,37,304.4172994719467,active
0xefa5f0435f230579dc95f219a1a8929f91b98cba727d7c1de8b10738be431ade,38,302.9214997012184,active
0xefa5f0435f230579dc95f219a1a8929f91b98cba727d7c1de8b10738be431ade,39,302.30732872479723,active
0xefa5f0435f230579dc95f219a1a8929f91b98cba727d7c1de8b10738be431ade,40,301.15010193260633,active
0xefa5f0435f230579dc95f219a1a8929f91b98cba727d7c1de8b10738be431ade,41,300.1931503853304,active
0xefa5f0435f230579dc95f219a1a8929f91b98cba727d7c1de8b10738be431ade,42,299.202375508559,active
0xefa5f0435f230579dc95f219a1a8929f91b98cba727d7c1de8b10738be431ade,43,296.9522311517169,active
0xefa5f0435f230579dc95f219a1a8929f91b98cba727d7c1de8b10738be431ade,44,296.9228483925098,active
0xefa5f0435f230579dc95f219a1a8929f91b98cba727d7c1de8b10738be431ade,45,296.87139247086094,active
0xefa5f0435f230579dc95f219a1a8929f91b98cba727d7c1de8b10738be431ade,46,296.8904265779506,active
0xefa5f0435f230579dc95f219a1a8929f91b98cba727d7c1de8b10738be431ade,47,296.7535714084673,active
0xefa5f0435f230579dc95f219a1a8929f91b98cba727d7c1de8b10738be431ade,48,297.2283702715346,active
0xefa5f0435f230579dc95f219a1a8929f91b98cba727d7c1de8b10738be431ade,49,296.1889523766661,active
0xefa5f0435f230579dc95f219a1a8929f91b98cba727d7c1de8b10738be431ade,50,296.2510789953254,active
0xefa5f0435f230579dc95f219a1a8929f91b98cba727d7c1de8b10738be431ade,51,296.23076695392797,active
0xefa5f0435f230579dc95f219a1a8929f91b98cba727d7c1de8b10738be431ade,52,296.26097173860404,active
0xefa5f0435f230579dc95f219a1a8929f91b98cba727d7c1de8b10738be431ade,53,296.243470063052,active
0xefa5f0435f230579dc95f219a1a8929f91b98cba727d7c1de8b10738be431ade,54,296.3245924216553,active
0xefa5f0435f230579dc95f219a1a8929f91b98cba727d7c1de8b10738be431ade,55,295.2270257031149,active
0xefa5f0435f230579dc95f219a1a8929f91b98cba727d7c1de8b10738be431ade,56,294.3737339566296,active
0xefa5f0435f230579dc95f219a1a8929f91b98cba727d7c1de8b10738be431ade,57,294.3343277288274,active
0xefa5f0435f230579dc95f219a1a8929f91b98cba727d7c1de8b10738be431ade,58,293.8538344099416,active
0xefa5f0435f230579dc95f219a1a8929f91b98cba727d7c1de8b10738be431ade,59,293.5780005614246,active
0xefa5f0435f230579dc95f219a1a8929f91b98cba727d7c1de8b10738be431ade,60,293.67156587613755,active
0xefa5f0435f230579dc95f219a1a8929f91b98cba727d7c1de8b10738be431ade,61,293.46117569698276,active
0xefa5f0435f230579dc95f219a1a8929f91b98cba727d7c1de8b10738be431ade,62,293.3817864414992,active
0xefa5f0435f230579dc95f219a1a8929f91b98cba727d7c1de8b10738be431ade,63,293.75659804889597,active
0xefa5f0435f230579dc95f219a1a8929f91b98cba727d7c1de8b10738be431ade,64,293.6095303150141,active
0xefa5f0435f230579dc95f219a1a8929f91b98cba727d7c1de8b10738be431ade,65,312.21965930033184,active
0xefa5f0435f230579dc95f219a1a8929f91b98cba727d7c1de8b10738be431ade,66,312.238685382759,active
0xefa5f0435f230579dc95f219a1a8929f91b98cba727d7c1de8b10738be431ade,67,312.0534053467149,active
0xefa5f0435f230579dc95f219a1a8929f91b98cba727d7c1de8b10738be431ade,68,311.60809897980647,active
0xefa5f0435f230579dc95f219a1a8929f91b98cba727d7c1de8b10738be431ade,69,312.2626635217317,active
0xefa5f0435f230579dc95f219a1a8929f91b98cba727d7c1de8b10738be431ade,70,309.7611646725344,active
0xefa5f0435f230579dc95f219a1a8929f91b98cba727d7c1de8b10738be431ade,71,309.6396090888801,active
0xefa5f0435f230579dc95f219a1a8929f91b98cba727d7c1de8b10738be431ade,72,309.6277850400688,active
0xefa5f0435f230579dc95f219a1a8929f91b98cba727d7c1de8b10738be431ade,73,302.06748858360515,active
0xefa5f0435f230579dc95f219a1a8929f91b98cba727d7c1de8b10738be431ade,74,293.52860564378454,active
0xefa5f0435f230579dc95f219a1a8929f91b98cba727d7c1de8b10738be431ade,75,293.5000377072259,active
0xefa5f0435f230579dc95f219a1a8929f91b98cba727d7c1de8b10738be431ade,76,293.47615367690526,active
0xefa5f0435f230579dc95f219a1a8929f91b98cba727d7c1de8b10738be431ade,77,293.7624920239978,active
0xefa5f0435f230579dc95f219a1a8929f91b98cba727d7c1de8b10738be431ade,78,293.7075110613115,active
0xefa5f0435f230579dc95f219a1a8929f91b98cba727d7c1de8b10738be431ade,79,293.9829104027349,active
0xefa5f0435f230579dc95f219a1a8929f91b98cba727d7c1de8b10738be431ade,80,305.01267437659527,active
0xefa5f0435f230579dc95f219a1a8929f91b98cba727d7c1de8b10738be431ade,81,294.0020272657154,active
0xefa5f0435f230579dc95f219a1a8929f91b98cba727d7c1de8b10738be431ade,82,294.0012271029654,active
0xefa5f0435f230579dc95f219a1a8929f91b98cba727d7c1de8b10738be431ade,83,295.2234918363962,active
0xefa5f0435f230579dc95f219a1a8929f91b98cba727d7c1de8b10738be431ade,84,294.1068947654755,active
0xefa5f0435f230579dc95f219a1a8929f91b98cba727d7c1de8b10738be431ade,85,294.90794747574347,active
0xefa5f0435f230579dc95f219a1a8929f91b98cba727d7c1de8b10738be431ade,86,296.1383246627993,active
0xefa5f0435f230579dc95f219a1a8929f91b98cba727d7c1de8b10738be431ade,87,296.2426650533243,active
0xefa5f0435f230579dc95f219a1a8929f91b98cba727d7c1de8b10738be431ade,88,296.0780406949231,active
0xefa5f0435f230579dc95f219a1a8929f91b98cba727d7c1de8b10738be431ade,89,296.28065407646756,active
0xefa5f0435f230579dc95f219a1a8929f91b98cba727d7c1de8b10738be431ade,90,296.2081329866889,active
0xefa5f0435f230579dc95f219a1a8929f91b98cba727d7c1de8b10738be431ade,91,296.88177526409,active
0xefa5f0435f230579dc95f219a1a8929f91b98cba727d7c1de8b10738be431ade,92,297.7741781472488,active
0xefa5f0435f230579dc95f219a1a8929f91b98cba727d7c1de8b10738be431ade,93,300.34486773815127,active
0xefa5f0435f230579dc95f219a1a8929f91b98cba727d7c1de8b10738be431ade,94,302.16174090624395,active
0xefa5f0435f230579dc95f219a1a8929f91b98cba727d7c1de8b10738be431ade,95,302.0615490563083,active
0xefa5f0435f230579dc95f219a1a8929f91b98cba727d7c1de8b10738be431ade,96,302.866914294101,active
0xefa5f0435f230579dc95f219a1a8929f91b98cba727d7c1de8b10738be431ade,97,301.5705193015909,active
0xefa5f0435f230579dc95f219a1a8929f91b98cba727d7c1de8b10738be431ade,98,303.849354442314,active
0xefa5f0435f230579dc95f219a1a8929f91b98cba727d7c1de8b10738be431ade,99,304.0725974253719,active
0xefa5f0435f230579dc95f219a1a8929f91b98cba727d7c1de8b10738be431ade,100,305.0410218898539,active
0xefa5f0435f230579dc95f219a1a8929f91b98cba727d7c1de8b10738be431ade,101,305.9849997411437,active
0xefa5f0435f230579dc95f219a1a8929f91b98cba727d7c1de8b10738be431ade,102,307.5203259276003,active
0xefa5f0435f230579dc95f219a1a8929f91b98cba727d7c1de8b10738be431ade,103,309.0683550510555,active
0xefa5f0435f230579dc95f219a1a8929f91b98cba727d7c1de8b10738be431ade,104,308.26515980509043,active
0xefa5f0435f230579dc95f219a1a8929f91b98cba727d7c1de8b10738be431ade,105,309.30376440020933,active
0xefa5f0435f230579dc95f219a1a8929f91b98cba727d7c1de8b10738be431ade,106,306.0204529770917,active
0xefa5f0435f230579dc95f219a1a8929f91b98cba727d7c1de8b10738be431ade,107,297.8915254585066,active
0xefa5f0435f230579dc95f219a1a8929f91b98cba727d7c1de8b10738be431ade,108,295.90587571931377,active
0xefa5f0435f230579dc95f219a1a8929f91b98cba727d7c1de8b10738be431ade,109,295.9422055883256,active
0xefa5f0435f230579dc95f219a1a8929f91b98cba727d7c1de8b10738be431ade,110,266.2660293686744,active
0xefa5f0435f230579dc95f219a1a8929f91b98cba727d7c1de8b10738be431ade,111,266.1564114385922,active
0xefa5f0435f230579dc95f219a1a8929f91b98cba727d7c1de8b10738be431ade,112,266.4083004649866,active
0xefa5f0435f230579dc95f219a1a8929f91b98cba727d7c1de8b10738be431ade,113,266.3938533458973,active
0xefa5f0435f230579dc95f219a1a8929f91b98cba727d7c1de8b10738be431ade,114,266.38291349325635,active
0xefa5f0435f230579dc95f219a1a8929f91b98cba727d7c1de8b10738be431ade,115,266.375695495005,active
0xefa5f0435f230579dc95f219a1a8929f91b98cba727d7c1de8b10738be431ade,116,266.2824763771225,active
0xefa5f0435f230579dc95f219a1a8929f91b98cba727d7c1de8b10738be431ade,117,266.25276900667825,active
0xefa5f0435f230579dc95f219a1a8929f91b98cba727d7c1de8b10738be431ade,118,265.9117354877754,active
0xefa5f0435f230579dc95f219a1a8929f91b98cba727d7c1de8b10738be431ade,119,265.7705398634909,active
0xefa5f0435f230579dc95f219a1a8929f91b98cba727d7c1de8b10738be431ade,120,265.7167911163452,active
0xefa5f0435f230579dc95f219a1a8929f91b98cba727d7c1de8b10738be431ade,121,265.5518699803653,active
0xefa5f0435f230579dc95f219a1a8929f91b98cba727d7c1de8b10738be431ade,122,265.61116741818836,active
0xefa5f0435f230579dc95f219a1a8929f91b98cba727d7c1de8b10738be431ade,123,265.55375484706394,active
0xefa5f0435f230579dc95f219a1a8929f91b98cba727d7c1de8b10738be431ade,124,265.5647646794823,active
0xefa5f0435f230579dc95f219a1a8929f91b98cba727d7c1de8b10738be431ade,125,265.5362507159571,active
0xefa5f0435f230579dc95f219a1a8929f91b98cba727d7c1de8b10738be431ade,126,265.562735000229,active
0xefa5f0435f230579dc95f219a1a8929f91b98cba727d7c1de8b10738be431ade,127,266.1225090358237,active
0xefa5f0435f230579dc95f219a1a8929f91b98cba727d7c1de8b10738be431ade,128,266.039240533418,active
0xefa5f0435f230579dc95f219a1a8929f91b98cba727d7c1de8b10738be431ade,129,266.0162367719128,active
0xefa5f0435f230579dc95f219a1a8929f91b98cba727d7c1de8b10738be431ade,130,266.0815756848427,active
0xefa5f0435f230579dc95f219a1a8929f91b98cba727d7c1de8b10738be431ade,131,266.7671112206969,active
0xefa5f0435f230579dc95f219a1a8929f91b98cba727d7c1de8b10738be431ade,132,266.75040746021574,active
0xefa5f0435f230579dc95f219a1a8929f91b98cba727d7c1de8b10738be431ade,133,266.17859436155146,active
0xefa5f0435f230579dc95f219a1a8929f91b98cba727d7c1de8b10738be431ade,134,266.440857564939,active
0xefa5f0435f230579dc95f219a1a8929f91b98cba727d7c1de8b10738be431ade,135,266.0799664499604,active
0xefa5f0435f230579dc95f219a1a8929f91b98cba727d7c1de8b10738be431ade,136,266.2477825965282,active
0xefa5f0435f230579dc95f219a1a8929f91b98cba727d7c1de8b10738be431ade,137,266.3677964206107,active
0xefa5f0435f230579dc95f219a1a8929f91b98cba727d7c1de8b10738be431ade,138,266.1723114714558,active
0xefa5f0435f230579dc95f219a1a8929f91b98cba727d7c1de8b10738be431ade,139,265.9805520447248,active
0xefa5f0435f230579dc95f219a1a8929f91b98cba727d7c1de8b10738be431ade,140,266.18095508683126,active
0xefa5f0435f230579dc95f219a1a8929f91b98cba727d7c1de8b10738be431ade,141,266.3782845499102,active
0xefa5f0435f230579dc95f219a1a8929f91b98cba727d7c1de8b10738be431ade,142,266.4907896995188,active
0xefa5f0435f230579dc95f219a1a8929f91b98cba727d7c1de8b10738be431ade,143,266.53162399994693,active
0xefa5f0435f230579dc95f219a1a8929f91b98cba727d7c1de8b10738be431ade,144,266.7267824918665,active
0xefa5f0435f230579dc95f219a1a8929f91b98cba727d7c1de8b10738be431ade,145,266.69031817973365,active
0xefa5f0435f230579dc95f219a1a8929f91b98cba727d7c1de8b10738be431ade,146,266.91313220536136,active
0xefa5f0435f230579dc95f219a1a8929f91b98cba727d7c1de8b10738be431ade,147,267.13908577774976,active
0xefa5f0435f230579dc95f219a1a8929f91b98cba727d7c1de8b10738be431ade,148,267.5076848298659,active
0xefa5f0435f230579dc95f219a1a8929f91b98cba727d7c1de8b10738be431ade,149,269.26146510260395,active
0xefa5f0435f230579dc95f219a1a8929f91b98cba727d7c1de8b10738be431ade,150,269.21902123235543,active
0xefa5f0435f230579dc95f219a1a8929f91b98cba727d7c1de8b10738be431ade,151,269.2328204306098,active
0xefa5f0435f230579dc95f219a1a8929f91b98cba727d7c1de8b10738be431ade,152,269.2499764823185,active
0xefa5f0435f230579dc95f219a1a8929f91b98cba727d7c1de8b10738be431ade,153,269.0593143134831,active
0xefa5f0435f230579dc95f219a1a8929f91b98cba727d7c1de8b10738be431ade,154,269.3372163166826,active
0xefa5f0435f230579dc95f219a1a8929f91b98cba727d7c1de8b10738be431ade,155,269.3125871824668,active
0xefa5f0435f230579dc95f219a1a8929f91b98cba727d7c1de8b10738be431ade,156,269.0557892866056,active
0xefa5f0435f230579dc95f219a1a8929f91b98cba727d7c1de8b10738be431ade,157,269.0773654835589,active
0xefa5f0435f230579dc95f219a1a8929f91b98cba727d7c1de8b10738be431ade,158,269.0644809700986,active
0xefa5f0435f230579dc95f219a1a8929f91b98cba727d7c1de8b10738be431ade,159,269.11316232075154,active
0xefa5f0435f230579dc95f219a1a8929f91b98cba727d7c1de8b10738be431ade,160,260.8804736437204,active
0xefa5f0435f230579dc95f219a1a8929f91b98cba727d7c1de8b10738be431ade,161,260.5880197876685,active
0xefa5f0435f230579dc95f219a1a8929f91b98cba727d7c1de8b10738be431ade,162,261.54295455305237,active
0xefa5f0435f230579dc95f219a1a8929f91b98cba727d7c1de8b10738be431ade,163,261.5674798342002,active
0xefa5f0435f230579dc95f219a1a8929f91b98cba727d7c1de8b10738be431ade,164,261.6064050349419,active
0xefa5f0435f230579dc95f219a1a8929f91b98cba727d7c1de8b10738be431ade,165,261.50868187693766,active
0xefa5f0435f230579dc95f219a1a8929f91b98cba727d7c1de8b10738be431ade,166,261.5790887462701,active
0xefa5f0435f230579dc95f219a1a8929f91b98cba727d7c1de8b10738be431ade,167,245.56682944832406,active
0xefa5f0435f230579dc95f219a1a8929f91b98cba727d7c1de8b10738be431ade,168,246.44588308361995,active
0xefa5f0435f230579dc95f219a1a8929f91b98cba727d7c1de8b10738be431ade,169,247.0043193750917,active
0xefa5f0435f230579dc95f219a1a8929f91b98cba727d7c1de8b10738be431ade,170,247.28029073030416,active
0xefa5f0435f230579dc95f219a1a8929f91b98cba727d7c1de8b10738be431ade,171,246.96297665000495,active
0xefa5f0435f230579dc95f219a1a8929f91b98cba727d7c1de8b10738be431ade,172,243.3931149943934,active
0xefa5f0435f230579dc95f219a1a8929f91b98cba727d7c1de8b10738be431ade,173,243.34493199871727,active
0xefa5f0435f230579dc95f219a1a8929f91b98cba727d7c1de8b10738be431ade,174,243.2702763536291,active
0xefa5f0435f230579dc95f219a1a8929f91b98cba727d7c1de8b10738be431ade,175,243.43311605764438,active
0xefa5f0435f230579dc95f219a1a8929f91b98cba727d7c1de8b10738be431ade,176,243.6979889226725,active
0xefa5f0435f230579dc95f219a1a8929f91b98cba727d7c1de8b10738be431ade,177,243.85630703634976,active
0xefa5f0435f230579dc95f219a1a8929f91b98cba727d7c1de8b10738be431ade,178,243.86479249340954,active
0xefa5f0435f230579dc95f219a1a8929f91b98cba727d7c1de8b10738be431ade,179,243.82460825238473,active
0xefa5f0435f230579dc95f219a1a8929f91b98cba727d7c1de8b10738be431ade,180,243.78431137981266,active
0xefa5f0435f230579dc95f219a1a8929f91b98cba727d7c1de8b10738be431ade,181,243.80620841500664,active
0xefa5f0435f230579dc95f219a1a8929f91b98cba727d7c1de8b10738be431ade,182,243.83779030488506,active
0xefa5f0435f230579dc95f219a1a8929f91b98cba727d7c1de8b10738be431ade,183,243.93116480270743,active
0xefa5f0435f230579dc95f219a1a8929f91b98cba727d7c1de8b10738be431ade,184,244.40790381300815,active
0xefa5f0435f230579dc95f219a1a8929f91b98cba727d7c1de8b10738be431ade,185,244.09045042826858,active
0xefa5f0435f230579dc95f219a1a8929f91b98cba727d7c1de8b10738be431ade,186,244.01617638619476,active
0xefa5f0435f230579dc95f219a1a8929f91b98cba727d7c1de8b10738be431ade,187,244.1269223793834,active
0xefa5f0435f230579dc95f219a1a8929f91b98cba727d7c1de8b10738be431ade,188,244.3207349434156,active
0xefa5f0435f230579dc95f219a1a8929f91b98cba727d7c1de8b10738be431ade,189,243.64979585896398,active
0xefa5f0435f230579dc95f219a1a8929f91b98cba727d7c1de8b10738be431ade,190,243.94814379000567,active
0xefa5f0435f230579dc95f219a1a8929f91b98cba727d7c1de8b10738be431ade,191,244.46467961801005,active
0xefa5f0435f230579dc95f219a1a8929f91b98cba727d7c1de8b10738be431ade,192,243.890113444852,active
0xefa5f0435f230579dc95f219a1a8929f91b98cba727d7c1de8b10738be431ade,193,243.87736044205712,active
0xefa5f0435f230579dc95f219a1a8929f91b98cba727d7c1de8b10738be431ade,194,243.87524300481408,active
0xefa5f0435f230579dc95f219a1a8929f91b98cba727d7c1de8b10738be431ade,195,243.86682297309193,active
0xefa5f0435f230579dc95f219a1a8929f91b98cba727d7c1de8b10738be431ade,196,243.88300458900702,active
0xefa5f0435f230579dc95f219a1a8929f91b98cba727d7c1de8b10738be431ade,197,243.39237250257617,active
0xefa5f0435f230579dc95f219a1a8929f91b98cba727d7c1de8b10738be431ade,198,243.00645764347234,active
0xefa5f0435f230579dc95f219a1a8929f91b98cba727d7c1de8b10738be431ade,199,243.4398257038975,active
0xefa5f0435f230579dc95f219a1a8929f91b98cba727d7c1de8b10738be431ade,200,219.74311812880708,active
0xefa5f0435f230579dc95f219a1a8929f91b98cba727d7c1de8b10738be431ade,201,219.5102345228262,active
0xefa5f0435f230579dc95f219a1a8929f91b98cba727d7c1de8b10738be431ade,202,219.52944803750339,active
0xefa5f0435f230579dc95f219a1a8929f91b98cba727d7c1de8b10738be431ade,203,220.51117755508378,active
0xefa5f0435f230579dc95f219a1a8929f91b98cba727d7c1de8b10738be431ade,204,220.68960019963208,active
0xefa5f0435f230579dc95f219a1a8929f91b98cba727d7c1de8b10738be431ade,205,221.03562482967783,active
0xefa5f0435f230579dc95f219a1a8929f91b98cba727d7c1de8b10738be431ade,206,221.01581713291108,active
0xefa5f0435f230579dc95f219a1a8929f91b98cba727d7c1de8b10738be431ade,207,220.91173910417868,active
0xefa5f0435f230579dc95f219a1a8929f91b98cba727d7c1de8b10738be431ade,208,221.0078951541071,active
0xefa5f0435f230579dc95f219a1a8929f91b98cba727d7c1de8b10738be431ade,209,220.93719508817102,active
0xefa5f0435f230579dc95f219a1a8929f91b98cba727d7c1de8b10738be431ade,210,220.61920074039375,active
0xefa5f0435f230579dc95f219a1a8929f91b98cba727d7c1de8b10738be431ade,211,221.11694193079714,active
0xefa5f0435f230579dc95f219a1a8929f91b98cba727d7c1de8b10738be431ade,212,220.68574067382153,active
0xefa5f0435f230579dc95f219a1a8929f91b98cba727d7c1de8b10738be431ade,213,220.73419940247337,active
0xefa5f0435f230579dc95f219a1a8929f91b98cba727d7c1de8b10738be431ade,214,220.66384285242114,active
0xefa5f0435f230579dc95f219a1a8929f91b98cba727d7c1de8b10738be431ade,215,220.8155109904598,active
0xefa5f0435f230579dc95f219a1a8929f91b98cba727d7c1de8b10738be431ade,216,220.59183827326987,active
0xefa5f0435f230579dc95f219a1a8929f91b98cba727d7c1de8b10738be431ade,217,220.57015755311298,active
0xefa5f0435f230579dc95f219a1a8929f91b98cba727d7c1de8b10738be431ade,218,220.68881835113376,active
0xefa5f0435f230579dc95f219a1a8929f91b98cba727d7c1de8b10738be431ade,219,220.45958999407037,active
0xefa5f0435f230579dc95f219a1a8929f91b98cba727d7c1de8b10738be431ade,220,220.75555015638824,active
0xefa5f0435f230579dc95f219a1a8929f91b98cba727d7c1de8b10738be431ade,221,221.02982719124165,active
0xefa5f0435f230579dc95f219a1a8929f91b98cba727d7c1de8b10738be431ade,222,219.90195153619507,active
0xefa5f0435f230579dc95f219a1a8929f91b98cba727d7c1de8b10738be431ade,223,219.9055961356489,active
0xefa5f0435f230579dc95f219a1a8929f91b98cba727d7c1de8b10738be431ade,224,220.78523894772775,active
0xefa5f0435f230579dc95f219a1a8929f91b98cba727d7c1de8b10738be431ade,225,220.73783563147165,active
0xefa5f0435f230579dc95f219a1a8929f91b98cba727d7c1de8b10738be431ade,226,220.7763590890377,active
0xefa5f0435f230579dc95f219a1a8929f91b98cba727d7c1de8b10738be431ade,227,220.80961740266838,active
0xefa5f0435f230579dc95f219a1a8929f91b98cba727d7c1de8b10738be431ade,228,220.77114759202945,active
0xefa5f0435f230579dc95f219a1a8929f91b98cba727d7c1de8b10738be431ade,229,220.97418901627475,active
0xefa5f0435f230579dc95f219a1a8929f91b98cba727d7c1de8b10738be431ade,230,220.8187004819516,active
0xefa5f0435f230579dc95f219a1a8929f91b98cba727d7c1de8b10738be431ade,231,221.24128201276028,active
0xefa5f0435f230579dc95f219a1a8929f91b98cba727d7c1de8b10738be431ade,232,221.34494160768915,active
0xefa5f0435f230579dc95f219a1a8929f91b98cba727d7c1de8b10738be431ade,233,221.38356172320292,active
0xefa5f0435f230579dc95f219a1a8929f91b98cba727d7c1de8b10738be431ade,234,221.32250463451425,active
0xefa5f0435f230579dc95f219a1a8929f91b98cba727d7c1de8b10738be431ade,235,221.2332453128211,active
0xefa5f0435f230579dc95f219a1a8929f91b98cba727d7c1de8b10738be431ade,236,221.22396938977846,active
