validator(0xefa5f0435f230579dc95f219a1a8929f91b98cba727d7c1de8b10738be431ade13).csv
Validator,epoch,earned,active
0xefa5f0435f230579dc95f219a1a8929f91b98cba727d7c1de8b10738be431ade,0,NaN,active
0xefa5f0435f230579dc95f219a1a8929f91b98cba727d7c1de8b10738be431ade,1,0.000028989473684210525,active
0xefa5f0435f230579dc95f219a1a8929f91b98cba727d7c1de8b10738be431ade,2,2.842105263156649e-7,active
0xefa5f0435f230579dc95f219a1a8929f91b98cba727d7c1de8b10738be431ade,3,5.684210520207784e-7,active
0xefa5f0435f230579dc95f219a1a8929f91b98cba727d7c1de8b10738be431ade,4,0,active
0xefa5f0435f230579dc95f219a1a8929f91b98cba727d7c1de8b10738be431ade,5,0,active
0xefa5f0435f230579dc95f219a1a8929f91b98cba727d7c1de8b10738be431ade,6,2.8667388918007167e-7,active
0xefa5f0435f230579dc95f219a1a8929f91b98cba727d7c1de8b10738be431ade,7,2.866738891800704e-7,active
0xefa5f0435f230579dc95f219a1a8929f91b98cba727d7c1de8b10738be431ade,8,0,active
0xefa5f0435f230579dc95f219a1a8929f91b98cba727d7c1de8b10738be431ade,9,0,active
0xefa5f0435f230579dc95f219a1a8929f91b98cba727d7c1de8b10738be431ade,10,0,active
0xefa5f0435f230579dc95f219a1a8929f91b98cba727d7c1de8b10738be431ade,11,0,active
0xefa5f0435f230579dc95f219a1a8929f91b98cba727d7c1de8b10738be431ade,12,0.0000017200433369439504,active
0xefa5f0435f230579dc95f219a1a8929f91b98cba727d7c1de8b10738be431ade,13,0.0000034400866738878114,active
0xefa5f0435f230579dc95f219a1a8929f91b98cba727d7c1de8b10738be431ade,14,8.600216684719081e-7,active
0xefa5f0435f230579dc95f219a1a8929f91b98cba727d7c1de8b10738be431ade,15,0.0004318770812565325,active
0xefa5f0435f230579dc95f219a1a8929f91b98cba727d7c1de8b10738be431ade,16,0.0003540428085192694,active
0xefa5f0435f230579dc95f219a1a8929f91b98cba727d7c1de8b10738be431ade,17,0.00019923835319362234,active
0xefa5f0435f230579dc95f219a1a8929f91b98cba727d7c1de8b10738be431ade,18,0.0000308216937888025,active
0xefa5f0435f230579dc95f219a1a8929f91b98cba727d7c1de8b10738be431ade,19,0.0006469997084203329,active
0xefa5f0435f230579dc95f219a1a8929f91b98cba727d7c1de8b10738be431ade,20,312.6843116839704,active
0xefa5f0435f230579dc95f219a1a8929f91b98cba727d7c1de8b10738be431ade,21,309.06746790974825,active
0xefa5f0435f230579dc95f219a1a8929f91b98cba727d7c1de8b10738be431ade,22,314.1833369397328,active
0xefa5f0435f230579dc95f219a1a8929f91b98cba727d7c1de8b10738be431ade,23,312.30585173572325,active
0xefa5f0435f230579dc95f219a1a8929f91b98cba727d7c1de8b10738be431ade,24,289.0390296974624,active
0xefa5f0435f230579dc95f219a1a8929f91b98cba727d7c1de8b10738be431ade,25,276.714519850779,active
0xefa5f0435f230579dc95f219a1a8929f91b98cba727d7c1de8b10738be431ade,26,263.84406934443285,active
0xefa5f0435f230579dc95f219a1a8929f91b98cba727d7c1de8b10738be431ade,27,244.00962923375218,active
0xefa5f0435f230579dc95f219a1a8929f91b98cba727d7c1de8b10738be431ade,28,230.37601983816103,active
0xefa5f0435f230579dc95f219a1a8929f91b98cba727d7c1de8b10738be431ade,29,227.51257608135182,active
0xefa5f0435f230579dc95f219a1a8929f91b98cba727d7c1de8b10738be431ade,30,223.2135690179643,active
0xefa5f0435f230579dc95f219a1a8929f91b98cba727d7c1de8b10738be431ade,31,222.6887611579818,active
0xefa5f0435f230579dc95f219a1a8929f91b98cba727d7c1de8b10738be431ade,32,222.9791896989603,active
0xefa5f0435f230579dc95f219a1a8929f91b98cba727d7c1de8b10738be431ade,33,222.52384568846205,active
0xefa5f0435f230579dc95f219a1a8929f91b98cba727d7c1de8b10738be431ade,34,222.36967597427758,active
0xefa5f0435f230579dc95f219a1a8929f91b98cba727d7c1de8b10738be431ade,35,216.98116949094714,active
0xefa5f0435f230579dc95f219a1a8929f91b98cba727d7c1de8b10738be431ade,36,209.06235030348026,active
0xefa5f0435f230579dc95f219a1a8929f91b98cba727d7c1de8b10738be431ade,37,205.48167714356404,active
0xefa5f0435f230579dc95f219a1a8929f91b98cba727d7c1de8b10738be431ade,38,204.47201229832245,active
0xefa5f0435f230579dc95f219a1a8929f91b98cba727d7c1de8b10738be431ade,39,204.05744688923812,active
0xefa5f0435f230579dc95f219a1a8929f91b98cba727d7c1de8b10738be431ade,40,203.27631880450926,active
0xefa5f0435f230579dc95f219a1a8929f91b98cba727d7c1de8b10738be431ade,41,202.63037651009807,active
0xefa5f0435f230579dc95f219a1a8929f91b98cba727d7c1de8b10738be431ade,42,201.96160346827713,active
0xefa5f0435f230579dc95f219a1a8929f91b98cba727d7c1de8b10738be431ade,43,200.44275602740896,active
0xefa5f0435f230579dc95f219a1a8929f91b98cba727d7c1de8b10738be431ade,44,200.42292266494417,active
0xefa5f0435f230579dc95f219a1a8929f91b98cba727d7c1de8b10738be431ade,45,200.38818991783108,active
0xefa5f0435f230579dc95f219a1a8929f91b98cba727d7c1de8b10738be431ade,46,200.40103794011668,active
0xefa5f0435f230579dc95f219a1a8929f91b98cba727d7c1de8b10738be431ade,47,200.3086607007155,active
0xefa5f0435f230579dc95f219a1a8929f91b98cba727d7c1de8b10738be431ade,48,200.62914993328582,active
0xefa5f0435f230579dc95f219a1a8929f91b98cba727d7c1de8b10738be431ade,49,199.92754285424962,active
0xefa5f0435f230579dc95f219a1a8929f91b98cba727d7c1de8b10738be431ade,50,199.96947832184455,active
0xefa5f0435f230579dc95f219a1a8929f91b98cba727d7c1de8b10738be431ade,51,199.95576769390132,active
0xefa5f0435f230579dc95f219a1a8929f91b98cba727d7c1de8b10738be431ade,52,199.97615592355768,active
0xefa5f0435f230579dc95f219a1a8929f91b98cba727d7c1de8b10738be431ade,53,199.9643422925602,active
0xefa5f0435f230579dc95f219a1a8929f91b98cba727d7c1de8b10738be431ade,54,200.01909988461742,active
0xefa5f0435f230579dc95f219a1a8929f91b98cba727d7c1de8b10738be431ade,55,199.27824234960264,active
0xefa5f0435f230579dc95f219a1a8929f91b98cba727d7c1de8b10738be431ade,56,198.7022704207251,active
0xefa5f0435f230579dc95f219a1a8929f91b98cba727d7c1de8b10738be431ade,57,198.67567121695848,active
0xefa5f0435f230579dc95f219a1a8929f91b98cba727d7c1de8b10738be431ade,58,198.35133822671054,active
0xefa5f0435f230579dc95f219a1a8929f91b98cba727d7c1de8b10738be431ade,59,198.16515037896158,active
0xefa5f0435f230579dc95f219a1a8929f91b98cba727d7c1de8b10738be431ade,60,198.22830696639286,active
0xefa5f0435f230579dc95f219a1a8929f91b98cba727d7c1de8b10738be431ade,61,198.08629359546345,active
0xefa5f0435f230579dc95f219a1a8929f91b98cba727d7c1de8b10738be431ade,62,198.03270584801203,active
0xefa5f0435f230579dc95f219a1a8929f91b98cba727d7c1de8b10738be431ade,63,198.28570368300495,active
0xefa5f0435f230579dc95f219a1a8929f91b98cba727d7c1de8b10738be431ade,64,198.18643296263448,active
0xefa5f0435f230579dc95f219a1a8929f91b98cba727d7c1de8b10738be431ade,65,210.74827002772403,active
0xefa5f0435f230579dc95f219a1a8929f91b98cba727d7c1de8b10738be431ade,66,210.76111263336244,active
0xefa5f0435f230579dc95f219a1a8929f91b98cba727d7c1de8b10738be431ade,67,210.63604860903254,active
0xefa5f0435f230579dc95f219a1a8929f91b98cba727d7c1de8b10738be431ade,68,210.3354668113696,active
0xefa5f0435f230579dc95f219a1a8929f91b98cba727d7c1de8b10738be431ade,69,210.777297877169,active
0xefa5f0435f230579dc95f219a1a8929f91b98cba727d7c1de8b10738be431ade,70,209.0887861539608,active
0xefa5f0435f230579dc95f219a1a8929f91b98cba727d7c1de8b10738be431ade,71,209.00673613499413,active
0xefa5f0435f230579dc95f219a1a8929f91b98cba727d7c1de8b10738be431ade,72,208.99875490204658,active
0xefa5f0435f230579dc95f219a1a8929f91b98cba727d7c1de8b10738be431ade,73,203.89555479393348,active
0xefa5f0435f230579dc95f219a1a8929f91b98cba727d7c1de8b10738be431ade,74,198.13180880955454,active
0xefa5f0435f230579dc95f219a1a8929f91b98cba727d7c1de8b10738be431ade,75,198.11252545237767,active
0xefa5f0435f230579dc95f219a1a8929f91b98cba727d7c1de8b10738be431ade,76,198.0964037319108,active
0xefa5f0435f230579dc95f219a1a8929f91b98cba727d7c1de8b10738be431ade,77,198.2896821161984,active
0xefa5f0435f230579dc95f219a1a8929f91b98cba727d7c1de8b10738be431ade,78,198.25256996638544,active
0xefa5f0435f230579dc95f219a1a8929f91b98cba727d7c1de8b10738be431ade,79,198.43846452184596,active
0xefa5f0435f230579dc95f219a1a8929f91b98cba727d7c1de8b10738be431ade,80,205.88355520420163,active
0xefa5f0435f230579dc95f219a1a8929f91b98cba727d7c1de8b10738be431ade,81,198.45136840435788,active
0xefa5f0435f230579dc95f219a1a8929f91b98cba727d7c1de8b10738be431ade,82,198.4508282945017,active
0xefa5f0435f230579dc95f219a1a8929f91b98cba727d7c1de8b10738be431ade,83,199.27585698956707,active
0xefa5f0435f230579dc95f219a1a8929f91b98cba727d7c1de8b10738be431ade,84,198.5221539666959,active
0xefa5f0435f230579dc95f219a1a8929f91b98cba727d7c1de8b10738be431ade,85,199.06286454612666,active
0xefa5f0435f230579dc95f219a1a8929f91b98cba727d7c1de8b10738be431ade,86,199.89336914738962,active
0xefa5f0435f230579dc95f219a1a8929f91b98cba727d7c1de8b10738be431ade,87,199.9637989109939,active
0xefa5f0435f230579dc95f219a1a8929f91b98cba727d7c1de8b10738be431ade,88,199.85267746907292,active
0xefa5f0435f230579dc95f219a1a8929f91b98cba727d7c1de8b10738be431ade,89,199.98944150161552,active
0xefa5f0435f230579dc95f219a1a8929f91b98cba727d7c1de8b10738be431ade,90,199.9404897660148,active
0xefa5f0435f230579dc95f219a1a8929f91b98cba727d7c1de8b10738be431ade,91,200.3951983032609,active
0xefa5f0435f230579dc95f219a1a8929f91b98cba727d7c1de8b10738be431ade,92,200.99757024939285,active
0xefa5f0435f230579dc95f219a1a8929f91b98cba727d7c1de8b10738be431ade,93,202.73278572325194,active
0xefa5f0435f230579dc95f219a1a8929f91b98cba727d7c1de8b10738be431ade,94,203.95917511171484,active
0xefa5f0435f230579dc95f219a1a8929f91b98cba727d7c1de8b10738be431ade,95,203.89154561300802,active
0xefa5f0435f230579dc95f219a1a8929f91b98cba727d7c1de8b10738be431ade,96,204.43516714851827,active
0xefa5f0435f230579dc95f219a1a8929f91b98cba727d7c1de8b10738be431ade,97,203.56010052857394,active
0xefa5f0435f230579dc95f219a1a8929f91b98cba727d7c1de8b10738be431ade,98,205.09831424856227,active
0xefa5f0435f230579dc95f219a1a8929f91b98cba727d7c1de8b10738be431ade,99,205.24900326212583,active
0xefa5f0435f230579dc95f219a1a8929f91b98cba727d7c1de8b10738be431ade,100,205.9026897756515,active
0xefa5f0435f230579dc95f219a1a8929f91b98cba727d7c1de8b10738be431ade,101,206.5398748252718,active
0xefa5f0435f230579dc95f219a1a8929f91b98cba727d7c1de8b10738be431ade,102,207.57622000113025,active
0xefa5f0435f230579dc95f219a1a8929f91b98cba727d7c1de8b10738be431ade,103,208.6211396594625,active
0xefa5f0435f230579dc95f219a1a8929f91b98cba727d7c1de8b10738be431ade,104,208.07898286843616,active
0xefa5f0435f230579dc95f219a1a8929f91b98cba727d7c1de8b10738be431ade,105,208.78004097014158,active
0xefa5f0435f230579dc95f219a1a8929f91b98cba727d7c1de8b10738be431ade,106,206.5638057595368,active
0xefa5f0435f230579dc95f219a1a8929f91b98cba727d7c1de8b10738be431ade,107,201.07677968449198,active
0xefa5f0435f230579dc95f219a1a8929f91b98cba727d7c1de8b10738be431ade,108,199.73646611053684,active
0xefa5f0435f230579dc95f219a1a8929f91b98cba727d7c1de8b10738be431ade,109,199.76098877211962,active
0xefa5f0435f230579dc95f219a1a8929f91b98cba727d7c1de8b10738be431ade,110,179.72956982385543,active
0xefa5f0435f230579dc95f219a1a8929f91b98cba727d7c1de8b10738be431ade,111,179.6555777210496,active
0xefa5f0435f230579dc95f219a1a8929f91b98cba727d7c1de8b10738be431ade,112,179.8256028138659,active
0xefa5f0435f230579dc95f219a1a8929f91b98cba727d7c1de8b10738be431ade,113,179.81585100848065,active
0xefa5f0435f230579dc95f219a1a8929f91b98cba727d7c1de8b10738be431ade,114,179.80846660794805,active
0xefa5f0435f230579dc95f219a1a8929f91b98cba727d7c1de8b10738be431ade,115,179.80359445912853,active
0xefa5f0435f230579dc95f219a1a8929f91b98cba727d7c1de8b10738be431ade,116,179.74067155455768,active
0xefa5f0435f230579dc95f219a1a8929f91b98cba727d7c1de8b10738be431ade,117,179.7206190795079,active
0xefa5f0435f230579dc95f219a1a8929f91b98cba727d7c1de8b10738be431ade,118,179.49042145424858,active
0xefa5f0435f230579dc95f219a1a8929f91b98cba727d7c1de8b10738be431ade,119,179.39511440785637,active
0xefa5f0435f230579dc95f219a1a8929f91b98cba727d7c1de8b10738be431ade,120,179.35883400353308,active
0xefa5f0435f230579dc95f219a1a8929f91b98cba727d7c1de8b10738be431ade,121,179.24751223674653,active
0xefa5f0435f230579dc95f219a1a8929f91b98cba727d7c1de8b10738be431ade,122,179.28753800727694,active
0xefa5f0435f230579dc95f219a1a8929f91b98cba727d7c1de8b10738be431ade,123,179.24878452176821,active
0xefa5f0435f230579dc95f219a1a8929f91b98cba727d7c1de8b10738be431ade,124,179.25621615865052,active
0xefa5f0435f230579dc95f219a1a8929f91b98cba727d7c1de8b10738be431ade,125,179.23696923327103,active
0xefa5f0435f230579dc95f219a1a8929f91b98cba727d7c1de8b10738be431ade,126,179.25484612515478,active
0xefa5f0435f230579dc95f219a1a8929f91b98cba727d7c1de8b10738be431ade,127,179.63269359918095,active
0xefa5f0435f230579dc95f219a1a8929f91b98cba727d7c1de8b10738be431ade,128,179.57648736005714,active
0xefa5f0435f230579dc95f219a1a8929f91b98cba727d7c1de8b10738be431ade,129,179.56095982104077,active
0xefa5f0435f230579dc95f219a1a8929f91b98cba727d7c1de8b10738be431ade,130,179.60506358726877,active
0xefa5f0435f230579dc95f219a1a8929f91b98cba727d7c1de8b10738be431ade,131,180.0678000739704,active
0xefa5f0435f230579dc95f219a1a8929f91b98cba727d7c1de8b10738be431ade,132,180.05652503564534,active
0xefa5f0435f230579dc95f219a1a8929f91b98cba727d7c1de8b10738be431ade,133,179.67055119404725,active
0xefa5f0435f230579dc95f219a1a8929f91b98cba727d7c1de8b10738be431ade,134,179.84757885633354,active
0xefa5f0435f230579dc95f219a1a8929f91b98cba727d7c1de8b10738be431ade,135,179.60397735372348,active
0xefa5f0435f230579dc95f219a1a8929f91b98cba727d7c1de8b10738be431ade,136,179.71725325265666,active
0xefa5f0435f230579dc95f219a1a8929f91b98cba727d7c1de8b10738be431ade,137,179.79826258391236,active
0xefa5f0435f230579dc95f219a1a8929f91b98cba727d7c1de8b10738be431ade,138,179.66631024323297,active
0xefa5f0435f230579dc95f219a1a8929f91b98cba727d7c1de8b10738be431ade,139,179.5368726301891,active
0xefa5f0435f230579dc95f219a1a8929f91b98cba727d7c1de8b10738be431ade,140,179.67214468361135,active
0xefa5f0435f230579dc95f219a1a8929f91b98cba727d7c1de8b10738be431ade,141,179.8053420711894,active
0xefa5f0435f230579dc95f219a1a8929f91b98cba727d7c1de8b10738be431ade,142,179.88128304717512,active
0xefa5f0435f230579dc95f219a1a8929f91b98cba727d7c1de8b10738be431ade,143,179.90884619996433,active
0xefa5f0435f230579dc95f219a1a8929f91b98cba727d7c1de8b10738be431ade,144,180.0405781820098,active
0xefa5f0435f230579dc95f219a1a8929f91b98cba727d7c1de8b10738be431ade,145,180.0159647713202,active
0xefa5f0435f230579dc95f219a1a8929f91b98cba727d7c1de8b10738be431ade,146,180.16636423861885,active
0xefa5f0435f230579dc95f219a1a8929f91b98cba727d7c1de8b10738be431ade,147,180.31888289998102,active
0xefa5f0435f230579dc95f219a1a8929f91b98cba727d7c1de8b10738be431ade,148,180.5676872601596,active
0xefa5f0435f230579dc95f219a1a8929f91b98cba727d7c1de8b10738be431ade,149,181.75148894425755,active
0xefa5f0435f230579dc95f219a1a8929f91b98cba727d7c1de8b10738be431ade,150,181.7228393318398,active
0xefa5f0435f230579dc95f219a1a8929f91b98cba727d7c1de8b10738be431ade,151,181.7321537906617,active
0xefa5f0435f230579dc95f219a1a8929f91b98cba727d7c1de8b10738be431ade,152,181.74373412556477,active
0xefa5f0435f230579dc95f219a1a8929f91b98cba727d7c1de8b10738be431ade,153,181.61503716160112,active
0xefa5f0435f230579dc95f219a1a8929f91b98cba727d7c1de8b10738be431ade,154,181.80262101376078,active
0xefa5f0435f230579dc95f219a1a8929f91b98cba727d7c1de8b10738be431ade,155,181.78599634816518,active
0xefa5f0435f230579dc95f219a1a8929f91b98cba727d7c1de8b10738be431ade,156,181.61265776845877,active
0xefa5f0435f230579dc95f219a1a8929f91b98cba727d7c1de8b10738be431ade,157,181.6272217014024,active
0xefa5f0435f230579dc95f219a1a8929f91b98cba727d7c1de8b10738be431ade,158,181.61852465481684,active
0xefa5f0435f230579dc95f219a1a8929f91b98cba727d7c1de8b10738be431ade,159,181.6513845665071,active
0xefa5f0435f230579dc95f219a1a8929f91b98cba727d7c1de8b10738be431ade,160,176.09431970951118,active
0xefa5f0435f230579dc95f219a1a8929f91b98cba727d7c1de8b10738be431ade,161,175.89691335667635,active
0xefa5f0435f230579dc95f219a1a8929f91b98cba727d7c1de8b10738be431ade,162,176.54149432331025,active
0xefa5f0435f230579dc95f219a1a8929f91b98cba727d7c1de8b10738be431ade,163,176.55804888808487,active
0xefa5f0435f230579dc95f219a1a8929f91b98cba727d7c1de8b10738be431ade,164,176.58432339858578,active
0xefa5f0435f230579dc95f219a1a8929f91b98cba727d7c1de8b10738be431ade,165,176.51836026693337,active
0xefa5f0435f230579dc95f219a1a8929f91b98cba727d7c1de8b10738be431ade,166,176.56588490373244,active
0xefa5f0435f230579dc95f219a1a8929f91b98cba727d7c1de8b10738be431ade,167,165.75760987761865,active
0xefa5f0435f230579dc95f219a1a8929f91b98cba727d7c1de8b10738be431ade,168,166.35097108144328,active
0xefa5f0435f230579dc95f219a1a8929f91b98cba727d7c1de8b10738be431ade,169,166.727915578187,active
0xefa5f0435f230579dc95f219a1a8929f91b98cba727d7c1de8b10738be431ade,170,166.9141962429552,active
0xefa5f0435f230579dc95f219a1a8929f91b98cba727d7c1de8b10738be431ade,171,166.70000923875338,active
0xefa5f0435f230579dc95f219a1a8929f91b98cba727d7c1de8b10738be431ade,172,164.29035262121576,active
0xefa5f0435f230579dc95f219a1a8929f91b98cba727d7c1de8b10738be431ade,173,164.25782909913409,active
