validator(0xefa5f0435f230579dc95f219a1a8929f91b98cba727d7c1de8b10738be431ade15).csv
Validator,epoch,earned,active
0xefa5f0435f230579dc95f219a1a8929f91b98cba727d7c1de8b10738be431ade,0,NaN,active
0xefa5f0435f230579dc95f219a1a8929f91b98cba727d7c1de8b10738be431ade,1,0.000025768421052631578,active
0xefa5f0435f230579dc95f219a1a8929f91b98cba727d7c1de8b10738be431ade,2,2.526315789472577e-7,active
0xefa5f0435f230579dc95f219a1a8929f91b98cba727d7c1de8b10738be431ade,3,5.052631573518031e-7,active
0xefa5f0435f230579dc95f219a1a8929f91b98cba727d7c1de8b10738be431ade,4,0,active
0xefa5f0435f230579dc95f219a1a8929f91b98cba727d7c1de8b10738be431ade,5,0,active
0xefa5f0435f230579dc95f219a1a8929f91b98cba727d7c1de8b10738be431ade,6,2.548212348267303e-7,active
0xefa5f0435f230579dc95f219a1a8929f91b98cba727d7c1de8b10738be431ade,7,2.548212348267292e-7,active
0xefa5f0435f230579dc95f219a1a8929f91b98cba727d7c1de8b10738be431ade,8,0,active
0xefa5f0435f230579dc95f219a1a8929f91b98cba727d7c1de8b10738be431ade,9,0,active
0xefa5f0435f230579dc95f219a1a8929f91b98cba727d7c1de8b10738be431ade,10,0,active
0xefa5f0435f230579dc95f219a1a8929f91b98cba727d7c1de8b10738be431ade,11,0,active
0xefa5f0435f230579dc95f219a1a8929f91b98cba727d7c1de8b10738be431ade,12,0.0000015289274106168452,active
0xefa5f0435f230579dc95f219a1a8929f91b98cba727d7c1de8b10738be431ade,13,0.0000030578548212336107,active
0xefa5f0435f230579dc95f219a1a8929f91b98cba727d7c1de8b10738be431ade,14,7.644637053083629e-7,active
0xefa5f0435f230579dc95f219a1a8929f91b98cba727d7c1de8b10738be431ade,15,0.00038389073889469555,active
0xefa5f0435f230579dc95f219a1a8929f91b98cba727d7c1de8b10738be431ade,16,0.00031470471868379494,active
0xefa5f0435f230579dc95f219a1a8929f91b98cba727d7c1de8b10738be431ade,17,0.00017710075839433095,active
0xefa5f0435f230579dc95f219a1a8929f91b98cba727d7c1de8b10738be431ade,18,0.000027397061145602208,active
0xefa5f0435f230579dc95f219a1a8929f91b98cba727d7c1de8b10738be431ade,19,0.0005751108519291845,active
0xefa5f0435f230579dc95f219a1a8929f91b98cba727d7c1de8b10738be431ade,20,277.9416103857514,active
0xefa5f0435f230579dc95f219a1a8929f91b98cba727d7c1de8b10738be431ade,21,274.7266381419983,active
0xefa5f0435f230579dc95f219a1a8929f91b98cba727d7c1de8b10738be431ade,22,279.2740772797625,active
0xefa5f0435f230579dc95f219a1a8929f91b98cba727d7c1de8b10738be431ade,23,277.6052015428652,active
0xefa5f0435f230579dc95f219a1a8929f91b98cba727d7c1de8b10738be431ade,24,256.9235819533001,active
0xefa5f0435f230579dc95f219a1a8929f91b98cba727d7c1de8b10738be431ade,25,245.96846208958144,active
0xefa5f0435f230579dc95f219a1a8929f91b98cba727d7c1de8b10738be431ade,26,234.5280616394959,active
0xefa5f0435f230579dc95f219a1a8929f91b98cba727d7c1de8b10738be431ade,27,216.89744820777972,active
0xefa5f0435f230579dc95f219a1a8929f91b98cba727d7c1de8b10738be431ade,28,204.77868430058754,active
0xefa5f0435f230579dc95f219a1a8929f91b98cba727d7c1de8b10738be431ade,29,202.23340096120162,active
0xefa5f0435f230579dc95f219a1a8929f91b98cba727d7c1de8b10738be431ade,30,198.41206134930152,active
0xefa5f0435f230579dc95f219a1a8929f91b98cba727d7c1de8b10738be431ade,31,197.94556547376158,active
0xefa5f0435f230579dc95f219a1a8929f91b98cba727d7c1de8b10738be431ade,32,198.20372417685363,active
0xefa5f0435f230579dc95f219a1a8929f91b98cba727d7c1de8b10738be431ade,33,197.79897394529962,active
0xefa5f0435f230579dc95f219a1a8929f91b98cba727d7c1de8b10738be431ade,34,197.6619341993578,active
0xefa5f0435f230579dc95f219a1a8929f91b98cba727d7c1de8b10738be431ade,35,192.87215065861963,active
0xefa5f0435f230579dc95f219a1a8929f91b98cba727d7c1de8b10738be431ade,36,185.83320026976017,active
0xefa5f0435f230579dc95f219a1a8929f91b98cba727d7c1de8b10738be431ade,37,182.65037968316798,active
0xefa5f0435f230579dc95f219a1a8929f91b98cba727d7c1de8b10738be431ade,38,181.75289982073102,active
0xefa5f0435f230579dc95f219a1a8929f91b98cba727d7c1de8b10738be431ade,39,181.38439723487826,active
0xefa5f0435f230579dc95f219a1a8929f91b98cba727d7c1de8b10738be431ade,40,180.69006115956384,active
0xefa5f0435f230579dc95f219a1a8929f91b98cba727d7c1de8b10738be431ade,41,180.11589023119828,active
0xefa5f0435f230579dc95f219a1a8929f91b98cba727d7c1de8b10738be431ade,42,179.52142530513527,active
0xefa5f0435f230579dc95f219a1a8929f91b98cba727d7c1de8b10738be431ade,43,178.1713386910301,active
0xefa5f0435f230579dc95f219a1a8929f91b98cba727d7c1de8b10738be431ade,44,178.15370903550593,active
0xefa5f0435f230579dc95f219a1a8929f91b98cba727d7c1de8b10738be431ade,45,178.1228354825165,active
0xefa5f0435f230579dc95f219a1a8929f91b98cba727d7c1de8b10738be431ade,46,178.13425594677028,active
0xefa5f0435f230579dc95f219a1a8929f91b98cba727d7c1de8b10738be431ade,47,178.0521428450804,active
0xefa5f0435f230579dc95f219a1a8929f91b98cba727d7c1de8b10738be431ade,48,178.33702216292085,active
0xefa5f0435f230579dc95f219a1a8929f91b98cba727d7c1de8b10738be431ade,49,177.71337142599964,active
0xefa5f0435f230579dc95f219a1a8929f91b98cba727d7c1de8b10738be431ade,50,177.75064739719514,active
0xefa5f0435f230579dc95f219a1a8929f91b98cba727d7c1de8b10738be431ade,51,177.7384601723568,active
0xefa5f0435f230579dc95f219a1a8929f91b98cba727d7c1de8b10738be431ade,52,177.75658304316227,active
0xefa5f0435f230579dc95f219a1a8929f91b98cba727d7c1de8b10738be431ade,53,177.74608203783123,active
0xefa5f0435f230579dc95f219a1a8929f91b98cba727d7c1de8b10738be431ade,54,177.79475545299334,active
0xefa5f0435f230579dc95f219a1a8929f91b98cba727d7c1de8b10738be431ade,55,177.13621542186888,active
0xefa5f0435f230579dc95f219a1a8929f91b98cba727d7c1de8b10738be431ade,56,176.6242403739779,active
0xefa5f0435f230579dc95f219a1a8929f91b98cba727d7c1de8b10738be431ade,57,176.60059663729632,active
0xefa5f0435f230579dc95f219a1a8929f91b98cba727d7c1de8b10738be431ade,58,176.3123006459649,active
0xefa5f0435f230579dc95f219a1a8929f91b98cba727d7c1de8b10738be431ade,59,176.1468003368547,active
0xefa5f0435f230579dc95f219a1a8929f91b98cba727d7c1de8b10738be431ade,60,176.20293952568247,active
0xefa5f0435f230579dc95f219a1a8929f91b98cba727d7c1de8b10738be431ade,61,176.07670541818968,active
0xefa5f0435f230579dc95f219a1a8929f91b98cba727d7c1de8b10738be431ade,62,176.0290718648996,active
0xefa5f0435f230579dc95f219a1a8929f91b98cba727d7c1de8b10738be431ade,63,176.25395882933762,active
0xefa5f0435f230579dc95f219a1a8929f91b98cba727d7c1de8b10738be431ade,64,176.16571818900832,active
0xefa5f0435f230579dc95f219a1a8929f91b98cba727d7c1de8b10738be431ade,65,187.33179558019913,active
0xefa5f0435f230579dc95f219a1a8929f91b98cba727d7c1de8b10738be431ade,66,187.34321122965542,active
0xefa5f0435f230579dc95f219a1a8929f91b98cba727d7c1de8b10738be431ade,67,187.23204320802895,active
0xefa5f0435f230579dc95f219a1a8929f91b98cba727d7c1de8b10738be431ade,68,186.964859387884,active
0xefa5f0435f230579dc95f219a1a8929f91b98cba727d7c1de8b10738be431ade,69,187.357598113039,active
0xefa5f0435f230579dc95f219a1a8929f91b98cba727d7c1de8b10738be431ade,70,185.85669880352077,active
0xefa5f0435f230579dc95f219a1a8929f91b98cba727d7c1de8b10738be431ade,71,185.78376545332816,active
0xefa5f0435f230579dc95f219a1a8929f91b98cba727d7c1de8b10738be431ade,72,185.77667102404135,active
0xefa5f0435f230579dc95f219a1a8929f91b98cba727d7c1de8b10738be431ade,73,181.24049315016305,active
0xefa5f0435f230579dc95f219a1a8929f91b98cba727d7c1de8b10738be431ade,74,176.11716338627056,active
0xefa5f0435f230579dc95f219a1a8929f91b98cba727d7c1de8b10738be431ade,75,176.10002262433565,active
0xefa5f0435f230579dc95f219a1a8929f91b98cba727d7c1de8b10738be431ade,76,176.08569220614294,active
0xefa5f0435f230579dc95f219a1a8929f91b98cba727d7c1de8b10738be431ade,77,176.25749521439866,active
0xefa5f0435f230579dc95f219a1a8929f91b98cba727d7c1de8b10738be431ade,78,176.22450663678697,active
0xefa5f0435f230579dc95f219a1a8929f91b98cba727d7c1de8b10738be431ade,79,176.38974624164086,active
0xefa5f0435f230579dc95f219a1a8929f91b98cba727d7c1de8b10738be431ade,80,183.00760462595701,active
0xefa5f0435f230579dc95f219a1a8929f91b98cba727d7c1de8b10738be431ade,81,176.4012163594293,active
0xefa5f0435f230579dc95f219a1a8929f91b98cba727d7c1de8b10738be431ade,82,176.40073626177923,active
0xefa5f0435f230579dc95f219a1a8929f91b98cba727d7c1de8b10738be431ade,83,177.13409510183754,active
0xefa5f0435f230579dc95f219a1a8929f91b98cba727d7c1de8b10738be431ade,84,176.46413685928528,active
0xefa5f0435f230579dc95f219a1a8929f91b98cba727d7c1de8b10738be431ade,85,176.94476848544608,active
0xefa5f0435f230579dc95f219a1a8929f91b98cba727d7c1de8b10738be431ade,86,177.6829947976797,active
0xefa5f0435f230579dc95f219a1a8929f91b98cba727d7c1de8b10738be431ade,87,177.7455990319947,active
0xefa5f0435f230579dc95f219a1a8929f91b98cba727d7c1de8b10738be431ade,88,177.6468244169537,active
0xefa5f0435f230579dc95f219a1a8929f91b98cba727d7c1de8b10738be431ade,89,177.76839244588038,active
0xefa5f0435f230579dc95f219a1a8929f91b98cba727d7c1de8b10738be431ade,90,177.72487979201318,active
0xefa5f0435f230579dc95f219a1a8929f91b98cba727d7c1de8b10738be431ade,91,178.12906515845432,active
0xefa5f0435f230579dc95f219a1a8929f91b98cba727d7c1de8b10738be431ade,92,178.66450688834914,active
0xefa5f0435f230579dc95f219a1a8929f91b98cba727d7c1de8b10738be431ade,93,180.20692064289065,active
0xefa5f0435f230579dc95f219a1a8929f91b98cba727d7c1de8b10738be431ade,94,181.2970445437464,active
0xefa5f0435f230579dc95f219a1a8929f91b98cba727d7c1de8b10738be431ade,95,181.23692943378506,active
0xefa5f0435f230579dc95f219a1a8929f91b98cba727d7c1de8b10738be431ade,96,181.72014857646087,active
0xefa5f0435f230579dc95f219a1a8929f91b98cba727d7c1de8b10738be431ade,97,180.9423115809547,active
0xefa5f0435f230579dc95f219a1a8929f91b98cba727d7c1de8b10738be431ade,98,182.3096126653886,active
0xefa5f0435f230579dc95f219a1a8929f91b98cba727d7c1de8b10738be431ade,99,182.44355845522287,active
0xefa5f0435f230579dc95f219a1a8929f91b98cba727d7c1de8b10738be431ade,100,183.02461313391248,active
0xefa5f0435f230579dc95f219a1a8929f91b98cba727d7c1de8b10738be431ade,101,183.59099984468617,active
0xefa5f0435f230579dc95f219a1a8929f91b98cba727d7c1de8b10738be431ade,102,184.51219555656013,active
0xefa5f0435f230579dc95f219a1a8929f91b98cba727d7c1de8b10738be431ade,103,185.44101303063331,active
0xefa5f0435f230579dc95f219a1a8929f91b98cba727d7c1de8b10738be431ade,104,184.95909588305437,active
0xefa5f0435f230579dc95f219a1a8929f91b98cba727d7c1de8b10738be431ade,105,185.58225864012573,active
0xefa5f0435f230579dc95f219a1a8929f91b98cba727d7c1de8b10738be431ade,106,183.61227178625498,active
0xefa5f0435f230579dc95f219a1a8929f91b98cba727d7c1de8b10738be431ade,107,178.734915275104,active
0xefa5f0435f230579dc95f219a1a8929f91b98cba727d7c1de8b10738be431ade,108,177.54352543158834,active
0xefa5f0435f230579dc95f219a1a8929f91b98cba727d7c1de8b10738be431ade,109,177.56532335299516,active
0xefa5f0435f230579dc95f219a1a8929f91b98cba727d7c1de8b10738be431ade,110,159.75961762120468,active
0xefa5f0435f230579dc95f219a1a8929f91b98cba727d7c1de8b10738be431ade,111,159.6938468631554,active
0xefa5f0435f230579dc95f219a1a8929f91b98cba727d7c1de8b10738be431ade,112,159.84498027899184,active
0xefa5f0435f230579dc95f219a1a8929f91b98cba727d7c1de8b10738be431ade,113,159.8363120075382,active
0xefa5f0435f230579dc95f219a1a8929f91b98cba727d7c1de8b10738be431ade,114,159.82974809595382,active
0xefa5f0435f230579dc95f219a1a8929f91b98cba727d7c1de8b10738be431ade,115,159.8254172970033,active
0xefa5f0435f230579dc95f219a1a8929f91b98cba727d7c1de8b10738be431ade,116,159.7694858262736,active
0xefa5f0435f230579dc95f219a1a8929f91b98cba727d7c1de8b10738be431ade,117,159.75166140400688,active
0xefa5f0435f230579dc95f219a1a8929f91b98cba727d7c1de8b10738be431ade,118,159.54704129266517,active
0xefa5f0435f230579dc95f219a1a8929f91b98cba727d7c1de8b10738be431ade,119,159.4623239180945,active
0xefa5f0435f230579dc95f219a1a8929f91b98cba727d7c1de8b10738be431ade,120,159.4300746698074,active
0xefa5f0435f230579dc95f219a1a8929f91b98cba727d7c1de8b10738be431ade,121,159.33112198821922,active
0xefa5f0435f230579dc95f219a1a8929f91b98cba727d7c1de8b10738be431ade,122,159.36670045091302,active
0xefa5f0435f230579dc95f219a1a8929f91b98cba727d7c1de8b10738be431ade,123,159.33225290823842,active
0xefa5f0435f230579dc95f219a1a8929f91b98cba727d7c1de8b10738be431ade,124,159.33885880768943,active
0xefa5f0435f230579dc95f219a1a8929f91b98cba727d7c1de8b10738be431ade,125,159.32175042957405,active
0xefa5f0435f230579dc95f219a1a8929f91b98cba727d7c1de8b10738be431ade,126,159.33764100013735,active
0xefa5f0435f230579dc95f219a1a8929f91b98cba727d7c1de8b10738be431ade,127,159.67350542149404,active
0xefa5f0435f230579dc95f219a1a8929f91b98cba727d7c1de8b10738be431ade,128,159.62354432005102,active
0xefa5f0435f230579dc95f219a1a8929f91b98cba727d7c1de8b10738be431ade,129,159.60974206314745,active
0xefa5f0435f230579dc95f219a1a8929f91b98cba727d7c1de8b10738be431ade,130,159.64894541090584,active
0xefa5f0435f230579dc95f219a1a8929f91b98cba727d7c1de8b10738be431ade,131,160.06026673241834,active
0xefa5f0435f230579dc95f219a1a8929f91b98cba727d7c1de8b10738be431ade,132,160.0502444761293,active
0xefa5f0435f230579dc95f219a1a8929f91b98cba727d7c1de8b10738be431ade,133,159.707156616931,active
0xefa5f0435f230579dc95f219a1a8929f91b98cba727d7c1de8b10738be431ade,134,159.8645145389631,active
0xefa5f0435f230579dc95f219a1a8929f91b98cba727d7c1de8b10738be431ade,135,159.64797986997638,active
0xefa5f0435f230579dc95f219a1a8929f91b98cba727d7c1de8b10738be431ade,136,159.74866955791714,active
0xefa5f0435f230579dc95f219a1a8929f91b98cba727d7c1de8b10738be431ade,137,159.8206778523664,active
0xefa5f0435f230579dc95f219a1a8929f91b98cba727d7c1de8b10738be431ade,138,159.70338688287373,active
0xefa5f0435f230579dc95f219a1a8929f91b98cba727d7c1de8b10738be431ade,139,159.5883312268348,active
0xefa5f0435f230579dc95f219a1a8929f91b98cba727d7c1de8b10738be431ade,140,159.70857305209907,active
0xefa5f0435f230579dc95f219a1a8929f91b98cba727d7c1de8b10738be431ade,141,159.826970729946,active
0xefa5f0435f230579dc95f219a1a8929f91b98cba727d7c1de8b10738be431ade,142,159.89447381971146,active
0xefa5f0435f230579dc95f219a1a8929f91b98cba727d7c1de8b10738be431ade,143,159.9189743999683,active
0xefa5f0435f230579dc95f219a1a8929f91b98cba727d7c1de8b10738be431ade,144,160.03606949511973,active
0xefa5f0435f230579dc95f219a1a8929f91b98cba727d7c1de8b10738be431ade,145,160.01419090784006,active
0xefa5f0435f230579dc95f219a1a8929f91b98cba727d7c1de8b10738be431ade,146,160.14787932321667,active
0xefa5f0435f230579dc95f219a1a8929f91b98cba727d7c1de8b10738be431ade,147,160.28345146664984,active
0xefa5f0435f230579dc95f219a1a8929f91b98cba727d7c1de8b10738be431ade,148,160.5046108979198,active
0xefa5f0435f230579dc95f219a1a8929f91b98cba727d7c1de8b10738be431ade,149,161.55687906156228,active
0xefa5f0435f230579dc95f219a1a8929f91b98cba727d7c1de8b10738be431ade,150,161.53141273941313,active
0xefa5f0435f230579dc95f219a1a8929f91b98cba727d7c1de8b10738be431ade,151,161.53969225836605,active
0xefa5f0435f230579dc95f219a1a8929f91b98cba727d7c1de8b10738be431ade,152,161.54998588939097,active
0xefa5f0435f230579dc95f219a1a8929f91b98cba727d7c1de8b10738be431ade,153,161.43558858808976,active
0xefa5f0435f230579dc95f219a1a8929f91b98cba727d7c1de8b10738be431ade,154,161.60232979000958,active
0xefa5f0435f230579dc95f219a1a8929f91b98cba727d7c1de8b10738be431ade,155,161.58755230948023,active
0xefa5f0435f230579dc95f219a1a8929f91b98cba727d7c1de8b10738be431ade,156,161.43347357196313,active
0xefa5f0435f230579dc95f219a1a8929f91b98cba727d7c1de8b10738be431ade,157,161.44641929013534,active
0xefa5f0435f230579dc95f219a1a8929f91b98cba727d7c1de8b10738be431ade,158,161.4386885820593,active
0xefa5f0435f230579dc95f219a1a8929f91b98cba727d7c1de8b10738be431ade,159,161.46789739245065,active
0xefa5f0435f230579dc95f219a1a8929f91b98cba727d7c1de8b10738be431ade,160,156.52828418623227,active
0xefa5f0435f230579dc95f219a1a8929f91b98cba727d7c1de8b10738be431ade,161,156.35281187260114,active
0xefa5f0435f230579dc95f219a1a8929f91b98cba727d7c1de8b10738be431ade,162,156.9257727318313,active
0xefa5f0435f230579dc95f219a1a8929f91b98cba727d7c1de8b10738be431ade,163,156.94048790052014,active
0xefa5f0435f230579dc95f219a1a8929f91b98cba727d7c1de8b10738be431ade,164,156.96384302096513,active
0xefa5f0435f230579dc95f219a1a8929f91b98cba727d7c1de8b10738be431ade,165,156.90520912616293,active
0xefa5f0435f230579dc95f219a1a8929f91b98cba727d7c1de8b10738be431ade,166,156.94745324776218,active
0xefa5f0435f230579dc95f219a1a8929f91b98cba727d7c1de8b10738be431ade,167,147.34009766899447,active
0xefa5f0435f230579dc95f219a1a8929f91b98cba727d7c1de8b10738be431ade,168,147.86752985017176,active
0xefa5f0435f230579dc95f219a1a8929f91b98cba727d7c1de8b10738be431ade,169,148.20259162505494,active
0xefa5f0435f230579dc95f219a1a8929f91b98cba727d7c1de8b10738be431ade,170,148.36817443818236,active
0xefa5f0435f230579dc95f219a1a8929f91b98cba727d7c1de8b10738be431ade,171,148.1777859900029,active
0xefa5f0435f230579dc95f219a1a8929f91b98cba727d7c1de8b10738be431ade,172,146.03586899663625,active
0xefa5f0435f230579dc95f219a1a8929f91b98cba727d7c1de8b10738be431ade,173,146.0069591992304,active
0xefa5f0435f230579dc95f219a1a8929f91b98cba727d7c1de8b10738be431ade,174,145.9621658121774,active
0xefa5f0435f230579dc95f219a1a8929f91b98cba727d7c1de8b10738be431ade,175,146.05986963458653,active
0xefa5f0435f230579dc95f219a1a8929f91b98cba727d7c1de8b10738be431ade,176,146.21879335360362,active
0xefa5f0435f230579dc95f219a1a8929f91b98cba727d7c1de8b10738be431ade,177,146.31378422180973,active
0xefa5f0435f230579dc95f219a1a8929f91b98cba727d7c1de8b10738be431ade,178,146.3188754960457,active
0xefa5f0435f230579dc95f219a1a8929f91b98cba727d7c1de8b10738be431ade,179,146.29476495143075,active
0xefa5f0435f230579dc95f219a1a8929f91b98cba727d7c1de8b10738be431ade,180,146.2705868278874,active
0xefa5f0435f230579dc95f219a1a8929f91b98cba727d7c1de8b10738be431ade,181,146.28372504900392,active
0xefa5f0435f230579dc95f219a1a8929f91b98cba727d7c1de8b10738be431ade,182,146.30267418293107,active
0xefa5f0435f230579dc95f219a1a8929f91b98cba727d7c1de8b10738be431ade,183,146.35869888162446,active
0xefa5f0435f230579dc95f219a1a8929f91b98cba727d7c1de8b10738be431ade,184,146.64474228780472,active
0xefa5f0435f230579dc95f219a1a8929f91b98cba727d7c1de8b10738be431ade,185,146.45427025696117,active
0xefa5f0435f230579dc95f219a1a8929f91b98cba727d7c1de8b10738be431ade,186,146.40970583171693,active
0xefa5f0435f230579dc95f219a1a8929f91b98cba727d7c1de8b10738be431ade,187,146.47615342762984,active
0xefa5f0435f230579dc95f219a1a8929f91b98cba727d7c1de8b10738be431ade,188,146.5924409660494,active
0xefa5f0435f230579dc95f219a1a8929f91b98cba727d7c1de8b10738be431ade,189,146.1898775153784,active
0xefa5f0435f230579dc95f219a1a8929f91b98cba727d7c1de8b10738be431ade,190,146.36888627400316,active
0xefa5f0435f230579dc95f219a1a8929f91b98cba727d7c1de8b10738be431ade,191,146.67880777080597,active
0xefa5f0435f230579dc95f219a1a8929f91b98cba727d7c1de8b10738be431ade,192,146.3340680669113,active
0xefa5f0435f230579dc95f219a1a8929f91b98cba727d7c1de8b10738be431ade,193,146.32641626523437,active
0xefa5f0435f230579dc95f219a1a8929f91b98cba727d7c1de8b10738be431ade,194,146.32514580288841,active
0xefa5f0435f230579dc95f219a1a8929f91b98cba727d7c1de8b10738be431ade,195,146.32009378385507,active
0xefa5f0435f230579dc95f219a1a8929f91b98cba727d7c1de8b10738be431ade,196,146.3298027534041,active
0xefa5f0435f230579dc95f219a1a8929f91b98cba727d7c1de8b10738be431ade,197,146.03542350154555,active
0xefa5f0435f230579dc95f219a1a8929f91b98cba727d7c1de8b10738be431ade,198,145.80387458608325,active
0xefa5f0435f230579dc95f219a1a8929f91b98cba727d7c1de8b10738be431ade,199,146.06389542233845,active
0xefa5f0435f230579dc95f219a1a8929f91b98cba727d7c1de8b10738be431ade,200,131.8458708772844,active
0xefa5f0435f230579dc95f219a1a8929f91b98cba727d7c1de8b10738be431ade,201,131.70614071369573,active
0xefa5f0435f230579dc95f219a1a8929f91b98cba727d7c1de8b10738be431ade,202,131.71766882250208,active
