validator(0xefa5f0435f230579dc95f219a1a8929f91b98cba727d7c1de8b10738be431ade10).csv
Validator,epoch,earned,active
0xefa5f0435f230579dc95f219a1a8929f91b98cba727d7c1de8b10738be431ade,0,NaN,active
0xefa5f0435f230579dc95f219a1a8929f91b98cba727d7c1de8b10738be431ade,1,0.000051536842105263155,active
0xefa5f0435f230579dc95f219a1a8929f91b98cba727d7c1de8b10738be431ade,2,5.052631578945154e-7,active
0xefa5f0435f230579dc95f219a1a8929f91b98cba727d7c1de8b10738be431ade,3,0.0000010105263147036062,active
0xefa5f0435f230579dc95f219a1a8929f91b98cba727d7c1de8b10738be431ade,4,0,active
0xefa5f0435f230579dc95f219a1a8929f91b98cba727d7c1de8b10738be431ade,5,0,active
0xefa5f0435f230579dc95f219a1a8929f91b98cba727d7c1de8b10738be431ade,6,5.096424696534606e-7,active
0xefa5f0435f230579dc95f219a1a8929f91b98cba727d7c1de8b10738be431ade,7,5.096424696534583e-7,active
0xefa5f0435f230579dc95f219a1a8929f91b98cba727d7c1de8b10738be431ade,8,0,active
0xefa5f0435f230579dc95f219a1a8929f91b98cba727d7c1de8b10738be431ade,9,0,active
0xefa5f0435f230579dc95f219a1a8929f91b98cba727d7c1de8b10738be431ade,10,0,active
0xefa5f0435f230579dc95f219a1a8929f91b98cba727d7c1de8b10738be431ade,11,0,active
0xefa5f0435f230579dc95f219a1a8929f91b98cba727d7c1de8b10738be431ade,12,0.0000030578548212336903,active
0xefa5f0435f230579dc95f219a1a8929f91b98cba727d7c1de8b10738be431ade,13,0.0000061157096424672215,active
0xefa5f0435f230579dc95f219a1a8929f91b98cba727d7c1de8b10738be431ade,14,0.0000015289274106167257,active
0xefa5f0435f230579dc95f219a1a8929f91b98cba727d7c1de8b10738be431ade,15,0.0007677814777893911,active
0xefa5f0435f230579dc95f219a1a8929f91b98cba727d7c1de8b10738be431ade,16,0.0006294094373675899,active
0xefa5f0435f230579dc95f219a1a8929f91b98cba727d7c1de8b10738be431ade,17,0.0003542015167886619,active
0xefa5f0435f230579dc95f219a1a8929f91b98cba727d7c1de8b10738be431ade,18,0.000054794122291204416,active
0xefa5f0435f230579dc95f219a1a8929f91b98cba727d7c1de8b10738be431ade,19,0.001150221703858369,active
0xefa5f0435f230579dc95f219a1a8929f91b98cba727d7c1de8b10738be431ade,20,555.8832207715028,active
0xefa5f0435f230579dc95f219a1a8929f91b98cba727d7c1de8b10738be431ade,21,549.4532762839966,active
0xefa5f0435f230579dc95f219a1a8929f91b98cba727d7c1de8b10738be431ade,22,558.548154559525,active
0xefa5f0435f230579dc95f219a1a8929f91b98cba727d7c1de8b10738be431ade,23,555.2104030857304,active
0xefa5f0435f230579dc95f219a1a8929f91b98cba727d7c1de8b10738be431ade,24,513.8471639066001,active
0xefa5f0435f230579dc95f219a1a8929f91b98cba727d7c1de8b10738be431ade,25,491.9369241791629,active
0xefa5f0435f230579dc95f219a1a8929f91b98cba727d7c1de8b10738be431ade,26,469.0561232789918,active
0xefa5f0435f230579dc95f219a1a8929f91b98cba727d7c1de8b10738be431ade,27,433.79489641555944,active
0xefa5f0435f230579dc95f219a1a8929f91b98cba727d7c1de8b10738be431ade,28,409.5573686011751,active
0xefa5f0435f230579dc95f219a1a8929f91b98cba727d7c1de8b10738be431ade,29,404.46680192240325,active
0xefa5f0435f230579dc95f219a1a8929f91b98cba727d7c1de8b10738be431ade,30,396.82412269860305,active
0xefa5f0435f230579dc95f219a1a8929f91b98cba727d7c1de8b10738be431ade,31,395.89113094752315,active
0xefa5f0435f230579dc95f219a1a8929f91b98cba727d7c1de8b10738be431ade,32,396.40744835370725,active
0xefa5f0435f230579dc95f219a1a8929f91b98cba727d7c1de8b10738be431ade,33,395.59794789059924,active
0xefa5f0435f230579dc95f219a1a8929f91b98cba727d7c1de8b10738be431ade,34,395.3238683987156,active
0xefa5f0435f230579dc95f219a1a8929f91b98cba727d7c1de8b10738be431ade,35,385.74430131723926,active
0xefa5f0435f230579dc95f219a1a8929f91b98cba727d7c1de8b10738be431ade,36,371.66640053952034,active
0xefa5f0435f230579dc95f219a1a8929f91b98cba727d7c1de8b10738be431ade,37,365.30075936633597,active
0xefa5f0435f230579dc95f219a1a8929f91b98cba727d7c1de8b10738be431ade,38,363.50579964146203,active
0xefa5f0435f230579dc95f219a1a8929f91b98cba727d7c1de8b10738be431ade,39,362.76879446975653,active
0xefa5f0435f230579dc95f219a1a8929f91b98cba727d7c1de8b10738be431ade,40,361.3801223191277,active
0xefa5f0435f230579dc95f219a1a8929f91b98cba727d7c1de8b10738be431ade,41,360.23178046239656,active
0xefa5f0435f230579dc95f219a1a8929f91b98cba727d7c1de8b10738be431ade,42,359.04285061027053,active
0xefa5f0435f230579dc95f219a1a8929f91b98cba727d7c1de8b10738be431ade,43,356.3426773820602,active
0xefa5f0435f230579dc95f219a1a8929f91b98cba727d7c1de8b10738be431ade,44,356.30741807101185,active
0xefa5f0435f230579dc95f219a1a8929f91b98cba727d7c1de8b10738be431ade,45,356.245670965033,active
0xefa5f0435f230579dc95f219a1a8929f91b98cba727d7c1de8b10738be431ade,46,356.26851189354056,active
0xefa5f0435f230579dc95f219a1a8929f91b98cba727d7c1de8b10738be431ade,47,356.1042856901608,active
0xefa5f0435f230579dc95f219a1a8929f91b98cba727d7c1de8b10738be431ade,48,356.6740443258417,active
0xefa5f0435f230579dc95f219a1a8929f91b98cba727d7c1de8b10738be431ade,49,355.4267428519993,active
0xefa5f0435f230579dc95f219a1a8929f91b98cba727d7c1de8b10738be431ade,50,355.5012947943903,active
0xefa5f0435f230579dc95f219a1a8929f91b98cba727d7c1de8b10738be431ade,51,355.4769203447136,active
0xefa5f0435f230579dc95f219a1a8929f91b98cba727d7c1de8b10738be431ade,52,355.51316608632453,active
0xefa5f0435f230579dc95f219a1a8929f91b98cba727d7c1de8b10738be431ade,53,355.49216407566246,active
0xefa5f0435f230579dc95f219a1a8929f91b98cba727d7c1de8b10738be431ade,54,355.5895109059867,active
0xefa5f0435f230579dc95f219a1a8929f91b98cba727d7c1de8b10738be431ade,55,354.27243084373777,active
0xefa5f0435f230579dc95f219a1a8929f91b98cba727d7c1de8b10738be431ade,56,353.2484807479558,active
0xefa5f0435f230579dc95f219a1a8929f91b98cba727d7c1de8b10738be431ade,57,353.20119327459264,active
0xefa5f0435f230579dc95f219a1a8929f91b98cba727d7c1de8b10738be431ade,58,352.6246012919298,active
0xefa5f0435f230579dc95f219a1a8929f91b98cba727d7c1de8b10738be431ade,59,352.2936006737094,active
0xefa5f0435f230579dc95f219a1a8929f91b98cba727d7c1de8b10738be431ade,60,352.40587905136493,active
0xefa5f0435f230579dc95f219a1a8929f91b98cba727d7c1de8b10738be431ade,61,352.15341083637935,active
0xefa5f0435f230579dc95f219a1a8929f91b98cba727d7c1de8b10738be431ade,62,352.0581437297992,active
0xefa5f0435f230579dc95f219a1a8929f91b98cba727d7c1de8b10738be431ade,63,352.50791765867524,active
0xefa5f0435f230579dc95f219a1a8929f91b98cba727d7c1de8b10738be431ade,64,352.33143637801663,active
0xefa5f0435f230579dc95f219a1a8929f91b98cba727d7c1de8b10738be431ade,65,374.66359116039825,active
0xefa5f0435f230579dc95f219a1a8929f91b98cba727d7c1de8b10738be431ade,66,374.68642245931085,active
0xefa5f0435f230579dc95f219a1a8929f91b98cba727d7c1de8b10738be431ade,67,374.4640864160579,active
0xefa5f0435f230579dc95f219a1a8929f91b98cba727d7c1de8b10738be431ade,68,373.929718775768,active
0xefa5f0435f230579dc95f219a1a8929f91b98cba727d7c1de8b10738be431ade,69,374.715196226078,active
0xefa5f0435f230579dc95f219a1a8929f91b98cba727d7c1de8b10738be431ade,70,371.71339760704154,active
0xefa5f0435f230579dc95f219a1a8929f91b98cba727d7c1de8b10738be431ade,71,371.5675309066563,active
0xefa5f0435f230579dc95f219a1a8929f91b98cba727d7c1de8b10738be431ade,72,371.5533420480827,active
0xefa5f0435f230579dc95f219a1a8929f91b98cba727d7c1de8b10738be431ade,73,362.4809863003261,active
0xefa5f0435f230579dc95f219a1a8929f91b98cba727d7c1de8b10738be431ade,74,352.2343267725411,active
0xefa5f0435f230579dc95f219a1a8929f91b98cba727d7c1de8b10738be431ade,75,352.2000452486713,active
0xefa5f0435f230579dc95f219a1a8929f91b98cba727d7c1de8b10738be431ade,76,352.1713844122859,active
0xefa5f0435f230579dc95f219a1a8929f91b98cba727d7c1de8b10738be431ade,77,352.5149904287973,active
0xefa5f0435f230579dc95f219a1a8929f91b98cba727d7c1de8b10738be431ade,78,352.44901327357394,active
0xefa5f0435f230579dc95f219a1a8929f91b98cba727d7c1de8b10738be431ade,79,352.77949248328173,active
0xefa5f0435f230579dc95f219a1a8929f91b98cba727d7c1de8b10738be431ade,80,366.01520925191403,active
0xefa5f0435f230579dc95f219a1a8929f91b98cba727d7c1de8b10738be431ade,81,352.8024327188586,active
0xefa5f0435f230579dc95f219a1a8929f91b98cba727d7c1de8b10738be431ade,82,352.80147252355846,active
0xefa5f0435f230579dc95f219a1a8929f91b98cba727d7c1de8b10738be431ade,83,354.2681902036751,active
0xefa5f0435f230579dc95f219a1a8929f91b98cba727d7c1de8b10738be431ade,84,352.92827371857055,active
0xefa5f0435f230579dc95f219a1a8929f91b98cba727d7c1de8b10738be431ade,85,353.88953697089215,active
0xefa5f0435f230579dc95f219a1a8929f91b98cba727d7c1de8b10738be431ade,86,355.3659895953594,active
0xefa5f0435f230579dc95f219a1a8929f91b98cba727d7c1de8b10738be431ade,87,355.4911980639894,active
0xefa5f0435f230579dc95f219a1a8929f91b98cba727d7c1de8b10738be431ade,88,355.2936488339074,active
0xefa5f0435f230579dc95f219a1a8929f91b98cba727d7c1de8b10738be431ade,89,355.53678489176076,active
0xefa5f0435f230579dc95f219a1a8929f91b98cba727d7c1de8b10738be431ade,90,355.44975958402637,active
0xefa5f0435f230579dc95f219a1a8929f91b98cba727d7c1de8b10738be431ade,91,356.25813031690865,active
0xefa5f0435f230579dc95f219a1a8929f91b98cba727d7c1de8b10738be431ade,92,357.3290137766983,active
0xefa5f0435f230579dc95f219a1a8929f91b98cba727d7c1de8b10738be431ade,93,360.4138412857813,active
0xefa5f0435f230579dc95f219a1a8929f91b98cba727d7c1de8b10738be431ade,94,362.5940890874928,active
0xefa5f0435f230579dc95f219a1a8929f91b98cba727d7c1de8b10738be431ade,95,362.47385886757013,active
0xefa5f0435f230579dc95f219a1a8929f91b98cba727d7c1de8b10738be431ade,96,363.44029715292174,active
0xefa5f0435f230579dc95f219a1a8929f91b98cba727d7c1de8b10738be431ade,97,361.8846231619094,active
0xefa5f0435f230579dc95f219a1a8929f91b98cba727d7c1de8b10738be431ade,98,364.6192253307772,active
0xefa5f0435f230579dc95f219a1a8929f91b98cba727d7c1de8b10738be431ade,99,364.88711691044574,active
0xefa5f0435f230579dc95f219a1a8929f91b98cba727d7c1de8b10738be431ade,100,366.04922626782496,active
0xefa5f0435f230579dc95f219a1a8929f91b98cba727d7c1de8b10738be431ade,101,367.18199968937233,active
0xefa5f0435f230579dc95f219a1a8929f91b98cba727d7c1de8b10738be431ade,102,369.02439111312026,active
0xefa5f0435f230579dc95f219a1a8929f91b98cba727d7c1de8b10738be431ade,103,370.88202606126663,active
0xefa5f0435f230579dc95f219a1a8929f91b98cba727d7c1de8b10738be431ade,104,369.91819176610875,active
0xefa5f0435f230579dc95f219a1a8929f91b98cba727d7c1de8b10738be431ade,105,371.16451728025146,active
0xefa5f0435f230579dc95f219a1a8929f91b98cba727d7c1de8b10738be431ade,106,367.22454357250996,active
0xefa5f0435f230579dc95f219a1a8929f91b98cba727d7c1de8b10738be431ade,107,357.469830550208,active
0xefa5f0435f230579dc95f219a1a8929f91b98cba727d7c1de8b10738be431ade,108,355.08705086317667,active
0xefa5f0435f230579dc95f219a1a8929f91b98cba727d7c1de8b10738be431ade,109,355.13064670599033,active
0xefa5f0435f230579dc95f219a1a8929f91b98cba727d7c1de8b10738be431ade,110,319.51923524240937,active
0xefa5f0435f230579dc95f219a1a8929f91b98cba727d7c1de8b10738be431ade,111,319.3876937263108,active
0xefa5f0435f230579dc95f219a1a8929f91b98cba727d7c1de8b10738be431ade,112,319.6899605579837,active
0xefa5f0435f230579dc95f219a1a8929f91b98cba727d7c1de8b10738be431ade,113,319.6726240150764,active
0xefa5f0435f230579dc95f219a1a8929f91b98cba727d7c1de8b10738be431ade,114,319.65949619190764,active
0xefa5f0435f230579dc95f219a1a8929f91b98cba727d7c1de8b10738be431ade,115,319.6508345940066,active
0xefa5f0435f230579dc95f219a1a8929f91b98cba727d7c1de8b10738be431ade,116,319.5389716525472,active
0xefa5f0435f230579dc95f219a1a8929f91b98cba727d7c1de8b10738be431ade,117,319.50332280801376,active
0xefa5f0435f230579dc95f219a1a8929f91b98cba727d7c1de8b10738be431ade,118,319.09408258533034,active
0xefa5f0435f230579dc95f219a1a8929f91b98cba727d7c1de8b10738be431ade,119,318.924647836189,active
0xefa5f0435f230579dc95f219a1a8929f91b98cba727d7c1de8b10738be431ade,120,318.8601493396148,active
0xefa5f0435f230579dc95f219a1a8929f91b98cba727d7c1de8b10738be431ade,121,318.66224397643845,active
0xefa5f0435f230579dc95f219a1a8929f91b98cba727d7c1de8b10738be431ade,122,318.73340090182603,active
0xefa5f0435f230579dc95f219a1a8929f91b98cba727d7c1de8b10738be431ade,123,318.66450581647683,active
0xefa5f0435f230579dc95f219a1a8929f91b98cba727d7c1de8b10738be431ade,124,318.67771761537887,active
0xefa5f0435f230579dc95f219a1a8929f91b98cba727d7c1de8b10738be431ade,125,318.6435008591481,active
0xefa5f0435f230579dc95f219a1a8929f91b98cba727d7c1de8b10738be431ade,126,318.6752820002747,active
0xefa5f0435f230579dc95f219a1a8929f91b98cba727d7c1de8b10738be431ade,127,319.3470108429881,active
0xefa5f0435f230579dc95f219a1a8929f91b98cba727d7c1de8b10738be431ade,128,319.24708864010205,active
0xefa5f0435f230579dc95f219a1a8929f91b98cba727d7c1de8b10738be431ade,129,319.2194841262949,active
0xefa5f0435f230579dc95f219a1a8929f91b98cba727d7c1de8b10738be431ade,130,319.2978908218117,active
0xefa5f0435f230579dc95f219a1a8929f91b98cba727d7c1de8b10738be431ade,131,320.1205334648367,active
0xefa5f0435f230579dc95f219a1a8929f91b98cba727d7c1de8b10738be431ade,132,320.1004889522586,active
0xefa5f0435f230579dc95f219a1a8929f91b98cba727d7c1de8b10738be431ade,133,319.414313233862,active
0xefa5f0435f230579dc95f219a1a8929f91b98cba727d7c1de8b10738be431ade,134,319.7290290779262,active
0xefa5f0435f230579dc95f219a1a8929f91b98cba727d7c1de8b10738be431ade,135,319.29595973995276,active
0xefa5f0435f230579dc95f219a1a8929f91b98cba727d7c1de8b10738be431ade,136,319.4973391158343,active
0xefa5f0435f230579dc95f219a1a8929f91b98cba727d7c1de8b10738be431ade,137,319.6413557047328,active
0xefa5f0435f230579dc95f219a1a8929f91b98cba727d7c1de8b10738be431ade,138,319.40677376574746,active
0xefa5f0435f230579dc95f219a1a8929f91b98cba727d7c1de8b10738be431ade,139,319.1766624536696,active
