validator(0xfcb6007ef5f253d4e8ad894a4278bd780a1e1b7b5a17ffbf47f10e73b2508e66).csv
Validator,epoch,earned,active
0xfcb6007ef5f253d4e8ad894a4278bd780a1e1b7b5a17ffbf47f10e73b2508e66,314,3102.2457940452955,active
0xfcb6007ef5f253d4e8ad894a4278bd780a1e1b7b5a17ffbf47f10e73b2508e66,315,3112.3551311191986,active
0xfcb6007ef5f253d4e8ad894a4278bd780a1e1b7b5a17ffbf47f10e73b2508e66,316,3099.1394416104486,active
0xfcb6007ef5f253d4e8ad894a4278bd780a1e1b7b5a17ffbf47f10e73b2508e66,317,3100.885787773965,active
0xfcb6007ef5f253d4e8ad894a4278bd780a1e1b7b5a17ffbf47f10e73b2508e66,318,3101.0460099897696,active
0xfcb6007ef5f253d4e8ad894a4278bd780a1e1b7b5a17ffbf47f10e73b2508e66,319,3101.8955458207815,active
0xfcb6007ef5f253d4e8ad894a4278bd780a1e1b7b5a17ffbf47f10e73b2508e66,320,3101.78627462839,active
0xfcb6007ef5f253d4e8ad894a4278bd780a1e1b7b5a17ffbf47f10e73b2508e66,321,3104.0713013517952,active
0xfcb6007ef5f253d4e8ad894a4278bd780a1e1b7b5a17ffbf47f10e73b2508e66,322,3105.328100769764,active
