validator(0xd1dbb08191b4ae8e227935669c1862ba75a41cd7df5970002eafb2f365c32ed8).csv
Validator,epoch,earned,active
0xd1dbb08191b4ae8e227935669c1862ba75a41cd7df5970002eafb2f365c32ed8,0,NaN,active
0xd1dbb08191b4ae8e227935669c1862ba75a41cd7df5970002eafb2f365c32ed8,1,0.0006442105263157894,active
0xd1dbb08191b4ae8e227935669c1862ba75a41cd7df5970002eafb2f365c32ed8,2,0.000006315789473681443,active
0xd1dbb08191b4ae8e227935669c1862ba75a41cd7df5970002eafb2f365c32ed8,3,0.000012631578933795079,active
0xd1dbb08191b4ae8e227935669c1862ba75a41cd7df5970002eafb2f365c32ed8,4,0,active
0xd1dbb08191b4ae8e227935669c1862ba75a41cd7df5970002eafb2f365c32ed8,5,0,active
0xd1dbb08191b4ae8e227935669c1862ba75a41cd7df5970002eafb2f365c32ed8,6,0.000006370530870668259,active
0xd1dbb08191b4ae8e227935669c1862ba75a41cd7df5970002eafb2f365c32ed8,7,0.000006370530870668231,active
0xd1dbb08191b4ae8e227935669c1862ba75a41cd7df5970002eafb2f365c32ed8,8,0,active
0xd1dbb08191b4ae8e227935669c1862ba75a41cd7df5970002eafb2f365c32ed8,9,0,active
0xd1dbb08191b4ae8e227935669c1862ba75a41cd7df5970002eafb2f365c32ed8,10,0,active
0xd1dbb08191b4ae8e227935669c1862ba75a41cd7df5970002eafb2f365c32ed8,11,0,active
0xd1dbb08191b4ae8e227935669c1862ba75a41cd7df5970002eafb2f365c32ed8,12,0.00003822318526542112,active
0xd1dbb08191b4ae8e227935669c1862ba75a41cd7df5970002eafb2f365c32ed8,13,0.00007644637053084024,active
0xd1dbb08191b4ae8e227935669c1862ba75a41cd7df5970002eafb2f365c32ed8,14,0.000019111592632709068,active
0xd1dbb08191b4ae8e227935669c1862ba75a41cd7df5970002eafb2f365c32ed8,15,0.009597268472367389,active
0xd1dbb08191b4ae8e227935669c1862ba75a41cd7df5970002eafb2f365c32ed8,16,0.007867617967094875,active
0xd1dbb08191b4ae8e227935669c1862ba75a41cd7df5970002eafb2f365c32ed8,17,0.004427518959858275,active
0xd1dbb08191b4ae8e227935669c1862ba75a41cd7df5970002eafb2f365c32ed8,18,0.0006849265286400555,active
0xd1dbb08191b4ae8e227935669c1862ba75a41cd7df5970002eafb2f365c32ed8,19,0.014377771298229616,active
0xd1dbb08191b4ae8e227935669c1862ba75a41cd7df5970002eafb2f365c32ed8,20,6735.8298435322395,active
0xd1dbb08191b4ae8e227935669c1862ba75a41cd7df5970002eafb2f365c32ed8,21,6726.506601843438,active
0xd1dbb08191b4ae8e227935669c1862ba75a41cd7df5970002eafb2f365c32ed8,22,6837.815487782312,active
0xd1dbb08191b4ae8e227935669c1862ba75a41cd7df5970002eafb2f365c32ed8,23,6796.921729283933,active
0xd1dbb08191b4ae8e227935669c1862ba75a41cd7df5970002eafb2f365c32ed8,24,6290.520297876951,active
0xd1dbb08191b4ae8e227935669c1862ba75a41cd7df5970002eafb2f365c32ed8,25,6022.2684465346265,active
0xd1dbb08191b4ae8e227935669c1862ba75a41cd7df5970002eafb2f365c32ed8,26,5742.138534002496,active
0xd1dbb08191b4ae8e227935669c1862ba75a41cd7df5970002eafb2f365c32ed8,27,5310.45272572691,active
0xd1dbb08191b4ae8e227935669c1862ba75a41cd7df5970002eafb2f365c32ed8,28,5013.721855319332,active
0xd1dbb08191b4ae8e227935669c1862ba75a41cd7df5970002eafb2f365c32ed8,29,4951.386736760013,active
0xd1dbb08191b4ae8e227935669c1862ba75a41cd7df5970002eafb2f365c32ed8,30,4857.810023604325,active
0xd1dbb08191b4ae8e227935669c1862ba75a41cd7df5970002eafb2f365c32ed8,31,4846.372113941475,active
0xd1dbb08191b4ae8e227935669c1862ba75a41cd7df5970002eafb2f365c32ed8,32,4852.676240570404,active
0xd1dbb08191b4ae8e227935669c1862ba75a41cd7df5970002eafb2f365c32ed8,33,4842.750179115348,active
0xd1dbb08191b4ae8e227935669c1862ba75a41cd7df5970002eafb2f365c32ed8,34,4839.378606156492,active
0xd1dbb08191b4ae8e227935669c1862ba75a41cd7df5970002eafb2f365c32ed8,35,4722.09382407533,active
0xd1dbb08191b4ae8e227935669c1862ba75a41cd7df5970002eafb2f365c32ed8,36,4549.743988780914,active
0xd1dbb08191b4ae8e227935669c1862ba75a41cd7df5970002eafb2f365c32ed8,37,4471.8049349490975,active
0xd1dbb08191b4ae8e227935669c1862ba75a41cd7df5970002eafb2f365c32ed8,38,4449.818136575792,active
0xd1dbb08191b4ae8e227935669c1862ba75a41cd7df5970002eafb2f365c32ed8,39,4440.782345277389,active
0xd1dbb08191b4ae8e227935669c1862ba75a41cd7df5970002eafb2f365c32ed8,40,4423.769376804475,active
0xd1dbb08191b4ae8e227935669c1862ba75a41cd7df5970002eafb2f365c32ed8,41,4409.698519080405,active
0xd1dbb08191b4ae8e227935669c1862ba75a41cd7df5970002eafb2f365c32ed8,42,4395.130946046469,active
0xd1dbb08191b4ae8e227935669c1862ba75a41cd7df5970002eafb2f365c32ed8,43,4362.064068094217,active
0xd1dbb08191b4ae8e227935669c1862ba75a41cd7df5970002eafb2f365c32ed8,44,4361.619155619405,active
0xd1dbb08191b4ae8e227935669c1862ba75a41cd7df5970002eafb2f365c32ed8,45,4360.850008523227,active
0xd1dbb08191b4ae8e227935669c1862ba75a41cd7df5970002eafb2f365c32ed8,46,4361.116320416618,active
0xd1dbb08191b4ae8e227935669c1862ba75a41cd7df5970002eafb2f365c32ed8,47,4359.092732400534,active
0xd1dbb08191b4ae8e227935669c1862ba75a41cd7df5970002eafb2f365c32ed8,48,4366.053887387356,active
0xd1dbb08191b4ae8e227935669c1862ba75a41cd7df5970002eafb2f365c32ed8,49,4350.7723804264615,active
0xd1dbb08191b4ae8e227935669c1862ba75a41cd7df5970002eafb2f365c32ed8,50,4351.67174956836,active
0xd1dbb08191b4ae8e227935669c1862ba75a41cd7df5970002eafb2f365c32ed8,51,4351.360163548786,active
0xd1dbb08191b4ae8e227935669c1862ba75a41cd7df5970002eafb2f365c32ed8,52,4351.7906261468615,active
0xd1dbb08191b4ae8e227935669c1862ba75a41cd7df5970002eafb2f365c32ed8,53,4351.5203264959955,active
0xd1dbb08191b4ae8e227935669c1862ba75a41cd7df5970002eafb2f365c32ed8,54,4352.698715210767,active
0xd1dbb08191b4ae8e227935669c1862ba75a41cd7df5970002eafb2f365c32ed8,55,4336.563436380742,active
0xd1dbb08191b4ae8e227935669c1862ba75a41cd7df5970002eafb2f365c32ed8,56,4324.01642844714,active
0xd1dbb08191b4ae8e227935669c1862ba75a41cd7df5970002eafb2f365c32ed8,57,4323.424555525724,active
0xd1dbb08191b4ae8e227935669c1862ba75a41cd7df5970002eafb2f365c32ed8,58,4316.353659545506,active
0xd1dbb08191b4ae8e227935669c1862ba75a41cd7df5970002eafb2f365c32ed8,59,4312.28901769622,active
0xd1dbb08191b4ae8e227935669c1862ba75a41cd7df5970002eafb2f365c32ed8,60,4313.650403895085,active
0xd1dbb08191b4ae8e227935669c1862ba75a41cd7df5970002eafb2f365c32ed8,61,4310.547085225158,active
0xd1dbb08191b4ae8e227935669c1862ba75a41cd7df5970002eafb2f365c32ed8,62,4309.368016652097,active
0xd1dbb08191b4ae8e227935669c1862ba75a41cd7df5970002eafb2f365c32ed8,63,4314.860515746973,active
0xd1dbb08191b4ae8e227935669c1862ba75a41cd7df5970002eafb2f365c32ed8,64,4312.687335759407,active
0xd1dbb08191b4ae8e227935669c1862ba75a41cd7df5970002eafb2f365c32ed8,65,4586.028672868605,active
0xd1dbb08191b4ae8e227935669c1862ba75a41cd7df5970002eafb2f365c32ed8,66,4586.293484700062,active
0xd1dbb08191b4ae8e227935669c1862ba75a41cd7df5970002eafb2f365c32ed8,67,4583.557371330703,active
0xd1dbb08191b4ae8e227935669c1862ba75a41cd7df5970002eafb2f365c32ed8,68,4577.001934332267,active
0xd1dbb08191b4ae8e227935669c1862ba75a41cd7df5970002eafb2f365c32ed8,69,4586.601775279166,active
0xd1dbb08191b4ae8e227935669c1862ba75a41cd7df5970002eafb2f365c32ed8,70,4549.844528299573,active
0xd1dbb08191b4ae8e227935669c1862ba75a41cd7df5970002eafb2f365c32ed8,71,4548.044686983118,active
0xd1dbb08191b4ae8e227935669c1862ba75a41cd7df5970002eafb2f365c32ed8,72,4547.856617156477,active
0xd1dbb08191b4ae8e227935669c1862ba75a41cd7df5970002eafb2f365c32ed8,73,4436.79587377838,active
0xd1dbb08191b4ae8e227935669c1862ba75a41cd7df5970002eafb2f365c32ed8,74,4311.36264305679,active
0xd1dbb08191b4ae8e227935669c1862ba75a41cd7df5970002eafb2f365c32ed8,75,4310.930105620524,active
0xd1dbb08191b4ae8e227935669c1862ba75a41cd7df5970002eafb2f365c32ed8,76,4310.566370911878,active
0xd1dbb08191b4ae8e227935669c1862ba75a41cd7df5970002eafb2f365c32ed8,77,4314.75916187258,active
0xd1dbb08191b4ae8e227935669c1862ba75a41cd7df5970002eafb2f365c32ed8,78,4313.938662185982,active
0xd1dbb08191b4ae8e227935669c1862ba75a41cd7df5970002eafb2f365c32ed8,79,4317.970741127642,active
0xd1dbb08191b4ae8e227935669c1862ba75a41cd7df5970002eafb2f365c32ed8,80,4479.960581020591,active
0xd1dbb08191b4ae8e227935669c1862ba75a41cd7df5970002eafb2f365c32ed8,81,4318.225116658568,active
0xd1dbb08191b4ae8e227935669c1862ba75a41cd7df5970002eafb2f365c32ed8,82,4318.20040448444,active
0xd1dbb08191b4ae8e227935669c1862ba75a41cd7df5970002eafb2f365c32ed8,83,4336.139644809622,active
0xd1dbb08191b4ae8e227935669c1862ba75a41cd7df5970002eafb2f365c32ed8,84,4319.726442374952,active
0xd1dbb08191b4ae8e227935669c1862ba75a41cd7df5970002eafb2f365c32ed8,85,4331.478991254329,active
0xd1dbb08191b4ae8e227935669c1862ba75a41cd7df5970002eafb2f365c32ed8,86,4349.537147197564,active
0xd1dbb08191b4ae8e227935669c1862ba75a41cd7df5970002eafb2f365c32ed8,87,4351.056505133331,active
0xd1dbb08191b4ae8e227935669c1862ba75a41cd7df5970002eafb2f365c32ed8,88,4348.625450265359,active
0xd1dbb08191b4ae8e227935669c1862ba75a41cd7df5970002eafb2f365c32ed8,89,4351.588181522395,active
0xd1dbb08191b4ae8e227935669c1862ba75a41cd7df5970002eafb2f365c32ed8,90,4350.509893943475,active
0xd1dbb08191b4ae8e227935669c1862ba75a41cd7df5970002eafb2f365c32ed8,91,4360.390740796925,active
0xd1dbb08191b4ae8e227935669c1862ba75a41cd7df5970002eafb2f365c32ed8,92,4373.484492081904,active
0xd1dbb08191b4ae8e227935669c1862ba75a41cd7df5970002eafb2f365c32ed8,93,4411.227471693785,active
0xd1dbb08191b4ae8e227935669c1862ba75a41cd7df5970002eafb2f365c32ed8,94,4437.898683115725,active
0xd1dbb08191b4ae8e227935669c1862ba75a41cd7df5970002eafb2f365c32ed8,95,4436.4134912840145,active
0xd1dbb08191b4ae8e227935669c1862ba75a41cd7df5970002eafb2f365c32ed8,96,4448.228297628139,active
0xd1dbb08191b4ae8e227935669c1862ba75a41cd7df5970002eafb2f365c32ed8,97,4429.174387243395,active
0xd1dbb08191b4ae8e227935669c1862ba75a41cd7df5970002eafb2f365c32ed8,98,4462.629995185857,active
0xd1dbb08191b4ae8e227935669c1862ba75a41cd7df5970002eafb2f365c32ed8,99,4465.894943752014,active
0xd1dbb08191b4ae8e227935669c1862ba75a41cd7df5970002eafb2f365c32ed8,100,4480.104263243134,active
0xd1dbb08191b4ae8e227935669c1862ba75a41cd7df5970002eafb2f365c32ed8,101,4493.954408875795,active
0xd1dbb08191b4ae8e227935669c1862ba75a41cd7df5970002eafb2f365c32ed8,102,4516.489441830957,active
0xd1dbb08191b4ae8e227935669c1862ba75a41cd7df5970002eafb2f365c32ed8,103,4539.210830519552,active
0xd1dbb08191b4ae8e227935669c1862ba75a41cd7df5970002eafb2f365c32ed8,104,4527.400262484959,active
0xd1dbb08191b4ae8e227935669c1862ba75a41cd7df5970002eafb2f365c32ed8,105,4542.639698620466,active
0xd1dbb08191b4ae8e227935669c1862ba75a41cd7df5970002eafb2f365c32ed8,106,4494.404675123185,active
0xd1dbb08191b4ae8e227935669c1862ba75a41cd7df5970002eafb2f365c32ed8,107,4375.004627529115,active
0xd1dbb08191b4ae8e227935669c1862ba75a41cd7df5970002eafb2f365c32ed8,108,4345.829080303889,active
0xd1dbb08191b4ae8e227935669c1862ba75a41cd7df5970002eafb2f365c32ed8,109,4346.349563836355,active
0xd1dbb08191b4ae8e227935669c1862ba75a41cd7df5970002eafb2f365c32ed8,110,3910.4992027289068,active
0xd1dbb08191b4ae8e227935669c1862ba75a41cd7df5970002eafb2f365c32ed8,111,3908.878726941283,active
0xd1dbb08191b4ae8e227935669c1862ba75a41cd7df5970002eafb2f365c32ed8,112,3912.5674859624783,active
0xd1dbb08191b4ae8e227935669c1862ba75a41cd7df5970002eafb2f365c32ed8,113,3912.344719163083,active
0xd1dbb08191b4ae8e227935669c1862ba75a41cd7df5970002eafb2f365c32ed8,114,3912.173464194951,active
0xd1dbb08191b4ae8e227935669c1862ba75a41cd7df5970002eafb2f365c32ed8,115,3912.056871989197,active
0xd1dbb08191b4ae8e227935669c1862ba75a41cd7df5970002eafb2f365c32ed8,116,3910.677252564716,active
0xd1dbb08191b4ae8e227935669c1862ba75a41cd7df5970002eafb2f365c32ed8,117,3910.2303892607915,active
0xd1dbb08191b4ae8e227935669c1862ba75a41cd7df5970002eafb2f365c32ed8,118,3905.2113580856553,active
0xd1dbb08191b4ae8e227935669c1862ba75a41cd7df5970002eafb2f365c32ed8,119,3903.127204061218,active
0xd1dbb08191b4ae8e227935669c1862ba75a41cd7df5970002eafb2f365c32ed8,120,3902.32731653336,active
0xd1dbb08191b4ae8e227935669c1862ba75a41cd7df5970002eafb2f365c32ed8,121,3899.8947590983566,active
0xd1dbb08191b4ae8e227935669c1862ba75a41cd7df5970002eafb2f365c32ed8,122,3900.7550877524777,active
0xd1dbb08191b4ae8e227935669c1862ba75a41cd7df5970002eafb2f365c32ed8,123,3899.9014168173967,active
0xd1dbb08191b4ae8e227935669c1862ba75a41cd7df5970002eafb2f365c32ed8,124,3900.0525973940908,active
0xd1dbb08191b4ae8e227935669c1862ba75a41cd7df5970002eafb2f365c32ed8,125,3899.6233378556276,active
0xd1dbb08191b4ae8e227935669c1862ba75a41cd7df5970002eafb2f365c32ed8,126,3900.0017764863974,active
0xd1dbb08191b4ae8e227935669c1862ba75a41cd7df5970002eafb2f365c32ed8,127,3908.211980039421,active
0xd1dbb08191b4ae8e227935669c1862ba75a41cd7df5970002eafb2f365c32ed8,128,3906.9785739386657,active
0xd1dbb08191b4ae8e227935669c1862ba75a41cd7df5970002eafb2f365c32ed8,129,3906.630208043789,active
0xd1dbb08191b4ae8e227935669c1862ba75a41cd7df5970002eafb2f365c32ed8,130,3907.5792153298116,active
0xd1dbb08191b4ae8e227935669c1862ba75a41cd7df5970002eafb2f365c32ed8,131,3917.6361783175935,active
0xd1dbb08191b4ae8e227935669c1862ba75a41cd7df5970002eafb2f365c32ed8,132,3917.3802807245747,active
0xd1dbb08191b4ae8e227935669c1862ba75a41cd7df5970002eafb2f365c32ed8,133,3908.9723146572583,active
0xd1dbb08191b4ae8e227935669c1862ba75a41cd7df5970002eafb2f365c32ed8,134,3912.8132330776175,active
0xd1dbb08191b4ae8e227935669c1862ba75a41cd7df5970002eafb2f365c32ed8,135,3907.502822997456,active
0xd1dbb08191b4ae8e227935669c1862ba75a41cd7df5970002eafb2f365c32ed8,136,3909.956737905379,active
0xd1dbb08191b4ae8e227935669c1862ba75a41cd7df5970002eafb2f365c32ed8,137,3911.7086396718983,active
0xd1dbb08191b4ae8e227935669c1862ba75a41cd7df5970002eafb2f365c32ed8,138,3908.827326057083,active
0xd1dbb08191b4ae8e227935669c1862ba75a41cd7df5970002eafb2f365c32ed8,139,3906.0007474369054,active
0xd1dbb08191b4ae8e227935669c1862ba75a41cd7df5970002eafb2f365c32ed8,140,3908.933195881085,active
0xd1dbb08191b4ae8e227935669c1862ba75a41cd7df5970002eafb2f365c32ed8,141,3911.820485794332,active
0xd1dbb08191b4ae8e227935669c1862ba75a41cd7df5970002eafb2f365c32ed8,142,3913.462094358569,active
0xd1dbb08191b4ae8e227935669c1862ba75a41cd7df5970002eafb2f365c32ed8,143,3914.0511953210316,active
0xd1dbb08191b4ae8e227935669c1862ba75a41cd7df5970002eafb2f365c32ed8,144,3916.906557337803,active
0xd1dbb08191b4ae8e227935669c1862ba75a41cd7df5970002eafb2f365c32ed8,145,3916.3605052382386,active
0xd1dbb08191b4ae8e227935669c1862ba75a41cd7df5970002eafb2f365c32ed8,146,3919.6219638181365,active
0xd1dbb08191b4ae8e227935669c1862ba75a41cd7df5970002eafb2f365c32ed8,147,3922.929501462806,active
0xd1dbb08191b4ae8e227935669c1862ba75a41cd7df5970002eafb2f365c32ed8,148,3928.33175258456,active
0xd1dbb08191b4ae8e227935669c1862ba75a41cd7df5970002eafb2f365c32ed8,149,3954.0751960952075,active
0xd1dbb08191b4ae8e227935669c1862ba75a41cd7df5970002eafb2f365c32ed8,150,3953.441147652537,active
0xd1dbb08191b4ae8e227935669c1862ba75a41cd7df5970002eafb2f365c32ed8,151,3953.6330245696195,active
0xd1dbb08191b4ae8e227935669c1862ba75a41cd7df5970002eafb2f365c32ed8,152,3953.8741959056247,active
0xd1dbb08191b4ae8e227935669c1862ba75a41cd7df5970002eafb2f365c32ed8,153,3951.063612001081,active
0xd1dbb08191b4ae8e227935669c1862ba75a41cd7df5970002eafb2f365c32ed8,154,3955.1337724304844,active
0xd1dbb08191b4ae8e227935669c1862ba75a41cd7df5970002eafb2f365c32ed8,155,3954.7613368441384,active
0xd1dbb08191b4ae8e227935669c1862ba75a41cd7df5970002eafb2f365c32ed8,156,3950.9795977140147,active
0xd1dbb08191b4ae8e227935669c1862ba75a41cd7df5970002eafb2f365c32ed8,157,3951.285694941892,active
0xd1dbb08191b4ae8e227935669c1862ba75a41cd7df5970002eafb2f365c32ed8,158,3951.085751655779,active
0xd1dbb08191b4ae8e227935669c1862ba75a41cd7df5970002eafb2f365c32ed8,159,3951.7898747493623,active
0xd1dbb08191b4ae8e227935669c1862ba75a41cd7df5970002eafb2f365c32ed8,160,3830.88661833673,active
0xd1dbb08191b4ae8e227935669c1862ba75a41cd7df5970002eafb2f365c32ed8,161,3826.5820134130095,active
0xd1dbb08191b4ae8e227935669c1862ba75a41cd7df5970002eafb2f365c32ed8,162,3840.594564768489,active
0xd1dbb08191b4ae8e227935669c1862ba75a41cd7df5970002eafb2f365c32ed8,163,3840.944561724403,active
0xd1dbb08191b4ae8e227935669c1862ba75a41cd7df5970002eafb2f365c32ed8,164,3841.5060098415793,active
0xd1dbb08191b4ae8e227935669c1862ba75a41cd7df5970002eafb2f365c32ed8,165,3840.060875042971,active
0xd1dbb08191b4ae8e227935669c1862ba75a41cd7df5970002eafb2f365c32ed8,166,3841.0846110644375,active
0xd1dbb08191b4ae8e227935669c1862ba75a41cd7df5970002eafb2f365c32ed8,167,3605.947572289503,active
0xd1dbb08191b4ae8e227935669c1862ba75a41cd7df5970002eafb2f365c32ed8,168,3618.846788570862,active
0xd1dbb08191b4ae8e227935669c1862ba75a41cd7df5970002eafb2f365c32ed8,169,3627.037930314232,active
0xd1dbb08191b4ae8e227935669c1862ba75a41cd7df5970002eafb2f365c32ed8,170,3631.0812768238256,active
0xd1dbb08191b4ae8e227935669c1862ba75a41cd7df5970002eafb2f365c32ed8,171,3626.412770575649,active
0xd1dbb08191b4ae8e227935669c1862ba75a41cd7df5970002eafb2f365c32ed8,172,3573.983899703872,active
0xd1dbb08191b4ae8e227935669c1862ba75a41cd7df5970002eafb2f365c32ed8,173,3573.267611586601,active
0xd1dbb08191b4ae8e227935669c1862ba75a41cd7df5970002eafb2f365c32ed8,174,3572.1626073310877,active
0xd1dbb08191b4ae8e227935669c1862ba75a41cd7df5970002eafb2f365c32ed8,175,3574.544967659367,active
0xd1dbb08191b4ae8e227935669c1862ba75a41cd7df5970002eafb2f365c32ed8,176,3578.4255514365195,active
0xd1dbb08191b4ae8e227935669c1862ba75a41cd7df5970002eafb2f365c32ed8,177,3580.7414771248523,active
0xd1dbb08191b4ae8e227935669c1862ba75a41cd7df5970002eafb2f365c32ed8,178,3580.857276788824,active
0xd1dbb08191b4ae8e227935669c1862ba75a41cd7df5970002eafb2f365c32ed8,179,3580.2584231584756,active
0xd1dbb08191b4ae8e227935669c1862ba75a41cd7df5970002eafb2f365c32ed8,180,3579.657921097519,active
0xd1dbb08191b4ae8e227935669c1862ba75a41cd7df5970002eafb2f365c32ed8,181,3579.9706594742484,active
0xd1dbb08191b4ae8e227935669c1862ba75a41cd7df5970002eafb2f365c32ed8,182,3580.425605441723,active
0xd1dbb08191b4ae8e227935669c1862ba75a41cd7df5970002eafb2f365c32ed8,183,3581.7878870592913,active
0xd1dbb08191b4ae8e227935669c1862ba75a41cd7df5970002eafb2f365c32ed8,184,3588.779317342645,active
0xd1dbb08191b4ae8e227935669c1862ba75a41cd7df5970002eafb2f365c32ed8,185,3584.1091501751016,active
0xd1dbb08191b4ae8e227935669c1862ba75a41cd7df5970002eafb2f365c32ed8,186,3583.009740558465,active
0xd1dbb08191b4ae8e227935669c1862ba75a41cd7df5970002eafb2f365c32ed8,187,3584.627073710904,active
0xd1dbb08191b4ae8e227935669c1862ba75a41cd7df5970002eafb2f365c32ed8,188,3587.4640973412306,active
0xd1dbb08191b4ae8e227935669c1862ba75a41cd7df5970002eafb2f365c32ed8,189,3577.603620161834,active
0xd1dbb08191b4ae8e227935669c1862ba75a41cd7df5970002eafb2f365c32ed8,190,3581.975595562421,active
0xd1dbb08191b4ae8e227935669c1862ba75a41cd7df5970002eafb2f365c32ed8,191,3589.5512608376025,active
0xd1dbb08191b4ae8e227935669c1862ba75a41cd7df5970002eafb2f365c32ed8,192,3581.1059191253985,active
0xd1dbb08191b4ae8e227935669c1862ba75a41cd7df5970002eafb2f365c32ed8,193,3580.909878388633,active
0xd1dbb08191b4ae8e227935669c1862ba75a41cd7df5970002eafb2f365c32ed8,194,3580.8700042777746,active
0xd1dbb08191b4ae8e227935669c1862ba75a41cd7df5970002eafb2f365c32ed8,195,3580.7375894068878,active
0xd1dbb08191b4ae8e227935669c1862ba75a41cd7df5970002eafb2f365c32ed8,196,3580.9664057568893,active
0xd1dbb08191b4ae8e227935669c1862ba75a41cd7df5970002eafb2f365c32ed8,197,3573.7536270627375,active
0xd1dbb08191b4ae8e227935669c1862ba75a41cd7df5970002eafb2f365c32ed8,198,3568.0784717111696,active
0xd1dbb08191b4ae8e227935669c1862ba75a41cd7df5970002eafb2f365c32ed8,199,3574.4329100908712,active
0xd1dbb08191b4ae8e227935669c1862ba75a41cd7df5970002eafb2f365c32ed8,200,3226.485679456273,active
0xd1dbb08191b4ae8e227935669c1862ba75a41cd7df5970002eafb2f365c32ed8,201,3223.0591347067557,active
0xd1dbb08191b4ae8e227935669c1862ba75a41cd7df5970002eafb2f365c32ed8,202,3223.3341361583302,active
0xd1dbb08191b4ae8e227935669c1862ba75a41cd7df5970002eafb2f365c32ed8,203,3237.7416543815866,active
0xd1dbb08191b4ae8e227935669c1862ba75a41cd7df5970002eafb2f365c32ed8,204,3240.354236346423,active
0xd1dbb08191b4ae8e227935669c1862ba75a41cd7df5970002eafb2f365c32ed8,205,3245.42767251103,active
0xd1dbb08191b4ae8e227935669c1862ba75a41cd7df5970002eafb2f365c32ed8,206,3245.129635081552,active
0xd1dbb08191b4ae8e227935669c1862ba75a41cd7df5970002eafb2f365c32ed8,207,3243.594279232235,active
0xd1dbb08191b4ae8e227935669c1862ba75a41cd7df5970002eafb2f365c32ed8,208,3244.9989169552973,active
0xd1dbb08191b4ae8e227935669c1862ba75a41cd7df5970002eafb2f365c32ed8,209,3243.9536484628748,active
0xd1dbb08191b4ae8e227935669c1862ba75a41cd7df5970002eafb2f365c32ed8,210,3239.27744898543,active
0xd1dbb08191b4ae8e227935669c1862ba75a41cd7df5970002eafb2f365c32ed8,211,3246.5784250820843,active
0xd1dbb08191b4ae8e227935669c1862ba75a41cd7df5970002eafb2f365c32ed8,212,3240.240064612545,active
0xd1dbb08191b4ae8e227935669c1862ba75a41cd7df5970002eafb2f365c32ed8,213,3240.9443862845055,active
0xd1dbb08191b4ae8e227935669c1862ba75a41cd7df5970002eafb2f365c32ed8,214,3239.904194743433,active
0xd1dbb08191b4ae8e227935669c1862ba75a41cd7df5970002eafb2f365c32ed8,215,3242.123888483911,active
0xd1dbb08191b4ae8e227935669c1862ba75a41cd7df5970002eafb2f365c32ed8,216,3238.8326380640465,active
0xd1dbb08191b4ae8e227935669c1862ba75a41cd7df5970002eafb2f365c32ed8,217,3238.507144739747,active
0xd1dbb08191b4ae8e227935669c1862ba75a41cd7df5970002eafb2f365c32ed8,218,3240.242205064145,active
0xd1dbb08191b4ae8e227935669c1862ba75a41cd7df5970002eafb2f365c32ed8,219,3236.869417080959,active
0xd1dbb08191b4ae8e227935669c1862ba75a41cd7df5970002eafb2f365c32ed8,220,3241.2076476763455,active
0xd1dbb08191b4ae8e227935669c1862ba75a41cd7df5970002eafb2f365c32ed8,221,3245.227491904741,active
0xd1dbb08191b4ae8e227935669c1862ba75a41cd7df5970002eafb2f365c32ed8,222,3228.6605213490056,active
0xd1dbb08191b4ae8e227935669c1862ba75a41cd7df5970002eafb2f365c32ed8,223,3228.706914130047,active
0xd1dbb08191b4ae8e227935669c1862ba75a41cd7df5970002eafb2f365c32ed8,224,3241.614895672733,active
0xd1dbb08191b4ae8e227935669c1862ba75a41cd7df5970002eafb2f365c32ed8,225,3240.9117380088514,active
0xd1dbb08191b4ae8e227935669c1862ba75a41cd7df5970002eafb2f365c32ed8,226,3241.4701749697742,active
0xd1dbb08191b4ae8e227935669c1862ba75a41cd7df5970002eafb2f365c32ed8,227,3241.9513055344464,active
0xd1dbb08191b4ae8e227935669c1862ba75a41cd7df5970002eafb2f365c32ed8,228,3241.379315693578,active
0xd1dbb08191b4ae8e227935669c1862ba75a41cd7df5970002eafb2f365c32ed8,229,3244.3532094480893,active
0xd1dbb08191b4ae8e227935669c1862ba75a41cd7df5970002eafb2f365c32ed8,230,3242.063142502895,active
0xd1dbb08191b4ae8e227935669c1862ba75a41cd7df5970002eafb2f365c32ed8,231,3248.2603052259583,active
0xd1dbb08191b4ae8e227935669c1862ba75a41cd7df5970002eafb2f365c32ed8,232,3249.7750320802324,active
0xd1dbb08191b4ae8e227935669c1862ba75a41cd7df5970002eafb2f365c32ed8,233,3250.334845434662,active
0xd1dbb08191b4ae8e227935669c1862ba75a41cd7df5970002eafb2f365c32ed8,234,3249.431206719102,active
0xd1dbb08191b4ae8e227935669c1862ba75a41cd7df5970002eafb2f365c32ed8,235,3248.1135137751385,active
0xd1dbb08191b4ae8e227935669c1862ba75a41cd7df5970002eafb2f365c32ed8,236,3247.9701320593144,active
0xd1dbb08191b4ae8e227935669c1862ba75a41cd7df5970002eafb2f365c32ed8,237,3249.130664414701,active
0xd1dbb08191b4ae8e227935669c1862ba75a41cd7df5970002eafb2f365c32ed8,238,3248.6640646087076,active
0xd1dbb08191b4ae8e227935669c1862ba75a41cd7df5970002eafb2f365c32ed8,239,3250.8098339457174,active
0xd1dbb08191b4ae8e227935669c1862ba75a41cd7df5970002eafb2f365c32ed8,240,3259.6933845487238,active
0xd1dbb08191b4ae8e227935669c1862ba75a41cd7df5970002eafb2f365c32ed8,241,3258.970116773025,active
0xd1dbb08191b4ae8e227935669c1862ba75a41cd7df5970002eafb2f365c32ed8,242,3258.9838733698243,active
0xd1dbb08191b4ae8e227935669c1862ba75a41cd7df5970002eafb2f365c32ed8,243,3259.2917781352758,active
0xd1dbb08191b4ae8e227935669c1862ba75a41cd7df5970002eafb2f365c32ed8,244,3261.7868179347906,active
0xd1dbb08191b4ae8e227935669c1862ba75a41cd7df5970002eafb2f365c32ed8,245,3272.1471608575253,active
0xd1dbb08191b4ae8e227935669c1862ba75a41cd7df5970002eafb2f365c32ed8,246,3263.3924188929545,active
0xd1dbb08191b4ae8e227935669c1862ba75a41cd7df5970002eafb2f365c32ed8,247,3286.162012787546,active
0xd1dbb08191b4ae8e227935669c1862ba75a41cd7df5970002eafb2f365c32ed8,248,3274.6329945471552,active
0xd1dbb08191b4ae8e227935669c1862ba75a41cd7df5970002eafb2f365c32ed8,249,3266.0329266693807,active
0xd1dbb08191b4ae8e227935669c1862ba75a41cd7df5970002eafb2f365c32ed8,250,3267.2919888076744,active
0xd1dbb08191b4ae8e227935669c1862ba75a41cd7df5970002eafb2f365c32ed8,251,3265.841486433376,active
0xd1dbb08191b4ae8e227935669c1862ba75a41cd7df5970002eafb2f365c32ed8,252,3263.0135205542656,active
0xd1dbb08191b4ae8e227935669c1862ba75a41cd7df5970002eafb2f365c32ed8,253,3264.227975263387,active
0xd1dbb08191b4ae8e227935669c1862ba75a41cd7df5970002eafb2f365c32ed8,254,3296.7645599034868,active
0xd1dbb08191b4ae8e227935669c1862ba75a41cd7df5970002eafb2f365c32ed8,255,3264.040418597111,active
0xd1dbb08191b4ae8e227935669c1862ba75a41cd7df5970002eafb2f365c32ed8,256,3264.0022730371065,active
0xd1dbb08191b4ae8e227935669c1862ba75a41cd7df5970002eafb2f365c32ed8,257,3264.2718314637873,active
0xd1dbb08191b4ae8e227935669c1862ba75a41cd7df5970002eafb2f365c32ed8,258,3266.209883801161,active
0xd1dbb08191b4ae8e227935669c1862ba75a41cd7df5970002eafb2f365c32ed8,259,3263.108284213486,active
0xd1dbb08191b4ae8e227935669c1862ba75a41cd7df5970002eafb2f365c32ed8,260,3262.817401120461,active
0xd1dbb08191b4ae8e227935669c1862ba75a41cd7df5970002eafb2f365c32ed8,261,3262.611476260129,active
0xd1dbb08191b4ae8e227935669c1862ba75a41cd7df5970002eafb2f365c32ed8,262,3264.116586483616,active
0xd1dbb08191b4ae8e227935669c1862ba75a41cd7df5970002eafb2f365c32ed8,263,3263.7251281208664,active
0xd1dbb08191b4ae8e227935669c1862ba75a41cd7df5970002eafb2f365c32ed8,264,3264.114654788045,active
0xd1dbb08191b4ae8e227935669c1862ba75a41cd7df5970002eafb2f365c32ed8,265,3290.723577348342,active
0xd1dbb08191b4ae8e227935669c1862ba75a41cd7df5970002eafb2f365c32ed8,266,3251.5096475187497,active
0xd1dbb08191b4ae8e227935669c1862ba75a41cd7df5970002eafb2f365c32ed8,267,3246.6443072931593,active
0xd1dbb08191b4ae8e227935669c1862ba75a41cd7df5970002eafb2f365c32ed8,268,3248.4082044251186,active
0xd1dbb08191b4ae8e227935669c1862ba75a41cd7df5970002eafb2f365c32ed8,269,3247.151670855977,active
0xd1dbb08191b4ae8e227935669c1862ba75a41cd7df5970002eafb2f365c32ed8,270,3249.080100602668,active
0xd1dbb08191b4ae8e227935669c1862ba75a41cd7df5970002eafb2f365c32ed8,271,3235.669391038234,active
0xd1dbb08191b4ae8e227935669c1862ba75a41cd7df5970002eafb2f365c32ed8,272,3234.407305679034,active
0xd1dbb08191b4ae8e227935669c1862ba75a41cd7df5970002eafb2f365c32ed8,273,3233.5487748378328,active
0xd1dbb08191b4ae8e227935669c1862ba75a41cd7df5970002eafb2f365c32ed8,274,3233.8478358946786,active
0xd1dbb08191b4ae8e227935669c1862ba75a41cd7df5970002eafb2f365c32ed8,275,3237.5055374400913,active
0xd1dbb08191b4ae8e227935669c1862ba75a41cd7df5970002eafb2f365c32ed8,276,3241.5647715129157,active
0xd1dbb08191b4ae8e227935669c1862ba75a41cd7df5970002eafb2f365c32ed8,277,3242.372370739172,active
0xd1dbb08191b4ae8e227935669c1862ba75a41cd7df5970002eafb2f365c32ed8,278,3236.683111327569,active
0xd1dbb08191b4ae8e227935669c1862ba75a41cd7df5970002eafb2f365c32ed8,279,3238.358871982987,active
0xd1dbb08191b4ae8e227935669c1862ba75a41cd7df5970002eafb2f365c32ed8,280,3238.511320119243,active
0xd1dbb08191b4ae8e227935669c1862ba75a41cd7df5970002eafb2f365c32ed8,281,3239.5261259943604,active
0xd1dbb08191b4ae8e227935669c1862ba75a41cd7df5970002eafb2f365c32ed8,282,3237.8101755694806,active
0xd1dbb08191b4ae8e227935669c1862ba75a41cd7df5970002eafb2f365c32ed8,283,3237.255055109974,active
0xd1dbb08191b4ae8e227935669c1862ba75a41cd7df5970002eafb2f365c32ed8,284,3237.978789980316,active
0xd1dbb08191b4ae8e227935669c1862ba75a41cd7df5970002eafb2f365c32ed8,285,3236.1447665938863,active
0xd1dbb08191b4ae8e227935669c1862ba75a41cd7df5970002eafb2f365c32ed8,286,3234.9911115732016,active
0xd1dbb08191b4ae8e227935669c1862ba75a41cd7df5970002eafb2f365c32ed8,287,3230.452091964469,active
0xd1dbb08191b4ae8e227935669c1862ba75a41cd7df5970002eafb2f365c32ed8,288,3232.0711829167794,active
0xd1dbb08191b4ae8e227935669c1862ba75a41cd7df5970002eafb2f365c32ed8,289,3229.9557602281507,active
0xd1dbb08191b4ae8e227935669c1862ba75a41cd7df5970002eafb2f365c32ed8,290,2907.122889688773,active
0xd1dbb08191b4ae8e227935669c1862ba75a41cd7df5970002eafb2f365c32ed8,291,2907.4851691457393,active
0xd1dbb08191b4ae8e227935669c1862ba75a41cd7df5970002eafb2f365c32ed8,292,2906.658710256077,active
0xd1dbb08191b4ae8e227935669c1862ba75a41cd7df5970002eafb2f365c32ed8,293,2907.81641586966,active
0xd1dbb08191b4ae8e227935669c1862ba75a41cd7df5970002eafb2f365c32ed8,294,2906.7350881608895,active
0xd1dbb08191b4ae8e227935669c1862ba75a41cd7df5970002eafb2f365c32ed8,295,2905.7243908594082,active
0xd1dbb08191b4ae8e227935669c1862ba75a41cd7df5970002eafb2f365c32ed8,296,2906.353262661513,active
0xd1dbb08191b4ae8e227935669c1862ba75a41cd7df5970002eafb2f365c32ed8,297,2924.44408380275,active
0xd1dbb08191b4ae8e227935669c1862ba75a41cd7df5970002eafb2f365c32ed8,298,2922.671672471089,active
0xd1dbb08191b4ae8e227935669c1862ba75a41cd7df5970002eafb2f365c32ed8,299,2906.1878968852593,active
0xd1dbb08191b4ae8e227935669c1862ba75a41cd7df5970002eafb2f365c32ed8,300,2906.4242055150457,active
0xd1dbb08191b4ae8e227935669c1862ba75a41cd7df5970002eafb2f365c32ed8,301,2903.056749743725,active
0xd1dbb08191b4ae8e227935669c1862ba75a41cd7df5970002eafb2f365c32ed8,302,2903.1513917396683,active
0xd1dbb08191b4ae8e227935669c1862ba75a41cd7df5970002eafb2f365c32ed8,303,2901.2134180072426,active
0xd1dbb08191b4ae8e227935669c1862ba75a41cd7df5970002eafb2f365c32ed8,304,2897.7838708757945,active
0xd1dbb08191b4ae8e227935669c1862ba75a41cd7df5970002eafb2f365c32ed8,305,2899.9084272034243,active
0xd1dbb08191b4ae8e227935669c1862ba75a41cd7df5970002eafb2f365c32ed8,306,2900.1294760821133,active
0xd1dbb08191b4ae8e227935669c1862ba75a41cd7df5970002eafb2f365c32ed8,307,2905.3200470900324,active
0xd1dbb08191b4ae8e227935669c1862ba75a41cd7df5970002eafb2f365c32ed8,308,2904.4915099627747,active
0xd1dbb08191b4ae8e227935669c1862ba75a41cd7df5970002eafb2f365c32ed8,309,2904.5052280129694,active
0xd1dbb08191b4ae8e227935669c1862ba75a41cd7df5970002eafb2f365c32ed8,310,2904.8145889180473,active
0xd1dbb08191b4ae8e227935669c1862ba75a41cd7df5970002eafb2f365c32ed8,311,2905.5813817832486,active
0xd1dbb08191b4ae8e227935669c1862ba75a41cd7df5970002eafb2f365c32ed8,312,2905.4239594043775,active
0xd1dbb08191b4ae8e227935669c1862ba75a41cd7df5970002eafb2f365c32ed8,313,2908.0944757674424,active
0xd1dbb08191b4ae8e227935669c1862ba75a41cd7df5970002eafb2f365c32ed8,314,2911.4371115259264,active
