validator(0x970f9006836b3eead979bbb97d2ae8f8f331a0834209f2bc878ed142fa9ad1ee).csv
Validator,epoch,earned,active
0x970f9006836b3eead979bbb97d2ae8f8f331a0834209f2bc878ed142fa9ad1ee,314,4032.919532258884,active
0x970f9006836b3eead979bbb97d2ae8f8f331a0834209f2bc878ed142fa9ad1ee,315,4046.061670454959,active
0x970f9006836b3eead979bbb97d2ae8f8f331a0834209f2bc878ed142fa9ad1ee,316,4028.8852544727433,active
0x970f9006836b3eead979bbb97d2ae8f8f331a0834209f2bc878ed142fa9ad1ee,317,4031.159472092122,active
0x970f9006836b3eead979bbb97d2ae8f8f331a0834209f2bc878ed142fa9ad1ee,318,4031.371728839154,active
0x970f9006836b3eead979bbb97d2ae8f8f331a0834209f2bc878ed142fa9ad1ee,319,4032.4800970839865,active
0x970f9006836b3eead979bbb97d2ae8f8f331a0834209f2bc878ed142fa9ad1ee,320,4032.342012973947,active
0x970f9006836b3eead979bbb97d2ae8f8f331a0834209f2bc878ed142fa9ad1ee,321,4035.316533777695,active
0x970f9006836b3eead979bbb97d2ae8f8f331a0834209f2bc878ed142fa9ad1ee,322,4036.954358296566,active
