validator(0xc77c9ba2f86fe51cefb7aa340c6956f5c0818f999004389ab95330ba839dfb0c).csv
Validator,epoch,earned,active
0xc77c9ba2f86fe51cefb7aa340c6956f5c0818f999004389ab95330ba839dfb0c,0,NaN,active
0xc77c9ba2f86fe51cefb7aa340c6956f5c0818f999004389ab95330ba839dfb0c,1,0.0009663157894736842,active
0xc77c9ba2f86fe51cefb7aa340c6956f5c0818f999004389ab95330ba839dfb0c,2,0.000009473684210522165,active
0xc77c9ba2f86fe51cefb7aa340c6956f5c0818f999004389ab95330ba839dfb0c,3,0.000018947368400692615,active
0xc77c9ba2f86fe51cefb7aa340c6956f5c0818f999004389ab95330ba839dfb0c,4,0,active
0xc77c9ba2f86fe51cefb7aa340c6956f5c0818f999004389ab95330ba839dfb0c,5,0,active
0xc77c9ba2f86fe51cefb7aa340c6956f5c0818f999004389ab95330ba839dfb0c,6,0.000009555796306002389,active
0xc77c9ba2f86fe51cefb7aa340c6956f5c0818f999004389ab95330ba839dfb0c,7,0.000009555796306002346,active
0xc77c9ba2f86fe51cefb7aa340c6956f5c0818f999004389ab95330ba839dfb0c,8,0,active
0xc77c9ba2f86fe51cefb7aa340c6956f5c0818f999004389ab95330ba839dfb0c,9,0,active
0xc77c9ba2f86fe51cefb7aa340c6956f5c0818f999004389ab95330ba839dfb0c,10,0,active
0xc77c9ba2f86fe51cefb7aa340c6956f5c0818f999004389ab95330ba839dfb0c,11,0,active
0xc77c9ba2f86fe51cefb7aa340c6956f5c0818f999004389ab95330ba839dfb0c,12,0.000057334777898131676,active
0xc77c9ba2f86fe51cefb7aa340c6956f5c0818f999004389ab95330ba839dfb0c,13,0.00011466955579626038,active
0xc77c9ba2f86fe51cefb7aa340c6956f5c0818f999004389ab95330ba839dfb0c,14,0.000028667388949063602,active
0xc77c9ba2f86fe51cefb7aa340c6956f5c0818f999004389ab95330ba839dfb0c,15,0.014395902708551086,active
0xc77c9ba2f86fe51cefb7aa340c6956f5c0818f999004389ab95330ba839dfb0c,16,0.011801426950642313,active
0xc77c9ba2f86fe51cefb7aa340c6956f5c0818f999004389ab95330ba839dfb0c,17,0.006641278439787411,active
0xc77c9ba2f86fe51cefb7aa340c6956f5c0818f999004389ab95330ba839dfb0c,18,0.0010273897929600833,active
0xc77c9ba2f86fe51cefb7aa340c6956f5c0818f999004389ab95330ba839dfb0c,19,0.021566656947344425,active
0xc77c9ba2f86fe51cefb7aa340c6956f5c0818f999004389ab95330ba839dfb0c,20,10422.810389465676,active
0xc77c9ba2f86fe51cefb7aa340c6956f5c0818f999004389ab95330ba839dfb0c,21,10408.457682183953,active
0xc77c9ba2f86fe51cefb7aa340c6956f5c0818f999004389ab95330ba839dfb0c,22,10256.868530087364,active
0xc77c9ba2f86fe51cefb7aa340c6956f5c0818f999004389ab95330ba839dfb0c,23,10195.52702337832,active
0xc77c9ba2f86fe51cefb7aa340c6956f5c0818f999004389ab95330ba839dfb0c,24,9435.914115619957,active
0xc77c9ba2f86fe51cefb7aa340c6956f5c0818f999004389ab95330ba839dfb0c,25,9223.710230845832,active
0xc77c9ba2f86fe51cefb7aa340c6956f5c0818f999004389ab95330ba839dfb0c,26,8794.700195250314,active
0xc77c9ba2f86fe51cefb7aa340c6956f5c0818f999004389ab95330ba839dfb0c,27,8133.559868133975,active
0xc77c9ba2f86fe51cefb7aa340c6956f5c0818f999004389ab95330ba839dfb0c,28,7679.111498264249,active
0xc77c9ba2f86fe51cefb7aa340c6956f5c0818f999004389ab95330ba839dfb0c,29,7583.664481283085,active
0xc77c9ba2f86fe51cefb7aa340c6956f5c0818f999004389ab95330ba839dfb0c,30,7440.365909692301,active
0xc77c9ba2f86fe51cefb7aa340c6956f5c0818f999004389ab95330ba839dfb0c,31,7422.872517477248,active
0xc77c9ba2f86fe51cefb7aa340c6956f5c0818f999004389ab95330ba839dfb0c,32,7432.553356437917,active
0xc77c9ba2f86fe51cefb7aa340c6956f5c0818f999004389ab95330ba839dfb0c,33,7417.375398987574,active
0xc77c9ba2f86fe51cefb7aa340c6956f5c0818f999004389ab95330ba839dfb0c,34,7412.23646818345,active
0xc77c9ba2f86fe51cefb7aa340c6956f5c0818f999004389ab95330ba839dfb0c,35,7232.621670932925,active
0xc77c9ba2f86fe51cefb7aa340c6956f5c0818f999004389ab95330ba839dfb0c,36,6968.664096191109,active
0xc77c9ba2f86fe51cefb7aa340c6956f5c0818f999004389ab95330ba839dfb0c,37,6849.3097100308,active
0xc77c9ba2f86fe51cefb7aa340c6956f5c0818f999004389ab95330ba839dfb0c,38,6815.654605962527,active
0xc77c9ba2f86fe51cefb7aa340c6956f5c0818f999004389ab95330ba839dfb0c,39,6801.8359194433415,active
0xc77c9ba2f86fe51cefb7aa340c6956f5c0818f999004389ab95330ba839dfb0c,40,6775.798618941006,active
0xc77c9ba2f86fe51cefb7aa340c6956f5c0818f999004389ab95330ba839dfb0c,41,6754.267459127954,active
0xc77c9ba2f86fe51cefb7aa340c6956f5c0818f999004389ab95330ba839dfb0c,42,6731.975283237503,active
0xc77c9ba2f86fe51cefb7aa340c6956f5c0818f999004389ab95330ba839dfb0c,43,6681.347623051888,active
0xc77c9ba2f86fe51cefb7aa340c6956f5c0818f999004389ab95330ba839dfb0c,44,6680.686518645887,active
0xc77c9ba2f86fe51cefb7aa340c6956f5c0818f999004389ab95330ba839dfb0c,45,6679.528773851483,active
0xc77c9ba2f86fe51cefb7aa340c6956f5c0818f999004389ab95330ba839dfb0c,46,6679.957036288406,active
0xc77c9ba2f86fe51cefb7aa340c6956f5c0818f999004389ab95330ba839dfb0c,47,6676.877830728023,active
0xc77c9ba2f86fe51cefb7aa340c6956f5c0818f999004389ab95330ba839dfb0c,48,6687.560681107285,active
0xc77c9ba2f86fe51cefb7aa340c6956f5c0818f999004389ab95330ba839dfb0c,49,6664.174050017488,active
0xc77c9ba2f86fe51cefb7aa340c6956f5c0818f999004389ab95330ba839dfb0c,50,6665.571882706936,active
0xc77c9ba2f86fe51cefb7aa340c6956f5c0818f999004389ab95330ba839dfb0c,51,6665.114867081951,active
0xc77c9ba2f86fe51cefb7aa340c6956f5c0818f999004389ab95330ba839dfb0c,52,6665.794466846256,active
0xc77c9ba2f86fe51cefb7aa340c6956f5c0818f999004389ab95330ba839dfb0c,53,6665.400683718595,active
0xc77c9ba2f86fe51cefb7aa340c6956f5c0818f999004389ab95330ba839dfb0c,54,6667.225915594206,active
0xc77c9ba2f86fe51cefb7aa340c6956f5c0818f999004389ab95330ba839dfb0c,55,6642.530951162985,active
0xc77c9ba2f86fe51cefb7aa340c6956f5c0818f999004389ab95330ba839dfb0c,56,6623.33210978693,active
0xc77c9ba2f86fe51cefb7aa340c6956f5c0818f999004389ab95330ba839dfb0c,57,6622.44547995613,active
0xc77c9ba2f86fe51cefb7aa340c6956f5c0818f999004389ab95330ba839dfb0c,58,6611.63450580861,active
0xc77c9ba2f86fe51cefb7aa340c6956f5c0818f999004389ab95330ba839dfb0c,59,6605.4283162777265,active
0xc77c9ba2f86fe51cefb7aa340c6956f5c0818f999004389ab95330ba839dfb0c,60,6607.533511415115,active
0xc77c9ba2f86fe51cefb7aa340c6956f5c0818f999004389ab95330ba839dfb0c,61,6602.799787347927,active
0xc77c9ba2f86fe51cefb7aa340c6956f5c0818f999004389ab95330ba839dfb0c,62,6601.013549839746,active
0xc77c9ba2f86fe51cefb7aa340c6956f5c0818f999004389ab95330ba839dfb0c,63,6609.446713087796,active
0xc77c9ba2f86fe51cefb7aa340c6956f5c0818f999004389ab95330ba839dfb0c,64,6606.13772749644,active
0xc77c9ba2f86fe51cefb7aa340c6956f5c0818f999004389ab95330ba839dfb0c,65,7024.860767826838,active
0xc77c9ba2f86fe51cefb7aa340c6956f5c0818f999004389ab95330ba839dfb0c,66,7025.288849710949,active
0xc77c9ba2f86fe51cefb7aa340c6956f5c0818f999004389ab95330ba839dfb0c,67,7021.120097303794,active
0xc77c9ba2f86fe51cefb7aa340c6956f5c0818f999004389ab95330ba839dfb0c,68,7011.100820383284,active
0xc77c9ba2f86fe51cefb7aa340c6956f5c0818f999004389ab95330ba839dfb0c,69,7025.828351573612,active
0xc77c9ba2f86fe51cefb7aa340c6956f5c0818f999004389ab95330ba839dfb0c,70,6969.545280975596,active
0xc77c9ba2f86fe51cefb7aa340c6956f5c0818f999004389ab95330ba839dfb0c,71,6966.810312099397,active
0xc77c9ba2f86fe51cefb7aa340c6956f5c0818f999004389ab95330ba839dfb0c,72,6966.544274090137,active
0xc77c9ba2f86fe51cefb7aa340c6956f5c0818f999004389ab95330ba839dfb0c,73,6796.439578924019,active
0xc77c9ba2f86fe51cefb7aa340c6956f5c0818f999004389ab95330ba839dfb0c,74,6604.316943535097,active
0xc77c9ba2f86fe51cefb7aa340c6956f5c0818f999004389ab95330ba839dfb0c,75,6603.67417242582,active
0xc77c9ba2f86fe51cefb7aa340c6956f5c0818f999004389ab95330ba839dfb0c,76,6603.136787983225,active
0xc77c9ba2f86fe51cefb7aa340c6956f5c0818f999004389ab95330ba839dfb0c,77,6609.579325987799,active
0xc77c9ba2f86fe51cefb7aa340c6956f5c0818f999004389ab95330ba839dfb0c,78,6608.342268690967,active
0xc77c9ba2f86fe51cefb7aa340c6956f5c0818f999004389ab95330ba839dfb0c,79,6614.5386819257465,active
0xc77c9ba2f86fe51cefb7aa340c6956f5c0818f999004389ab95330ba839dfb0c,80,6862.705489845518,active
0xc77c9ba2f86fe51cefb7aa340c6956f5c0818f999004389ab95330ba839dfb0c,81,6614.968806348589,active
0xc77c9ba2f86fe51cefb7aa340c6956f5c0818f999004389ab95330ba839dfb0c,82,6614.950802895753,active
0xc77c9ba2f86fe51cefb7aa340c6956f5c0818f999004389ab95330ba839dfb0c,83,6642.451440085018,active
0xc77c9ba2f86fe51cefb7aa340c6956f5c0818f999004389ab95330ba839dfb0c,84,6617.328297696883,active
0xc77c9ba2f86fe51cefb7aa340c6956f5c0818f999004389ab95330ba839dfb0c,85,6635.351774405339,active
0xc77c9ba2f86fe51cefb7aa340c6956f5c0818f999004389ab95330ba839dfb0c,86,6663.034939681827,active
0xc77c9ba2f86fe51cefb7aa340c6956f5c0818f999004389ab95330ba839dfb0c,87,6665.382571210025,active
0xc77c9ba2f86fe51cefb7aa340c6956f5c0818f999004389ab95330ba839dfb0c,88,6661.6785661536005,active
0xc77c9ba2f86fe51cefb7aa340c6956f5c0818f999004389ab95330ba839dfb0c,89,6666.23731430623,active
0xc77c9ba2f86fe51cefb7aa340c6956f5c0818f999004389ab95330ba839dfb0c,90,6664.605608732121,active
0xc77c9ba2f86fe51cefb7aa340c6956f5c0818f999004389ab95330ba839dfb0c,91,6679.76238398667,active
0xc77c9ba2f86fe51cefb7aa340c6956f5c0818f999004389ab95330ba839dfb0c,92,6699.841215720215,active
0xc77c9ba2f86fe51cefb7aa340c6956f5c0818f999004389ab95330ba839dfb0c,93,6757.6810599307255,active
0xc77c9ba2f86fe51cefb7aa340c6956f5c0818f999004389ab95330ba839dfb0c,94,6798.560231560269,active
0xc77c9ba2f86fe51cefb7aa340c6956f5c0818f999004389ab95330ba839dfb0c,95,6796.305941111521,active
0xc77c9ba2f86fe51cefb7aa340c6956f5c0818f999004389ab95330ba839dfb0c,96,6814.426448562667,active
0xc77c9ba2f86fe51cefb7aa340c6956f5c0818f999004389ab95330ba839dfb0c,97,6785.257899910412,active
0xc77c9ba2f86fe51cefb7aa340c6956f5c0818f999004389ab95330ba839dfb0c,98,6836.531095237971,active
0xc77c9ba2f86fe51cefb7aa340c6956f5c0818f999004389ab95330ba839dfb0c,99,6841.554004035218,active
0xc77c9ba2f86fe51cefb7aa340c6956f5c0818f999004389ab95330ba839dfb0c,100,6863.343301488147,active
0xc77c9ba2f86fe51cefb7aa340c6956f5c0818f999004389ab95330ba839dfb0c,101,6884.582556530831,active
0xc77c9ba2f86fe51cefb7aa340c6956f5c0818f999004389ab95330ba839dfb0c,102,6919.1269946268385,active
0xc77c9ba2f86fe51cefb7aa340c6956f5c0818f999004389ab95330ba839dfb0c,103,6953.957245486714,active
0xc77c9ba2f86fe51cefb7aa340c6956f5c0818f999004389ab95330ba839dfb0c,104,6935.885562284801,active
0xc77c9ba2f86fe51cefb7aa340c6956f5c0818f999004389ab95330ba839dfb0c,105,6959.253894342704,active
0xc77c9ba2f86fe51cefb7aa340c6956f5c0818f999004389ab95330ba839dfb0c,106,6885.380245077619,active
0xc77c9ba2f86fe51cefb7aa340c6956f5c0818f999004389ab95330ba839dfb0c,107,6702.48149956689,active
0xc77c9ba2f86fe51cefb7aa340c6956f5c0818f999004389ab95330ba839dfb0c,108,6657.8048991799715,active
0xc77c9ba2f86fe51cefb7aa340c6956f5c0818f999004389ab95330ba839dfb0c,109,6658.622311741664,active
0xc77c9ba2f86fe51cefb7aa340c6956f5c0818f999004389ab95330ba839dfb0c,110,5990.916099609759,active
0xc77c9ba2f86fe51cefb7aa340c6956f5c0818f999004389ab95330ba839dfb0c,111,5988.449724820253,active
0xc77c9ba2f86fe51cefb7aa340c6956f5c0818f999004389ab95330ba839dfb0c,112,5994.117162108887,active
0xc77c9ba2f86fe51cefb7aa340c6956f5c0818f999004389ab95330ba839dfb0c,113,5993.79210570364,active
0xc77c9ba2f86fe51cefb7aa340c6956f5c0818f999004389ab95330ba839dfb0c,114,5993.545961877225,active
0xc77c9ba2f86fe51cefb7aa340c6956f5c0818f999004389ab95330ba839dfb0c,115,5993.383558802261,active
0xc77c9ba2f86fe51cefb7aa340c6956f5c0818f999004389ab95330ba839dfb0c,116,5991.286153003107,active
0xc77c9ba2f86fe51cefb7aa340c6956f5c0818f999004389ab95330ba839dfb0c,117,5990.617744929067,active
0xc77c9ba2f86fe51cefb7aa340c6956f5c0818f999004389ab95330ba839dfb0c,118,5982.9445798477245,active
0xc77c9ba2f86fe51cefb7aa340c6956f5c0818f999004389ab95330ba839dfb0c,119,5979.767715188237,active
0xc77c9ba2f86fe51cefb7aa340c6956f5c0818f999004389ab95330ba839dfb0c,120,5978.558382419162,active
0xc77c9ba2f86fe51cefb7aa340c6956f5c0818f999004389ab95330ba839dfb0c,121,5974.847699944755,active
0xc77c9ba2f86fe51cefb7aa340c6956f5c0818f999004389ab95330ba839dfb0c,122,5976.181876804493,active
0xc77c9ba2f86fe51cefb7aa340c6956f5c0818f999004389ab95330ba839dfb0c,123,5974.890108953063,active
0xc77c9ba2f86fe51cefb7aa340c6956f5c0818f999004389ab95330ba839dfb0c,124,5975.137827306182,active
0xc77c9ba2f86fe51cefb7aa340c6956f5c0818f999004389ab95330ba839dfb0c,125,5974.496270576049,active
0xc77c9ba2f86fe51cefb7aa340c6956f5c0818f999004389ab95330ba839dfb0c,126,5975.092160053231,active
0xc77c9ba2f86fe51cefb7aa340c6956f5c0818f999004389ab95330ba839dfb0c,127,5987.686929614859,active
0xc77c9ba2f86fe51cefb7aa340c6956f5c0818f999004389ab95330ba839dfb0c,128,5985.813410064372,active
0xc77c9ba2f86fe51cefb7aa340c6956f5c0818f999004389ab95330ba839dfb0c,129,5985.295831440158,active
0xc77c9ba2f86fe51cefb7aa340c6956f5c0818f999004389ab95330ba839dfb0c,130,5986.765939911505,active
0xc77c9ba2f86fe51cefb7aa340c6956f5c0818f999004389ab95330ba839dfb0c,131,6002.190310374159,active
0xc77c9ba2f86fe51cefb7aa340c6956f5c0818f999004389ab95330ba839dfb0c,132,6001.814480127129,active
0xc77c9ba2f86fe51cefb7aa340c6956f5c0818f999004389ab95330ba839dfb0c,133,5988.948834791613,active
0xc77c9ba2f86fe51cefb7aa340c6956f5c0818f999004389ab95330ba839dfb0c,134,5994.849688352369,active
0xc77c9ba2f86fe51cefb7aa340c6956f5c0818f999004389ab95330ba839dfb0c,135,5986.729732547061,active
0xc77c9ba2f86fe51cefb7aa340c6956f5c0818f999004389ab95330ba839dfb0c,136,5990.505552003379,active
0xc77c9ba2f86fe51cefb7aa340c6956f5c0818f999004389ab95330ba839dfb0c,137,5993.205831691988,active
0xc77c9ba2f86fe51cefb7aa340c6956f5c0818f999004389ab95330ba839dfb0c,138,5988.807471405849,active
0xc77c9ba2f86fe51cefb7aa340c6956f5c0818f999004389ab95330ba839dfb0c,139,5984.492934400964,active
0xc77c9ba2f86fe51cefb7aa340c6956f5c0818f999004389ab95330ba839dfb0c,140,5989.001950493678,active
0xc77c9ba2f86fe51cefb7aa340c6956f5c0818f999004389ab95330ba839dfb0c,141,5993.441811861234,active
0xc77c9ba2f86fe51cefb7aa340c6956f5c0818f999004389ab95330ba839dfb0c,142,5995.9731483358055,active
0xc77c9ba2f86fe51cefb7aa340c6956f5c0818f999004389ab95330ba839dfb0c,143,5996.8919094276025,active
0xc77c9ba2f86fe51cefb7aa340c6956f5c0818f999004389ab95330ba839dfb0c,144,6001.282924511224,active
0xc77c9ba2f86fe51cefb7aa340c6956f5c0818f999004389ab95330ba839dfb0c,145,6000.462487014434,active
0xc77c9ba2f86fe51cefb7aa340c6956f5c0818f999004389ab95330ba839dfb0c,146,6005.475744381575,active
0xc77c9ba2f86fe51cefb7aa340c6956f5c0818f999004389ab95330ba839dfb0c,147,6010.559640730625,active
0xc77c9ba2f86fe51cefb7aa340c6956f5c0818f999004389ab95330ba839dfb0c,148,6018.853023107875,active
0xc77c9ba2f86fe51cefb7aa340c6956f5c0818f999004389ab95330ba839dfb0c,149,6058.31262107474,active
0xc77c9ba2f86fe51cefb7aa340c6956f5c0818f999004389ab95330ba839dfb0c,150,6057.357645082484,active
0xc77c9ba2f86fe51cefb7aa340c6956f5c0818f999004389ab95330ba839dfb0c,151,6057.668123438219,active
0xc77c9ba2f86fe51cefb7aa340c6956f5c0818f999004389ab95330ba839dfb0c,152,6058.054130119689,active
0xc77c9ba2f86fe51cefb7aa340c6956f5c0818f999004389ab95330ba839dfb0c,153,6053.764281130802,active
0xc77c9ba2f86fe51cefb7aa340c6956f5c0818f999004389ab95330ba839dfb0c,154,6060.01700360174,active
0xc77c9ba2f86fe51cefb7aa340c6956f5c0818f999004389ab95330ba839dfb0c,155,6059.462854516171,active
0xc77c9ba2f86fe51cefb7aa340c6956f5c0818f999004389ab95330ba839dfb0c,156,6053.684968946955,active
0xc77c9ba2f86fe51cefb7aa340c6956f5c0818f999004389ab95330ba839dfb0c,157,6054.1704277417,active
0xc77c9ba2f86fe51cefb7aa340c6956f5c0818f999004389ab95330ba839dfb0c,158,6053.880529554883,active
0xc77c9ba2f86fe51cefb7aa340c6956f5c0818f999004389ab95330ba839dfb0c,159,6054.975847226706,active
0xc77c9ba2f86fe51cefb7aa340c6956f5c0818f999004389ab95330ba839dfb0c,160,5869.74250275824,active
0xc77c9ba2f86fe51cefb7aa340c6956f5c0818f999004389ab95330ba839dfb0c,161,5863.162367399746,active
0xc77c9ba2f86fe51cefb7aa340c6956f5c0818f999004389ab95330ba839dfb0c,162,5884.648150147087,active
0xc77c9ba2f86fe51cefb7aa340c6956f5c0818f999004389ab95330ba839dfb0c,163,5885.199962565761,active
0xc77c9ba2f86fe51cefb7aa340c6956f5c0818f999004389ab95330ba839dfb0c,164,5886.075769413363,active
0xc77c9ba2f86fe51cefb7aa340c6956f5c0818f999004389ab95330ba839dfb0c,165,5883.877023888163,active
0xc77c9ba2f86fe51cefb7aa340c6956f5c0818f999004389ab95330ba839dfb0c,166,5885.4611600545595,active
0xc77c9ba2f86fe51cefb7aa340c6956f5c0818f999004389ab95330ba839dfb0c,167,5525.189509004506,active
0xc77c9ba2f86fe51cefb7aa340c6956f5c0818f999004389ab95330ba839dfb0c,168,5544.9679861486,active
0xc77c9ba2f86fe51cefb7aa340c6956f5c0818f999004389ab95330ba839dfb0c,169,5557.5326568169385,active
0xc77c9ba2f86fe51cefb7aa340c6956f5c0818f999004389ab95330ba839dfb0c,170,5563.7419402125415,active
0xc77c9ba2f86fe51cefb7aa340c6956f5c0818f999004389ab95330ba839dfb0c,171,5556.602456303145,active
0xc77c9ba2f86fe51cefb7aa340c6956f5c0818f999004389ab95330ba839dfb0c,172,5476.281501667323,active
0xc77c9ba2f86fe51cefb7aa340c6956f5c0818f999004389ab95330ba839dfb0c,173,5475.197396852266,active
0xc77c9ba2f86fe51cefb7aa340c6956f5c0818f999004389ab95330ba839dfb0c,174,5473.517664341338,active
0xc77c9ba2f86fe51cefb7aa340c6956f5c0818f999004389ab95330ba839dfb0c,175,5477.181515140307,active
0xc77c9ba2f86fe51cefb7aa340c6956f5c0818f999004389ab95330ba839dfb0c,176,5483.141085406218,active
0xc77c9ba2f86fe51cefb7aa340c6956f5c0818f999004389ab95330ba839dfb0c,177,5486.703201603831,active
0xc77c9ba2f86fe51cefb7aa340c6956f5c0818f999004389ab95330ba839dfb0c,178,5486.894122170883,active
0xc77c9ba2f86fe51cefb7aa340c6956f5c0818f999004389ab95330ba839dfb0c,179,5485.989987245836,active
0xc77c9ba2f86fe51cefb7aa340c6956f5c0818f999004389ab95330ba839dfb0c,180,5485.083318140395,active
0xc77c9ba2f86fe51cefb7aa340c6956f5c0818f999004389ab95330ba839dfb0c,181,5485.5759957117225,active
0xc77c9ba2f86fe51cefb7aa340c6956f5c0818f999004389ab95330ba839dfb0c,182,5486.286579983318,active
0xc77c9ba2f86fe51cefb7aa340c6956f5c0818f999004389ab95330ba839dfb0c,183,5488.387481790522,active
0xc77c9ba2f86fe51cefb7aa340c6956f5c0818f999004389ab95330ba839dfb0c,184,5499.113984975675,active
0xc77c9ba2f86fe51cefb7aa340c6956f5c0818f999004389ab95330ba839dfb0c,185,5491.971366752766,active
0xc77c9ba2f86fe51cefb7aa340c6956f5c0818f999004389ab95330ba839dfb0c,186,5490.300220209964,active
0xc77c9ba2f86fe51cefb7aa340c6956f5c0818f999004389ab95330ba839dfb0c,187,5492.791976124654,active
0xc77c9ba2f86fe51cefb7aa340c6956f5c0818f999004389ab95330ba839dfb0c,188,5497.152708182441,active
0xc77c9ba2f86fe51cefb7aa340c6956f5c0818f999004389ab95330ba839dfb0c,189,5482.056754063063,active
0xc77c9ba2f86fe51cefb7aa340c6956f5c0818f999004389ab95330ba839dfb0c,190,5488.769504569017,active
0xc77c9ba2f86fe51cefb7aa340c6956f5c0818f999004389ab95330ba839dfb0c,191,5500.391425755724,active
0xc77c9ba2f86fe51cefb7aa340c6956f5c0818f999004389ab95330ba839dfb0c,192,5487.463836963299,active
0xc77c9ba2f86fe51cefb7aa340c6956f5c0818f999004389ab95330ba839dfb0c,193,5487.176897732108,active
0xc77c9ba2f86fe51cefb7aa340c6956f5c0818f999004389ab95330ba839dfb0c,194,5487.129255947317,active
0xc77c9ba2f86fe51cefb7aa340c6956f5c0818f999004389ab95330ba839dfb0c,195,5486.939807433275,active
0xc77c9ba2f86fe51cefb7aa340c6956f5c0818f999004389ab95330ba839dfb0c,196,5487.303889563966,active
0xc77c9ba2f86fe51cefb7aa340c6956f5c0818f999004389ab95330ba839dfb0c,197,5476.264795795393,active
0xc77c9ba2f86fe51cefb7aa340c6956f5c0818f999004389ab95330ba839dfb0c,198,5467.581812284637,active
0xc77c9ba2f86fe51cefb7aa340c6956f5c0818f999004389ab95330ba839dfb0c,199,5477.332480428136,active
0xc77c9ba2f86fe51cefb7aa340c6956f5c0818f999004389ab95330ba839dfb0c,200,4944.162750680944,active
0xc77c9ba2f86fe51cefb7aa340c6956f5c0818f999004389ab95330ba839dfb0c,201,4938.922930386501,active
0xc77c9ba2f86fe51cefb7aa340c6956f5c0818f999004389ab95330ba839dfb0c,202,4939.355229447266,active
0xc77c9ba2f86fe51cefb7aa340c6956f5c0818f999004389ab95330ba839dfb0c,203,4961.443887118995,active
0xc77c9ba2f86fe51cefb7aa340c6956f5c0818f999004389ab95330ba839dfb0c,204,4965.458350008956,active
0xc77c9ba2f86fe51cefb7aa340c6956f5c0818f999004389ab95330ba839dfb0c,205,4973.243813787121,active
0xc77c9ba2f86fe51cefb7aa340c6956f5c0818f999004389ab95330ba839dfb0c,206,4972.798145784558,active
0xc77c9ba2f86fe51cefb7aa340c6956f5c0818f999004389ab95330ba839dfb0c,207,4970.456417328147,active
0xc77c9ba2f86fe51cefb7aa340c6956f5c0818f999004389ab95330ba839dfb0c,208,4972.619903331072,active
0xc77c9ba2f86fe51cefb7aa340c6956f5c0818f999004389ab95330ba839dfb0c,209,4971.029170317676,active
0xc77c9ba2f86fe51cefb7aa340c6956f5c0818f999004389ab95330ba839dfb0c,210,4963.874380567745,active
0xc77c9ba2f86fe51cefb7aa340c6956f5c0818f999004389ab95330ba839dfb0c,211,4975.073427318458,active
0xc77c9ba2f86fe51cefb7aa340c6956f5c0818f999004389ab95330ba839dfb0c,212,4965.371511686509,active
0xc77c9ba2f86fe51cefb7aa340c6956f5c0818f999004389ab95330ba839dfb0c,213,4966.461820421482,active
0xc77c9ba2f86fe51cefb7aa340c6956f5c0818f999004389ab95330ba839dfb0c,214,4964.878816425736,active
0xc77c9ba2f86fe51cefb7aa340c6956f5c0818f999004389ab95330ba839dfb0c,215,4968.291309908771,active
0xc77c9ba2f86fe51cefb7aa340c6956f5c0818f999004389ab95330ba839dfb0c,216,4963.258732205814,active
0xc77c9ba2f86fe51cefb7aa340c6956f5c0818f999004389ab95330ba839dfb0c,217,4962.770921666301,active
0xc77c9ba2f86fe51cefb7aa340c6956f5c0818f999004389ab95330ba839dfb0c,218,4965.440758621998,active
0xc77c9ba2f86fe51cefb7aa340c6956f5c0818f999004389ab95330ba839dfb0c,219,4960.28318047328,active
0xc77c9ba2f86fe51cefb7aa340c6956f5c0818f999004389ab95330ba839dfb0c,220,4966.942206806745,active
0xc77c9ba2f86fe51cefb7aa340c6956f5c0818f999004389ab95330ba839dfb0c,221,4973.113368436918,active
0xc77c9ba2f86fe51cefb7aa340c6956f5c0818f999004389ab95330ba839dfb0c,222,4947.736460852429,active
0xc77c9ba2f86fe51cefb7aa340c6956f5c0818f999004389ab95330ba839dfb0c,223,4947.818463388004,active
0xc77c9ba2f86fe51cefb7aa340c6956f5c0818f999004389ab95330ba839dfb0c,224,4967.610196855782,active
0xc77c9ba2f86fe51cefb7aa340c6956f5c0818f999004389ab95330ba839dfb0c,225,4966.543634623996,active
0xc77c9ba2f86fe51cefb7aa340c6956f5c0818f999004389ab95330ba839dfb0c,226,4967.4104023551,active
0xc77c9ba2f86fe51cefb7aa340c6956f5c0818f999004389ab95330ba839dfb0c,227,4968.158705723138,active
0xc77c9ba2f86fe51cefb7aa340c6956f5c0818f999004389ab95330ba839dfb0c,228,4967.293145033896,active
0xc77c9ba2f86fe51cefb7aa340c6956f5c0818f999004389ab95330ba839dfb0c,229,4971.861524035461,active
0xc77c9ba2f86fe51cefb7aa340c6956f5c0818f999004389ab95330ba839dfb0c,230,4968.363072634093,active
0xc77c9ba2f86fe51cefb7aa340c6956f5c0818f999004389ab95330ba839dfb0c,231,4977.871046679156,active
0xc77c9ba2f86fe51cefb7aa340c6956f5c0818f999004389ab95330ba839dfb0c,232,4980.203360484304,active
0xc77c9ba2f86fe51cefb7aa340c6956f5c0818f999004389ab95330ba839dfb0c,233,4981.072302993979,active
0xc77c9ba2f86fe51cefb7aa340c6956f5c0818f999004389ab95330ba839dfb0c,234,4979.69853444946,active
0xc77c9ba2f86fe51cefb7aa340c6956f5c0818f999004389ab95330ba839dfb0c,235,4977.690223030085,active
0xc77c9ba2f86fe51cefb7aa340c6956f5c0818f999004389ab95330ba839dfb0c,236,4977.481517184946,active
0xc77c9ba2f86fe51cefb7aa340c6956f5c0818f999004389ab95330ba839dfb0c,237,4979.271048352315,active
0xc77c9ba2f86fe51cefb7aa340c6956f5c0818f999004389ab95330ba839dfb0c,238,4978.5670155054395,active
0xc77c9ba2f86fe51cefb7aa340c6956f5c0818f999004389ab95330ba839dfb0c,239,4981.866432774542,active
0xc77c9ba2f86fe51cefb7aa340c6956f5c0818f999004389ab95330ba839dfb0c,240,4995.491544183125,active
0xc77c9ba2f86fe51cefb7aa340c6956f5c0818f999004389ab95330ba839dfb0c,241,4994.39422953936,active
0xc77c9ba2f86fe51cefb7aa340c6956f5c0818f999004389ab95330ba839dfb0c,242,4994.42640381742,active
0xc77c9ba2f86fe51cefb7aa340c6956f5c0818f999004389ab95330ba839dfb0c,243,4994.909363194313,active
0xc77c9ba2f86fe51cefb7aa340c6956f5c0818f999004389ab95330ba839dfb0c,244,4998.744146457003,active
0xc77c9ba2f86fe51cefb7aa340c6956f5c0818f999004389ab95330ba839dfb0c,245,5014.632692547564,active
0xc77c9ba2f86fe51cefb7aa340c6956f5c0818f999004389ab95330ba839dfb0c,246,5001.227018277481,active
0xc77c9ba2f86fe51cefb7aa340c6956f5c0818f999004389ab95330ba839dfb0c,247,5036.133160190631,active
0xc77c9ba2f86fe51cefb7aa340c6956f5c0818f999004389ab95330ba839dfb0c,248,5018.475855901045,active
0xc77c9ba2f86fe51cefb7aa340c6956f5c0818f999004389ab95330ba839dfb0c,249,5005.307148696433,active
0xc77c9ba2f86fe51cefb7aa340c6956f5c0818f999004389ab95330ba839dfb0c,250,5007.247839830677,active
0xc77c9ba2f86fe51cefb7aa340c6956f5c0818f999004389ab95330ba839dfb0c,251,5005.036023942381,active
0xc77c9ba2f86fe51cefb7aa340c6956f5c0818f999004389ab95330ba839dfb0c,252,5000.713168063783,active
0xc77c9ba2f86fe51cefb7aa340c6956f5c0818f999004389ab95330ba839dfb0c,253,5002.585485030849,active
0xc77c9ba2f86fe51cefb7aa340c6956f5c0818f999004389ab95330ba839dfb0c,254,5052.460582012681,active
0xc77c9ba2f86fe51cefb7aa340c6956f5c0818f999004389ab95330ba839dfb0c,255,5002.320382126012,active
0xc77c9ba2f86fe51cefb7aa340c6956f5c0818f999004389ab95330ba839dfb0c,256,5002.273032420548,active
0xc77c9ba2f86fe51cefb7aa340c6956f5c0818f999004389ab95330ba839dfb0c,257,5002.697256454266,active
0xc77c9ba2f86fe51cefb7aa340c6956f5c0818f999004389ab95330ba839dfb0c,258,5005.678557262341,active
0xc77c9ba2f86fe51cefb7aa340c6956f5c0818f999004389ab95330ba839dfb0c,259,5000.936266010302,active
0xc77c9ba2f86fe51cefb7aa340c6956f5c0818f999004389ab95330ba839dfb0c,260,5000.501566467448,active
0xc77c9ba2f86fe51cefb7aa340c6956f5c0818f999004389ab95330ba839dfb0c,261,5000.197067682255,active
0xc77c9ba2f86fe51cefb7aa340c6956f5c0818f999004389ab95330ba839dfb0c,262,5002.51486121241,active
0xc77c9ba2f86fe51cefb7aa340c6956f5c0818f999004389ab95330ba839dfb0c,263,5001.926022287679,active
0xc77c9ba2f86fe51cefb7aa340c6956f5c0818f999004389ab95330ba839dfb0c,264,5002.534104391831,active
0xc77c9ba2f86fe51cefb7aa340c6956f5c0818f999004389ab95330ba839dfb0c,265,5043.325738948171,active
0xc77c9ba2f86fe51cefb7aa340c6956f5c0818f999004389ab95330ba839dfb0c,266,4983.238060456459,active
0xc77c9ba2f86fe51cefb7aa340c6956f5c0818f999004389ab95330ba839dfb0c,267,4975.792474812305,active
0xc77c9ba2f86fe51cefb7aa340c6956f5c0818f999004389ab95330ba839dfb0c,268,4978.506800455239,active
0xc77c9ba2f86fe51cefb7aa340c6956f5c0818f999004389ab95330ba839dfb0c,269,4976.592023919403,active
0xc77c9ba2f86fe51cefb7aa340c6956f5c0818f999004389ab95330ba839dfb0c,270,4979.558526287334,active
0xc77c9ba2f86fe51cefb7aa340c6956f5c0818f999004389ab95330ba839dfb0c,271,4959.016143596248,active
0xc77c9ba2f86fe51cefb7aa340c6956f5c0818f999004389ab95330ba839dfb0c,272,4957.092756209205,active
0xc77c9ba2f86fe51cefb7aa340c6956f5c0818f999004389ab95330ba839dfb0c,273,4955.787848976895,active
0xc77c9ba2f86fe51cefb7aa340c6956f5c0818f999004389ab95330ba839dfb0c,274,4956.257079458266,active
0xc77c9ba2f86fe51cefb7aa340c6956f5c0818f999004389ab95330ba839dfb0c,275,4961.87383983969,active
0xc77c9ba2f86fe51cefb7aa340c6956f5c0818f999004389ab95330ba839dfb0c,276,4968.106035206445,active
0xc77c9ba2f86fe51cefb7aa340c6956f5c0818f999004389ab95330ba839dfb0c,277,4969.3547198563165,active
0xc77c9ba2f86fe51cefb7aa340c6956f5c0818f999004389ab95330ba839dfb0c,278,4960.646114090061,active
0xc77c9ba2f86fe51cefb7aa340c6956f5c0818f999004389ab95330ba839dfb0c,279,4963.225344494145,active
0xc77c9ba2f86fe51cefb7aa340c6956f5c0818f999004389ab95330ba839dfb0c,280,4963.469901999978,active
0xc77c9ba2f86fe51cefb7aa340c6956f5c0818f999004389ab95330ba839dfb0c,281,4965.036146245386,active
0xc77c9ba2f86fe51cefb7aa340c6956f5c0818f999004389ab95330ba839dfb0c,282,4962.417116657099,active
0xc77c9ba2f86fe51cefb7aa340c6956f5c0818f999004389ab95330ba839dfb0c,283,4961.577214036935,active
0xc77c9ba2f86fe51cefb7aa340c6956f5c0818f999004389ab95330ba839dfb0c,284,4962.697345933342,active
0xc77c9ba2f86fe51cefb7aa340c6956f5c0818f999004389ab95330ba839dfb0c,285,4959.897319991846,active
0xc77c9ba2f86fe51cefb7aa340c6956f5c0818f999004389ab95330ba839dfb0c,286,4958.140047501367,active
0xc77c9ba2f86fe51cefb7aa340c6956f5c0818f999004389ab95330ba839dfb0c,287,4951.194139481415,active
0xc77c9ba2f86fe51cefb7aa340c6956f5c0818f999004389ab95330ba839dfb0c,288,4953.686513006088,active
0xc77c9ba2f86fe51cefb7aa340c6956f5c0818f999004389ab95330ba839dfb0c,289,4950.455126068597,active
0xc77c9ba2f86fe51cefb7aa340c6956f5c0818f999004389ab95330ba839dfb0c,290,4455.668745451802,active
0xc77c9ba2f86fe51cefb7aa340c6956f5c0818f999004389ab95330ba839dfb0c,291,4456.232784587069,active
0xc77c9ba2f86fe51cefb7aa340c6956f5c0818f999004389ab95330ba839dfb0c,292,4454.974871856689,active
0xc77c9ba2f86fe51cefb7aa340c6956f5c0818f999004389ab95330ba839dfb0c,293,4456.758044164751,active
0xc77c9ba2f86fe51cefb7aa340c6956f5c0818f999004389ab95330ba839dfb0c,294,4455.109493197814,active
0xc77c9ba2f86fe51cefb7aa340c6956f5c0818f999004389ab95330ba839dfb0c,295,4453.569186014711,active
0xc77c9ba2f86fe51cefb7aa340c6956f5c0818f999004389ab95330ba839dfb0c,296,4454.541821872929,active
0xc77c9ba2f86fe51cefb7aa340c6956f5c0818f999004389ab95330ba839dfb0c,297,4482.278289927453,active
0xc77c9ba2f86fe51cefb7aa340c6956f5c0818f999004389ab95330ba839dfb0c,298,4479.570601456194,active
0xc77c9ba2f86fe51cefb7aa340c6956f5c0818f999004389ab95330ba839dfb0c,299,4454.314785020441,active
0xc77c9ba2f86fe51cefb7aa340c6956f5c0818f999004389ab95330ba839dfb0c,300,4454.685745229682,active
0xc77c9ba2f86fe51cefb7aa340c6956f5c0818f999004389ab95330ba839dfb0c,301,4449.533194591156,active
0xc77c9ba2f86fe51cefb7aa340c6956f5c0818f999004389ab95330ba839dfb0c,302,4449.687001978188,active
0xc77c9ba2f86fe51cefb7aa340c6956f5c0818f999004389ab95330ba839dfb0c,303,4446.725394360428,active
0xc77c9ba2f86fe51cefb7aa340c6956f5c0818f999004389ab95330ba839dfb0c,304,4441.477611096038,active
0xc77c9ba2f86fe51cefb7aa340c6956f5c0818f999004389ab95330ba839dfb0c,305,4444.742672011165,active
0xc77c9ba2f86fe51cefb7aa340c6956f5c0818f999004389ab95330ba839dfb0c,306,4445.090204904727,active
0xc77c9ba2f86fe51cefb7aa340c6956f5c0818f999004389ab95330ba839dfb0c,307,4453.054646342571,active
0xc77c9ba2f86fe51cefb7aa340c6956f5c0818f999004389ab95330ba839dfb0c,308,4451.793482423293,active
0xc77c9ba2f86fe51cefb7aa340c6956f5c0818f999004389ab95330ba839dfb0c,309,4451.823260270282,active
0xc77c9ba2f86fe51cefb7aa340c6956f5c0818f999004389ab95330ba839dfb0c,310,4452.306179102922,active
0xc77c9ba2f86fe51cefb7aa340c6956f5c0818f999004389ab95330ba839dfb0c,311,4453.49022252807,active
0xc77c9ba2f86fe51cefb7aa340c6956f5c0818f999004389ab95330ba839dfb0c,312,4453.257690993079,active
0xc77c9ba2f86fe51cefb7aa340c6956f5c0818f999004389ab95330ba839dfb0c,313,4457.35965880298,active
0xc77c9ba2f86fe51cefb7aa340c6956f5c0818f999004389ab95330ba839dfb0c,314,4462.491837874861,active
