validator(0x68cf08c4ef8b0462d8c3879f4e26cc371fbddd844650d0c41a9c3badc81046094).csv
Validator,epoch,earned,active
0x68cf08c4ef8b0462d8c3879f4e26cc371fbddd844650d0c41a9c3badc8104609,0,NaN,active
0x68cf08c4ef8b0462d8c3879f4e26cc371fbddd844650d0c41a9c3badc8104609,1,0.0000758021052631579,active
0x68cf08c4ef8b0462d8c3879f4e26cc371fbddd844650d0c41a9c3badc8104609,2,7.431578947365164e-7,active
0x68cf08c4ef8b0462d8c3879f4e26cc371fbddd844650d0c41a9c3badc8104609,3,0.0000014863157878765538,active
0x68cf08c4ef8b0462d8c3879f4e26cc371fbddd844650d0c41a9c3badc8104609,4,0,active
0x68cf08c4ef8b0462d8c3879f4e26cc371fbddd844650d0c41a9c3badc8104609,5,0,active
0x68cf08c4ef8b0462d8c3879f4e26cc371fbddd844650d0c41a9c3badc8104609,6,7.495991324486319e-7,active
0x68cf08c4ef8b0462d8c3879f4e26cc371fbddd844650d0c41a9c3badc8104609,7,7.495991324486285e-7,active
0x68cf08c4ef8b0462d8c3879f4e26cc371fbddd844650d0c41a9c3badc8104609,8,0,active
0x68cf08c4ef8b0462d8c3879f4e26cc371fbddd844650d0c41a9c3badc8104609,9,0,active
0x68cf08c4ef8b0462d8c3879f4e26cc371fbddd844650d0c41a9c3badc8104609,10,0,active
0x68cf08c4ef8b0462d8c3879f4e26cc371fbddd844650d0c41a9c3badc8104609,11,0,active
0x68cf08c4ef8b0462d8c3879f4e26cc371fbddd844650d0c41a9c3badc8104609,12,0.000004497594799564552,active
0x68cf08c4ef8b0462d8c3879f4e26cc371fbddd844650d0c41a9c3badc8104609,13,0.00000899518959912887,active
0x68cf08c4ef8b0462d8c3879f4e26cc371fbddd844650d0c41a9c3badc8104609,14,0.0000022487973997821,active
0x68cf08c4ef8b0462d8c3879f4e26cc371fbddd844650d0c41a9c3badc8104609,15,0.001129278590248563,active
0x68cf08c4ef8b0462d8c3879f4e26cc371fbddd844650d0c41a9c3badc8104609,16,0.0009257563807948304,active
0x68cf08c4ef8b0462d8c3879f4e26cc371fbddd844650d0c41a9c3badc8104609,17,0.0005209713976099902,active
0x68cf08c4ef8b0462d8c3879f4e26cc371fbddd844650d0c41a9c3badc8104609,18,0.00008059302153664652,active
0x68cf08c4ef8b0462d8c3879f4e26cc371fbddd844650d0c41a9c3badc8104609,19,0.0016917844227583515,active
0x68cf08c4ef8b0462d8c3879f4e26cc371fbddd844650d0c41a9c3badc8104609,20,809.2685953417102,active
0x68cf08c4ef8b0462d8c3879f4e26cc371fbddd844650d0c41a9c3badc8104609,21,808.1522842787332,active
0x68cf08c4ef8b0462d8c3879f4e26cc371fbddd844650d0c41a9c3badc8104609,22,821.5293028003337,active
0x68cf08c4ef8b0462d8c3879f4e26cc371fbddd844650d0c41a9c3badc8104609,23,816.6200382744316,active
0x68cf08c4ef8b0462d8c3879f4e26cc371fbddd844650d0c41a9c3badc8104609,24,755.7817510703634,active
0x68cf08c4ef8b0462d8c3879f4e26cc371fbddd844650d0c41a9c3badc8104609,25,723.5555162855322,active
0x68cf08c4ef8b0462d8c3879f4e26cc371fbddd844650d0c41a9c3badc8104609,26,689.9017511489266,active
0x68cf08c4ef8b0462d8c3879f4e26cc371fbddd844650d0c41a9c3badc8104609,27,638.038485852053,active
0x68cf08c4ef8b0462d8c3879f4e26cc371fbddd844650d0c41a9c3badc8104609,28,602.3892062610074,active
0x68cf08c4ef8b0462d8c3879f4e26cc371fbddd844650d0c41a9c3badc8104609,29,594.9018487962458,active
0x68cf08c4ef8b0462d8c3879f4e26cc371fbddd844650d0c41a9c3badc8104609,30,583.6607679995388,active
0x68cf08c4ef8b0462d8c3879f4e26cc371fbddd844650d0c41a9c3badc8104609,31,582.2884958748774,active
0x68cf08c4ef8b0462d8c3879f4e26cc371fbddd844650d0c41a9c3badc8104609,32,583.0479109320456,active
0x68cf08c4ef8b0462d8c3879f4e26cc371fbddd844650d0c41a9c3badc8104609,33,581.8572734809237,active
0x68cf08c4ef8b0462d8c3879f4e26cc371fbddd844650d0c41a9c3badc8104609,34,581.454149180824,active
0x68cf08c4ef8b0462d8c3879f4e26cc371fbddd844650d0c41a9c3badc8104609,35,567.3642358916452,active
0x68cf08c4ef8b0462d8c3879f4e26cc371fbddd844650d0c41a9c3badc8104609,36,546.6580390912419,active
0x68cf08c4ef8b0462d8c3879f4e26cc371fbddd844650d0c41a9c3badc8104609,37,531.7561375561767,active
0x68cf08c4ef8b0462d8c3879f4e26cc371fbddd844650d0c41a9c3badc8104609,38,529.1424469850133,active
0x68cf08c4ef8b0462d8c3879f4e26cc371fbddd844650d0c41a9c3badc8104609,39,528.0687931273382,active
0x68cf08c4ef8b0462d8c3879f4e26cc371fbddd844650d0c41a9c3badc8104609,40,526.0465389308794,active
0x68cf08c4ef8b0462d8c3879f4e26cc371fbddd844650d0c41a9c3badc8104609,41,524.3741328701574,active
0x68cf08c4ef8b0462d8c3879f4e26cc371fbddd844650d0c41a9c3badc8104609,42,522.6426525364233,active
0x68cf08c4ef8b0462d8c3879f4e26cc371fbddd844650d0c41a9c3badc8104609,43,518.7113341553728,active
0x68cf08c4ef8b0462d8c3879f4e26cc371fbddd844650d0c41a9c3badc8104609,44,518.6592182878661,active
0x68cf08c4ef8b0462d8c3879f4e26cc371fbddd844650d0c41a9c3badc8104609,45,518.5685458489558,active
0x68cf08c4ef8b0462d8c3879f4e26cc371fbddd844650d0c41a9c3badc8104609,46,518.6010042132187,active
0x68cf08c4ef8b0462d8c3879f4e26cc371fbddd844650d0c41a9c3badc8104609,47,518.3611593467459,active
0x68cf08c4ef8b0462d8c3879f4e26cc371fbddd844650d0c41a9c3badc8104609,48,519.1897348813193,active
0x68cf08c4ef8b0462d8c3879f4e26cc371fbddd844650d0c41a9c3badc8104609,49,517.3733216833074,active
0x68cf08c4ef8b0462d8c3879f4e26cc371fbddd844650d0c41a9c3badc8104609,50,517.4810564387572,active
0x68cf08c4ef8b0462d8c3879f4e26cc371fbddd844650d0c41a9c3badc8104609,51,517.4447900581446,active
0x68cf08c4ef8b0462d8c3879f4e26cc371fbddd844650d0c41a9c3badc8104609,52,517.4967647187202,active
0x68cf08c4ef8b0462d8c3879f4e26cc371fbddd844650d0c41a9c3badc8104609,53,517.4654076540645,active
0x68cf08c4ef8b0462d8c3879f4e26cc371fbddd844650d0c41a9c3badc8104609,54,517.6063228235805,active
0x68cf08c4ef8b0462d8c3879f4e26cc371fbddd844650d0c41a9c3badc8104609,55,515.6883601113486,active
0x68cf08c4ef8b0462d8c3879f4e26cc371fbddd844650d0c41a9c3badc8104609,56,514.1970933460877,active
0x68cf08c4ef8b0462d8c3879f4e26cc371fbddd844650d0c41a9c3badc8104609,57,514.1274852056481,active
0x68cf08c4ef8b0462d8c3879f4e26cc371fbddd844650d0c41a9c3badc8104609,58,513.2874112775881,active
0x68cf08c4ef8b0462d8c3879f4e26cc371fbddd844650d0c41a9c3badc8104609,59,512.8048284116126,active
0x68cf08c4ef8b0462d8c3879f4e26cc371fbddd844650d0c41a9c3badc8104609,60,512.9674916503325,active
0x68cf08c4ef8b0462d8c3879f4e26cc371fbddd844650d0c41a9c3badc8104609,61,512.5992242370681,active
0x68cf08c4ef8b0462d8c3879f4e26cc371fbddd844650d0c41a9c3badc8104609,62,512.4597822904051,active
0x68cf08c4ef8b0462d8c3879f4e26cc371fbddd844650d0c41a9c3badc8104609,63,513.1137077342269,active
0x68cf08c4ef8b0462d8c3879f4e26cc371fbddd844650d0c41a9c3badc8104609,64,512.856048972925,active
0x68cf08c4ef8b0462d8c3879f4e26cc371fbddd844650d0c41a9c3badc8104609,65,545.3620668863202,active
0x68cf08c4ef8b0462d8c3879f4e26cc371fbddd844650d0c41a9c3badc8104609,66,545.394429025956,active
0x68cf08c4ef8b0462d8c3879f4e26cc371fbddd844650d0c41a9c3badc8104609,67,545.0699255585566,active
0x68cf08c4ef8b0462d8c3879f4e26cc371fbddd844650d0c41a9c3badc8104609,68,544.2912313084281,active
0x68cf08c4ef8b0462d8c3879f4e26cc371fbddd844650d0c41a9c3badc8104609,69,545.4337013054048,active
0x68cf08c4ef8b0462d8c3879f4e26cc371fbddd844650d0c41a9c3badc8104609,70,541.0634332900405,active
0x68cf08c4ef8b0462d8c3879f4e26cc371fbddd844650d0c41a9c3badc8104609,71,540.8502542552611,active
0x68cf08c4ef8b0462d8c3879f4e26cc371fbddd844650d0c41a9c3badc8104609,72,540.8287451044257,active
0x68cf08c4ef8b0462d8c3879f4e26cc371fbddd844650d0c41a9c3badc8104609,73,527.6222941448116,active
0x68cf08c4ef8b0462d8c3879f4e26cc371fbddd844650d0c41a9c3badc8104609,74,512.7066073250068,active
0x68cf08c4ef8b0462d8c3879f4e26cc371fbddd844650d0c41a9c3badc8104609,75,512.6559388643302,active
0x68cf08c4ef8b0462d8c3879f4e26cc371fbddd844650d0c41a9c3badc8104609,76,512.6134520986366,active
0x68cf08c4ef8b0462d8c3879f4e26cc371fbddd844650d0c41a9c3badc8104609,77,513.1128288255411,active
0x68cf08c4ef8b0462d8c3879f4e26cc371fbddd844650d0c41a9c3badc8104609,78,513.0160243297124,active
0x68cf08c4ef8b0462d8c3879f4e26cc371fbddd844650d0c41a9c3badc8104609,79,513.4962915453655,active
0x68cf08c4ef8b0462d8c3879f4e26cc371fbddd844650d0c41a9c3badc8104609,80,532.7610434007747,active
0x68cf08c4ef8b0462d8c3879f4e26cc371fbddd844650d0c41a9c3badc8104609,81,513.5281124011638,active
0x68cf08c4ef8b0462d8c3879f4e26cc371fbddd844650d0c41a9c3badc8104609,82,513.5259441865859,active
0x68cf08c4ef8b0462d8c3879f4e26cc371fbddd844650d0c41a9c3badc8104609,83,515.6600753835049,active
0x68cf08c4ef8b0462d8c3879f4e26cc371fbddd844650d0c41a9c3badc8104609,84,513.7089671544002,active
0x68cf08c4ef8b0462d8c3879f4e26cc371fbddd844650d0c41a9c3badc8104609,85,515.1073724754417,active
0x68cf08c4ef8b0462d8c3879f4e26cc371fbddd844650d0c41a9c3badc8104609,86,517.2556593965422,active
0x68cf08c4ef8b0462d8c3879f4e26cc371fbddd844650d0c41a9c3badc8104609,87,517.4371260069662,active
0x68cf08c4ef8b0462d8c3879f4e26cc371fbddd844650d0c41a9c3badc8104609,88,517.1488009119909,active
0x68cf08c4ef8b0462d8c3879f4e26cc371fbddd844650d0c41a9c3badc8104609,89,517.5019171396932,active
0x68cf08c4ef8b0462d8c3879f4e26cc371fbddd844650d0c41a9c3badc8104609,90,517.3744659049704,active
0x68cf08c4ef8b0462d8c3879f4e26cc371fbddd844650d0c41a9c3badc8104609,91,518.5503060114875,active
0x68cf08c4ef8b0462d8c3879f4e26cc371fbddd844650d0c41a9c3badc8104609,92,520.1082398227903,active
0x68cf08c4ef8b0462d8c3879f4e26cc371fbddd844650d0c41a9c3badc8104609,93,524.5975471682129,active
0x68cf08c4ef8b0462d8c3879f4e26cc371fbddd844650d0c41a9c3badc8104609,94,527.7701821760919,active
0x68cf08c4ef8b0462d8c3879f4e26cc371fbddd844650d0c41a9c3badc8104609,95,527.5943701703839,active
0x68cf08c4ef8b0462d8c3879f4e26cc371fbddd844650d0c41a9c3badc8104609,96,529.0002436482912,active
0x68cf08c4ef8b0462d8c3879f4e26cc371fbddd844650d0c41a9c3badc8104609,97,526.7350925308494,active
0x68cf08c4ef8b0462d8c3879f4e26cc371fbddd844650d0c41a9c3badc8104609,98,530.7145818871796,active
0x68cf08c4ef8b0462d8c3879f4e26cc371fbddd844650d0c41a9c3badc8104609,99,531.1036847893859,active
0x68cf08c4ef8b0462d8c3879f4e26cc371fbddd844650d0c41a9c3badc8104609,100,532.7943436647889,active
0x68cf08c4ef8b0462d8c3879f4e26cc371fbddd844650d0c41a9c3badc8104609,101,534.4422956299882,active
0x68cf08c4ef8b0462d8c3879f4e26cc371fbddd844650d0c41a9c3badc8104609,102,537.1231046118666,active
0x68cf08c4ef8b0462d8c3879f4e26cc371fbddd844650d0c41a9c3badc8104609,103,539.8260884041952,active
0x68cf08c4ef8b0462d8c3879f4e26cc371fbddd844650d0c41a9c3badc8104609,104,538.4223620364229,active
0x68cf08c4ef8b0462d8c3879f4e26cc371fbddd844650d0c41a9c3badc8104609,105,540.2355634031708,active
0x68cf08c4ef8b0462d8c3879f4e26cc371fbddd844650d0c41a9c3badc8104609,106,534.5000313381285,active
0x68cf08c4ef8b0462d8c3879f4e26cc371fbddd844650d0c41a9c3badc8104609,107,520.301111817272,active
0x68cf08c4ef8b0462d8c3879f4e26cc371fbddd844650d0c41a9c3badc8104609,108,516.8321680548207,active
0x68cf08c4ef8b0462d8c3879f4e26cc371fbddd844650d0c41a9c3badc8104609,109,516.8948446296858,active
0x68cf08c4ef8b0462d8c3879f4e26cc371fbddd844650d0c41a9c3badc8104609,110,465.0615162514839,active
0x68cf08c4ef8b0462d8c3879f4e26cc371fbddd844650d0c41a9c3badc8104609,111,464.86942799177405,active
0x68cf08c4ef8b0462d8c3879f4e26cc371fbddd844650d0c41a9c3badc8104609,112,465.308748657603,active
0x68cf08c4ef8b0462d8c3879f4e26cc371fbddd844650d0c41a9c3badc8104609,113,465.2828855277848,active
0x68cf08c4ef8b0462d8c3879f4e26cc371fbddd844650d0c41a9c3badc8104609,114,465.2631483590872,active
0x68cf08c4ef8b0462d8c3879f4e26cc371fbddd844650d0c41a9c3badc8104609,115,465.24991191608825,active
0x68cf08c4ef8b0462d8c3879f4e26cc371fbddd844650d0c41a9c3badc8104609,116,465.0864668616558,active
0x68cf08c4ef8b0462d8c3879f4e26cc371fbddd844650d0c41a9c3badc8104609,117,465.03395142146775,active
0x68cf08c4ef8b0462d8c3879f4e26cc371fbddd844650d0c41a9c3badc8104609,118,464.43767842487495,active
0x68cf08c4ef8b0462d8c3879f4e26cc371fbddd844650d0c41a9c3badc8104609,119,464.1904414955619,active
0x68cf08c4ef8b0462d8c3879f4e26cc371fbddd844650d0c41a9c3badc8104609,120,464.0959387146878,active
0x68cf08c4ef8b0462d8c3879f4e26cc371fbddd844650d0c41a9c3badc8104609,121,463.8072650595026,active
0x68cf08c4ef8b0462d8c3879f4e26cc371fbddd844650d0c41a9c3badc8104609,122,463.9102075304398,active
0x68cf08c4ef8b0462d8c3879f4e26cc371fbddd844650d0c41a9c3badc8104609,123,463.80930698786483,active
0x68cf08c4ef8b0462d8c3879f4e26cc371fbddd844650d0c41a9c3badc8104609,124,463.82791156917597,active
0x68cf08c4ef8b0462d8c3879f4e26cc371fbddd844650d0c41a9c3badc8104609,125,463.77748510344554,active
0x68cf08c4ef8b0462d8c3879f4e26cc371fbddd844650d0c41a9c3badc8104609,126,463.8231170476689,active
0x68cf08c4ef8b0462d8c3879f4e26cc371fbddd844650d0c41a9c3badc8104609,127,464.8001739294987,active
0x68cf08c4ef8b0462d8c3879f4e26cc371fbddd844650d0c41a9c3badc8104609,128,464.65411307186656,active
0x68cf08c4ef8b0462d8c3879f4e26cc371fbddd844650d0c41a9c3badc8104609,129,464.61330886940203,active
0x68cf08c4ef8b0462d8c3879f4e26cc371fbddd844650d0c41a9c3badc8104609,130,464.72680048250845,active
0x68cf08c4ef8b0462d8c3879f4e26cc371fbddd844650d0c41a9c3badc8104609,131,465.9234993862843,active
0x68cf08c4ef8b0462d8c3879f4e26cc371fbddd844650d0c41a9c3badc8104609,132,465.8936954473327,active
0x68cf08c4ef8b0462d8c3879f4e26cc371fbddd844650d0c41a9c3badc8104609,133,464.8943652010292,active
0x68cf08c4ef8b0462d8c3879f4e26cc371fbddd844650d0c41a9c3badc8104609,134,465.351793524809,active
0x68cf08c4ef8b0462d8c3879f4e26cc371fbddd844650d0c41a9c3badc8104609,135,464.72085250887585,active
0x68cf08c4ef8b0462d8c3879f4e26cc371fbddd844650d0c41a9c3badc8104609,136,465.0133243374355,active
0x68cf08c4ef8b0462d8c3879f4e26cc371fbddd844650d0c41a9c3badc8104609,137,465.22230634200037,active
0x68cf08c4ef8b0462d8c3879f4e26cc371fbddd844650d0c41a9c3badc8104609,138,464.88025674761013,active
0x68cf08c4ef8b0462d8c3879f4e26cc371fbddd844650d0c41a9c3badc8104609,139,464.5447153774373,active
0x68cf08c4ef8b0462d8c3879f4e26cc371fbddd844650d0c41a9c3badc8104609,140,464.8941005468105,active
0x68cf08c4ef8b0462d8c3879f4e26cc371fbddd844650d0c41a9c3badc8104609,141,465.23811628108416,active
0x68cf08c4ef8b0462d8c3879f4e26cc371fbddd844650d0c41a9c3badc8104609,142,465.43398255238344,active
0x68cf08c4ef8b0462d8c3879f4e26cc371fbddd844650d0c41a9c3badc8104609,143,465.50467303971965,active
0x68cf08c4ef8b0462d8c3879f4e26cc371fbddd844650d0c41a9c3badc8104609,144,465.8448943224694,active
0x68cf08c4ef8b0462d8c3879f4e26cc371fbddd844650d0c41a9c3badc8104609,145,465.780579923099,active
0x68cf08c4ef8b0462d8c3879f4e26cc371fbddd844650d0c41a9c3badc8104609,146,466.1691006447361,active
0x68cf08c4ef8b0462d8c3879f4e26cc371fbddd844650d0c41a9c3badc8104609,147,466.5631031473123,active
0x68cf08c4ef8b0462d8c3879f4e26cc371fbddd844650d0c41a9c3badc8104609,148,467.20623663214377,active
0x68cf08c4ef8b0462d8c3879f4e26cc371fbddd844650d0c41a9c3badc8104609,149,470.26860436770005,active
0x68cf08c4ef8b0462d8c3879f4e26cc371fbddd844650d0c41a9c3badc8104609,150,470.1938354578627,active
0x68cf08c4ef8b0462d8c3879f4e26cc371fbddd844650d0c41a9c3badc8104609,151,470.21729590962684,active
0x68cf08c4ef8b0462d8c3879f4e26cc371fbddd844650d0c41a9c3badc8104609,152,470.246619112044,active
0x68cf08c4ef8b0462d8c3879f4e26cc371fbddd844650d0c41a9c3badc8104609,153,469.91298706431144,active
0x68cf08c4ef8b0462d8c3879f4e26cc371fbddd844650d0c41a9c3badc8104609,154,470.39770423219704,active
0x68cf08c4ef8b0462d8c3879f4e26cc371fbddd844650d0c41a9c3badc8104609,155,470.3540493044733,active
0x68cf08c4ef8b0462d8c3879f4e26cc371fbddd844650d0c41a9c3badc8104609,156,469.90491277841505,active
0x68cf08c4ef8b0462d8c3879f4e26cc371fbddd844650d0c41a9c3badc8104609,157,469.9419568005707,active
0x68cf08c4ef8b0462d8c3879f4e26cc371fbddd844650d0c41a9c3badc8104609,158,469.9188154180661,active
0x68cf08c4ef8b0462d8c3879f4e26cc371fbddd844650d0c41a9c3badc8104609,159,470.0031983215029,active
0x68cf08c4ef8b0462d8c3879f4e26cc371fbddd844650d0c41a9c3badc8104609,160,455.6242783262992,active
0x68cf08c4ef8b0462d8c3879f4e26cc371fbddd844650d0c41a9c3badc8104609,161,455.1129120957339,active
0x68cf08c4ef8b0462d8c3879f4e26cc371fbddd844650d0c41a9c3badc8104609,162,456.7800898646143,active
0x68cf08c4ef8b0462d8c3879f4e26cc371fbddd844650d0c41a9c3badc8104609,163,456.82231974422393,active
0x68cf08c4ef8b0462d8c3879f4e26cc371fbddd844650d0c41a9c3badc8104609,164,456.8896986677049,active
0x68cf08c4ef8b0462d8c3879f4e26cc371fbddd844650d0c41a9c3badc8104609,165,456.71842443190513,active
0x68cf08c4ef8b0462d8c3879f4e26cc371fbddd844650d0c41a9c3badc8104609,166,456.84078548348947,active
0x68cf08c4ef8b0462d8c3879f4e26cc371fbddd844650d0c41a9c3badc8104609,167,428.8752428317689,active
0x68cf08c4ef8b0462d8c3879f4e26cc371fbddd844650d0c41a9c3badc8104609,168,430.40995097340823,active
0x68cf08c4ef8b0462d8c3879f4e26cc371fbddd844650d0c41a9c3badc8104609,169,431.38470609305017,active
0x68cf08c4ef8b0462d8c3879f4e26cc371fbddd844650d0c41a9c3badc8104609,170,431.86614277402185,active
0x68cf08c4ef8b0462d8c3879f4e26cc371fbddd844650d0c41a9c3badc8104609,171,431.31142731449137,active
0x68cf08c4ef8b0462d8c3879f4e26cc371fbddd844650d0c41a9c3badc8104609,172,425.0762706745956,active
0x68cf08c4ef8b0462d8c3879f4e26cc371fbddd844650d0c41a9c3badc8104609,173,424.99159952999696,active
0x68cf08c4ef8b0462d8c3879f4e26cc371fbddd844650d0c41a9c3badc8104609,174,424.8606954554355,active
0x68cf08c4ef8b0462d8c3879f4e26cc371fbddd844650d0c41a9c3badc8104609,175,425.1445664569893,active
0x68cf08c4ef8b0462d8c3879f4e26cc371fbddd844650d0c41a9c3badc8104609,176,425.6066324058619,active
0x68cf08c4ef8b0462d8c3879f4e26cc371fbddd844650d0c41a9c3badc8104609,177,425.8826042747021,active
0x68cf08c4ef8b0462d8c3879f4e26cc371fbddd844650d0c41a9c3badc8104609,178,425.8969004153058,active
0x68cf08c4ef8b0462d8c3879f4e26cc371fbddd844650d0c41a9c3badc8104609,179,425.826197627457,active
0x68cf08c4ef8b0462d8c3879f4e26cc371fbddd844650d0c41a9c3badc8104609,180,425.75529845665443,active
0x68cf08c4ef8b0462d8c3879f4e26cc371fbddd844650d0c41a9c3badc8104609,181,425.79301756256876,active
0x68cf08c4ef8b0462d8c3879f4e26cc371fbddd844650d0c41a9c3badc8104609,182,425.8476505914643,active
0x68cf08c4ef8b0462d8c3879f4e26cc371fbddd844650d0c41a9c3badc8104609,183,426.01020032341285,active
0x68cf08c4ef8b0462d8c3879f4e26cc371fbddd844650d0c41a9c3badc8104609,184,426.8422703322022,active
0x68cf08c4ef8b0462d8c3879f4e26cc371fbddd844650d0c41a9c3badc8104609,185,426.2873344470932,active
0x68cf08c4ef8b0462d8c3879f4e26cc371fbddd844650d0c41a9c3badc8104609,186,426.1570962946812,active
0x68cf08c4ef8b0462d8c3879f4e26cc371fbddd844650d0c41a9c3badc8104609,187,426.3499827700321,active
0x68cf08c4ef8b0462d8c3879f4e26cc371fbddd844650d0c41a9c3badc8104609,188,426.6879381651882,active
0x68cf08c4ef8b0462d8c3879f4e26cc371fbddd844650d0c41a9c3badc8104609,189,425.51566998522037,active
0x68cf08c4ef8b0462d8c3879f4e26cc371fbddd844650d0c41a9c3badc8104609,190,426.0361894925776,active
0x68cf08c4ef8b0462d8c3879f4e26cc371fbddd844650d0c41a9c3badc8104609,191,426.93775462803274,active
0x68cf08c4ef8b0462d8c3879f4e26cc371fbddd844650d0c41a9c3badc8104609,192,425.93379760826525,active
0x68cf08c4ef8b0462d8c3879f4e26cc371fbddd844650d0c41a9c3badc8104609,193,425.9110031168078,active
0x68cf08c4ef8b0462d8c3879f4e26cc371fbddd844650d0c41a9c3badc8104609,194,425.90678285515077,active
0x68cf08c4ef8b0462d8c3879f4e26cc371fbddd844650d0c41a9c3badc8104609,195,425.891555753326,active
0x68cf08c4ef8b0462d8c3879f4e26cc371fbddd844650d0c41a9c3badc8104609,196,425.9192932889456,active
0x68cf08c4ef8b0462d8c3879f4e26cc371fbddd844650d0c41a9c3badc8104609,197,425.0619282332778,active
0x68cf08c4ef8b0462d8c3879f4e26cc371fbddd844650d0c41a9c3badc8104609,198,424.3874449697479,active
0x68cf08c4ef8b0462d8c3879f4e26cc371fbddd844650d0c41a9c3badc8104609,199,425.14376144367293,active
0x68cf08c4ef8b0462d8c3879f4e26cc371fbddd844650d0c41a9c3badc8104609,200,383.75931807829676,active
0x68cf08c4ef8b0462d8c3879f4e26cc371fbddd844650d0c41a9c3badc8104609,201,383.3521869407707,active
0x68cf08c4ef8b0462d8c3879f4e26cc371fbddd844650d0c41a9c3badc8104609,202,383.3853185622346,active
0x68cf08c4ef8b0462d8c3879f4e26cc371fbddd844650d0c41a9c3badc8104609,203,385.0993822244473,active
0x68cf08c4ef8b0462d8c3879f4e26cc371fbddd844650d0c41a9c3badc8104609,204,385.41055154990596,active
0x68cf08c4ef8b0462d8c3879f4e26cc371fbddd844650d0c41a9c3badc8104609,205,386.014418327515,active
0x68cf08c4ef8b0462d8c3879f4e26cc371fbddd844650d0c41a9c3badc8104609,206,385.97939790992916,active
0x68cf08c4ef8b0462d8c3879f4e26cc371fbddd844650d0c41a9c3badc8104609,207,385.79720911063583,active
0x68cf08c4ef8b0462d8c3879f4e26cc371fbddd844650d0c41a9c3badc8104609,208,385.96470660354123,active
0x68cf08c4ef8b0462d8c3879f4e26cc371fbddd844650d0c41a9c3badc8104609,209,385.8408090151159,active
0x68cf08c4ef8b0462d8c3879f4e26cc371fbddd844650d0c41a9c3badc8104609,210,385.28504200401034,active
0x68cf08c4ef8b0462d8c3879f4e26cc371fbddd844650d0c41a9c3badc8104609,211,386.1538598407383,active
0x68cf08c4ef8b0462d8c3879f4e26cc371fbddd844650d0c41a9c3badc8104609,212,385.4003915714662,active
0x68cf08c4ef8b0462d8c3879f4e26cc371fbddd844650d0c41a9c3badc8104609,213,385.4845918517851,active
0x68cf08c4ef8b0462d8c3879f4e26cc371fbddd844650d0c41a9c3badc8104609,214,385.36129614620364,active
0x68cf08c4ef8b0462d8c3879f4e26cc371fbddd844650d0c41a9c3badc8104609,215,385.6257383048362,active
0x68cf08c4ef8b0462d8c3879f4e26cc371fbddd844650d0c41a9c3badc8104609,216,385.2346960841195,active
0x68cf08c4ef8b0462d8c3879f4e26cc371fbddd844650d0c41a9c3badc8104609,217,385.1964073308065,active
0x68cf08c4ef8b0462d8c3879f4e26cc371fbddd844650d0c41a9c3badc8104609,218,385.40320625076487,active
0x68cf08c4ef8b0462d8c3879f4e26cc371fbddd844650d0c41a9c3badc8104609,219,385.00246379179913,active
0x68cf08c4ef8b0462d8c3879f4e26cc371fbddd844650d0c41a9c3badc8104609,220,385.51889147441045,active
0x68cf08c4ef8b0462d8c3879f4e26cc371fbddd844650d0c41a9c3badc8104609,221,385.9974509606715,active
0x68cf08c4ef8b0462d8c3879f4e26cc371fbddd844650d0c41a9c3badc8104609,222,384.0273494998621,active
0x68cf08c4ef8b0462d8c3879f4e26cc371fbddd844650d0c41a9c3badc8104609,223,384.033290939944,active
0x68cf08c4ef8b0462d8c3879f4e26cc371fbddd844650d0c41a9c3badc8104609,224,385.56903479063516,active
0x68cf08c4ef8b0462d8c3879f4e26cc371fbddd844650d0c41a9c3badc8104609,225,385.48582530304554,active
0x68cf08c4ef8b0462d8c3879f4e26cc371fbddd844650d0c41a9c3badc8104609,226,385.55267431104926,active
0x68cf08c4ef8b0462d8c3879f4e26cc371fbddd844650d0c41a9c3badc8104609,227,385.61032837095775,active
0x68cf08c4ef8b0462d8c3879f4e26cc371fbddd844650d0c41a9c3badc8104609,228,385.54272019079434,active
0x68cf08c4ef8b0462d8c3879f4e26cc371fbddd844650d0c41a9c3badc8104609,229,385.89687389351434,active
0x68cf08c4ef8b0462d8c3879f4e26cc371fbddd844650d0c41a9c3badc8104609,230,385.6249106385788,active
0x68cf08c4ef8b0462d8c3879f4e26cc371fbddd844650d0c41a9c3badc8104609,231,386.3624550901659,active
0x68cf08c4ef8b0462d8c3879f4e26cc371fbddd844650d0c41a9c3badc8104609,232,386.54305168559944,active
0x68cf08c4ef8b0462d8c3879f4e26cc371fbddd844650d0c41a9c3badc8104609,233,386.6100669462776,active
0x68cf08c4ef8b0462d8c3879f4e26cc371fbddd844650d0c41a9c3badc8104609,234,386.50301233962335,active
0x68cf08c4ef8b0462d8c3879f4e26cc371fbddd844650d0c41a9c3badc8104609,235,386.3467076704815,active
0x68cf08c4ef8b0462d8c3879f4e26cc371fbddd844650d0c41a9c3badc8104609,236,386.33008098392224,active
0x68cf08c4ef8b0462d8c3879f4e26cc371fbddd844650d0c41a9c3badc8104609,237,386.46854853695856,active
0x68cf08c4ef8b0462d8c3879f4e26cc371fbddd844650d0c41a9c3badc8104609,238,386.4134767033914,active
0x68cf08c4ef8b0462d8c3879f4e26cc371fbddd844650d0c41a9c3badc8104609,239,386.6691341409856,active
0x68cf08c4ef8b0462d8c3879f4e26cc371fbddd844650d0c41a9c3badc8104609,240,387.7262218928477,active
0x68cf08c4ef8b0462d8c3879f4e26cc371fbddd844650d0c41a9c3badc8104609,241,387.64062296516346,active
0x68cf08c4ef8b0462d8c3879f4e26cc371fbddd844650d0c41a9c3badc8104609,242,387.64268971507755,active
0x68cf08c4ef8b0462d8c3879f4e26cc371fbddd844650d0c41a9c3badc8104609,243,387.67974417577875,active
0x68cf08c4ef8b0462d8c3879f4e26cc371fbddd844650d0c41a9c3badc8104609,244,387.97694998249284,active
0x68cf08c4ef8b0462d8c3879f4e26cc371fbddd844650d0c41a9c3badc8104609,245,389.2097052154546,active
0x68cf08c4ef8b0462d8c3879f4e26cc371fbddd844650d0c41a9c3badc8104609,246,388.1687939047049,active
0x68cf08c4ef8b0462d8c3879f4e26cc371fbddd844650d0c41a9c3badc8104609,247,390.8775896379134,active
0x68cf08c4ef8b0462d8c3879f4e26cc371fbddd844650d0c41a9c3badc8104609,248,389.506688713064,active
0x68cf08c4ef8b0462d8c3879f4e26cc371fbddd844650d0c41a9c3badc8104609,249,388.4841724293472,active
0x68cf08c4ef8b0462d8c3879f4e26cc371fbddd844650d0c41a9c3badc8104609,250,388.6343659765275,active
0x68cf08c4ef8b0462d8c3879f4e26cc371fbddd844650d0c41a9c3badc8104609,251,388.46226522729523,active
0x68cf08c4ef8b0462d8c3879f4e26cc371fbddd844650d0c41a9c3badc8104609,252,388.1263184318697,active
0x68cf08c4ef8b0462d8c3879f4e26cc371fbddd844650d0c41a9c3badc8104609,253,388.27120561031967,active
0x68cf08c4ef8b0462d8c3879f4e26cc371fbddd844650d0c41a9c3badc8104609,254,392.1417811219774,active
0x68cf08c4ef8b0462d8c3879f4e26cc371fbddd844650d0c41a9c3badc8104609,255,388.24976306477424,active
0x68cf08c4ef8b0462d8c3879f4e26cc371fbddd844650d0c41a9c3badc8104609,256,388.24565690497883,active
0x68cf08c4ef8b0462d8c3879f4e26cc371fbddd844650d0c41a9c3badc8104609,257,388.27815141603986,active
0x68cf08c4ef8b0462d8c3879f4e26cc371fbddd844650d0c41a9c3badc8104609,258,388.5091099907105,active
0x68cf08c4ef8b0462d8c3879f4e26cc371fbddd844650d0c41a9c3badc8104609,259,388.14061214127247,active
0x68cf08c4ef8b0462d8c3879f4e26cc371fbddd844650d0c41a9c3badc8104609,260,388.10644284617894,active
0x68cf08c4ef8b0462d8c3879f4e26cc371fbddd844650d0c41a9c3badc8104609,261,388.08237903589736,active
0x68cf08c4ef8b0462d8c3879f4e26cc371fbddd844650d0c41a9c3badc8104609,262,388.2618401917156,active
0x68cf08c4ef8b0462d8c3879f4e26cc371fbddd844650d0c41a9c3badc8104609,263,388.2157076199896,active
0x68cf08c4ef8b0462d8c3879f4e26cc371fbddd844650d0c41a9c3badc8104609,264,388.26247206869533,active
0x68cf08c4ef8b0462d8c3879f4e26cc371fbddd844650d0c41a9c3badc8104609,265,391.4280053701744,active
0x68cf08c4ef8b0462d8c3879f4e26cc371fbddd844650d0c41a9c3badc8104609,266,386.76398346118407,active
0x68cf08c4ef8b0462d8c3879f4e26cc371fbddd844650d0c41a9c3badc8104609,267,386.18568259701834,active
0x68cf08c4ef8b0462d8c3879f4e26cc371fbddd844650d0c41a9c3badc8104609,268,386.39592299899147,active
0x68cf08c4ef8b0462d8c3879f4e26cc371fbddd844650d0c41a9c3badc8104609,269,386.2468854991318,active
0x68cf08c4ef8b0462d8c3879f4e26cc371fbddd844650d0c41a9c3badc8104609,270,386.4766974935198,active
0x68cf08c4ef8b0462d8c3879f4e26cc371fbddd844650d0c41a9c3badc8104609,271,384.88192408552237,active
0x68cf08c4ef8b0462d8c3879f4e26cc371fbddd844650d0c41a9c3badc8104609,272,384.7322222372604,active
0x68cf08c4ef8b0462d8c3879f4e26cc371fbddd844650d0c41a9c3badc8104609,273,384.6305226474443,active
0x68cf08c4ef8b0462d8c3879f4e26cc371fbddd844650d0c41a9c3badc8104609,274,384.66651834775706,active
0x68cf08c4ef8b0462d8c3879f4e26cc371fbddd844650d0c41a9c3badc8104609,275,385.1020251770155,active
0x68cf08c4ef8b0462d8c3879f4e26cc371fbddd844650d0c41a9c3badc8104609,276,385.5852958354259,active
0x68cf08c4ef8b0462d8c3879f4e26cc371fbddd844650d0c41a9c3badc8104609,277,385.6817844829264,active
0x68cf08c4ef8b0462d8c3879f4e26cc371fbddd844650d0c41a9c3badc8104609,278,385.0054680302411,active
0x68cf08c4ef8b0462d8c3879f4e26cc371fbddd844650d0c41a9c3badc8104609,279,385.2052239795934,active
0x68cf08c4ef8b0462d8c3879f4e26cc371fbddd844650d0c41a9c3badc8104609,280,385.22378117309887,active
0x68cf08c4ef8b0462d8c3879f4e26cc371fbddd844650d0c41a9c3badc8104609,281,385.3449167098974,active
0x68cf08c4ef8b0462d8c3879f4e26cc371fbddd844650d0c41a9c3badc8104609,282,385.14122601377284,active
0x68cf08c4ef8b0462d8c3879f4e26cc371fbddd844650d0c41a9c3badc8104609,283,385.07561680575174,active
0x68cf08c4ef8b0462d8c3879f4e26cc371fbddd844650d0c41a9c3badc8104609,284,385.1621289757758,active
0x68cf08c4ef8b0462d8c3879f4e26cc371fbddd844650d0c41a9c3badc8104609,285,384.94439211130975,active
0x68cf08c4ef8b0462d8c3879f4e26cc371fbddd844650d0c41a9c3badc8104609,286,384.80758543598677,active
0x68cf08c4ef8b0462d8c3879f4e26cc371fbddd844650d0c41a9c3badc8104609,287,384.2680830624535,active
0x68cf08c4ef8b0462d8c3879f4e26cc371fbddd844650d0c41a9c3badc8104609,288,384.4610979931024,active
0x68cf08c4ef8b0462d8c3879f4e26cc371fbddd844650d0c41a9c3badc8104609,289,384.20988542965677,active
0x68cf08c4ef8b0462d8c3879f4e26cc371fbddd844650d0c41a9c3badc8104609,290,345.80862971214486,active
0x68cf08c4ef8b0462d8c3879f4e26cc371fbddd844650d0c41a9c3badc8104609,291,345.8520644823683,active
0x68cf08c4ef8b0462d8c3879f4e26cc371fbddd844650d0c41a9c3badc8104609,292,345.7540960419368,active
